Lyrics,Song,Artist,Genre,Composition
"Pacto
 
Um isqueiro um cachimbo e um pedra o menino acendeu 
Lá se vai sua inocência a delinqüência agora o dominou 
Amigo eu não acreditei, ao te ver assim 
Você é só mais um dos muitos que morrem em vão 
Pensando ser ladrão, um tiro no coração 
Volta, lembra da nossa infância 
Lembra de deus 
Um pacto sagrado que você e eu, juramos 
Só amar, (só amar) nosso deus (nosso deus) 
Mas o tempo não para menino não pensa amigo 
Que cresceu e se esqueceu de deus 
O pacto foi quebrado 
Eu vi o moleque bem louco ligado 
Um maluco se pa 
Ele já não pensa 
Suas idéia já não constam 
Seus amigos se afastam 
Ele não sorri 
Se os nóias te chamarem não vá 
Resgata, sua vida, sai fora 
Não num caminho triste 
Não vá, não vá 
Que tal se falarmos de deus 
Que não deve ser esquecido 
A verdade o motivo a razão pelo qual estamos vivos 
Não vire não de as costas não baixe a sua cabeça 
Agindo desta forma mostrará sua fraqueza 
O dominado viciado escravo da droga 
Entrou de embalo vacilou pensando que era moda 
Talvez um dia tenha sido, hoje é obseção 
Um maluco viaja naquela overdose 
Até estourar a veia do teu coração 
Procuro a solução, eu quero é sobreviver 
Eu também quero queimar uma guiba cheirar uma coca 
Eu não consigo me conter 
Você se lembra quando me dizia 
Cuida da tua vida, e vê se deixa a minha 
Vida? que vida é essa irmão 
Vida de cão, vira lata caminha sozinho na noite 
Aqui sem dono e na escuridão 
Correndo atrás de pó 
Fugindo docrack pá 
Você se causa a dó mais não quer se tocar 
Que a noite está se acabndo 
E sua vida só começou 
Te ofereceram a morte você abraçou 
Se esqueceu do nome de deus 
Contrariou seus princípios 
Pra você cair no abismo não foi nada difícil 
Se atolou, se afogou no beco sujo do vício 
Endividado até o pescoço não pagou desde o início 
Mistura farinha, maconha, pedrinha 
O estomago entoja seus olhos se afundam 
Com a sua cova 
Volta e lembra da nossa infância 
Lembra de deus 
Um pacto sagrado que você e eu 
Juramos 
Só amar, nosso deus (nosso deus) 
Mas o tempo não para menino só pensa amigo 
Que cresceu e se esqueceu de deus 
O pacto foi quebrado 
Eu vi o moleque bem loko ligado 
Um maluco se pa 
Ele já não pensa 
Suas idéia já não constam 
Seus amigos se afastam 
E não sorri 
Se os nóias te chamarem não vá 
Resgata, sua vida, sai fora 
Não num caminho triste 
Não vá, não vá, não vá 
Não vá, não vá, não vá 
Não vá, não vá, não vá 
Neste caminho não 
Pelo amor de deus 
Não vá, não vá, não vá 
Não vá, não vá, não vá 
Não vá, não vá, não vá 
E ae maluco? 
Nessas hora que queria participar das suas ilusões 
Entrar na sua mente 
E pode te salvar 
Te resgatar pro mundo real novamente 
A sua mãe está tão triste 
Mas tão triste com a sua pessoa 
Que ela prefere morrer 
Ao invés de ver seu filho assim desse jeito 
Para um momento e pensa ta bom? 
Em deus 
Pelo amor de deus


  Essa informação está errada? Nos avise. ",Pacto,Exaltasamba,Pagode,Composição: Expressão Ativa. 
"Pago Pra Ver
 
Se quer fugir do nosso amor 
Não seja tão covarde vai se arrepender 
Mudar as regras da paixão 
Seu coração pode doer
Pago Pra Ver
 
Você que sempre abusou, brincou, usou,ganhou 
Mas não sabe perder 
É hora de assumir o nosso amor
Pago Pra Ver
 
Você que sempre evitou 
Levar alguém a sério pra não se envolver 
Mas por mim se apaixonou, já não consegue esconder 
A nossa relação não é só mais um caso 
Não foi só prazer 
É amor e paixão pra valer 
Pago pra ver 
Passar mais uma noite sem meu corpo pra te amar de novo 
Pago pra ver 
Querer fugir de mim fazer de mim tão pouco 
Pago pra ver 
Depois de tudo que passamos você conseguir me esquecer


  Essa informação está errada? Nos avise. ",Pago Pra Ver,Exaltasamba,Pagode,Composição: André Renato / Riquinho. 
"Palavras de Amigo
 
Thiaguinho- Sou teu amigo e tenho que te alertar cara.
Palavras de Amigo
 
Rodriguinho- Meu..alertar o que véio? O que você vai falar de novo véio?
Palavras de Amigo
 
Thiaguinho- Já te falei mil vezes, mas vou falar de novo... Você está de sacanagem...
Palavras de Amigo
 
Rodriguinho- sai daê!
Palavras de Amigo
 
Thiaguinho- Quantas vezes eu vou ter que te falar que ela não presta?
Palavras de Amigo
 
Rodriguinho- Mas sem ela eu não sou feliz...
Palavras de Amigo
 
Thiaguinho- Tô cansando de tentar te alertar sai fora dessa...
Palavras de Amigo
 
Rodriguinho- Tenho medo de não conseguir.
Palavras de Amigo
 
Thiaguinho- Negrão...inventa qualquer desculpa, mas com essa maluca você não vai ter paz.
Palavras de Amigo
 
Rodriguinho- Negrão... mas eu já tô envolvido, tenho até apelido, tô curtindo demais.
Palavras de Amigo
 
Thiaguinho- Tá curtindo o que? Todo mundo falando da sua vida! Isso é vida?
Palavras de Amigo
 
Rodriguinho- Dane-se você e me respeite ou a gente parte pra briga!
Palavras de Amigo
 
Thiaguinho- São só palavras de amigo, não quero contigo me aborrecer não!
Palavras de Amigo
 
Rodriguinho- Tá com orgulho ferido, pois aquele dia ela não quis você.
Palavras de Amigo
 
Thiaguinho- Então tá! Não queria, mas vou ter que falar, todo mundo já cansou de brincar com aquela que você diz amar!
Palavras de Amigo
 
Rodriguinho- Então tá! Vai ser triste, mas eu vou te entender, porque eu nunca duvidei de você. Deixa quieto dela eu vou me esquecer!


  Essa informação está errada? Nos avise. ",Palavras de Amigo,Exaltasamba,Pagode,Composição: Rodriguinho / Tiaguinho. 
"Para de Falar Tanta Besteira
 
Quando saio pra me divertir 
Logo vem voce querendo discutir 
Eu não posso olhar pra nenhum lugar 
Que voce acha que quero te provocar 
O que a gente tinha ja passou 
Deu o que era pra dar 
Só voce não notou 
Minha vida tem que continuar 
A sua também então sai pra lá
Para de Falar Tanta Besteira
 
Minha paciência tem limites, tem 
Meu pé não é lugar de ninguem
Para de Falar Tanta Besteira
 
Para de falar tanta besteira 
Porque eu não to de brincadeira 
Me segue de segunda a sexta feira 
Você ta muito baladeira (2x)
Para de Falar Tanta Besteira
 
Sempre reclamou de mim 
Fez questão de difamar 
Fez minha fama por aí 
Agora vou aproveitar 
Foi você quem quis assim 
Não adianta reclamar 
Quando for falar de mim...
Para de Falar Tanta Besteira
 
Para de falar tanta besteira 
Porque eu não to de brincadeira 
Me segue de segunda a sexta feira 
Você ta muito baladeira(2x)


  ",Para de Falar Tanta Besteira,Exaltasamba,Pagode,Sabe de quem é a composição? Envie pra gente.
"Parado No Tempo
 
Quando essa mágoa passar 
Você vai me procurar 
Sentindo um grande desejo  
De me encontrar 
Parado no tempo 
E a todo momento 
O seu pensamento é querer voltar 
Nosso juramento não pode virar 
Promessas ao vento 
Bailando no ar 
Te vejo lá no firmamento  
Viajo no meu sentimento 
E viro uma estrela a te iluminar 
Mas não volta enquanto 
No seu peito existir revolta 
Quem prende um carinho então logo solta 
Acaba condenado a solidão 
Meu bem volta 
Sabendo que seu ninho 
É no meu coração 
Você já me conhece 
Vem me dar perdão 
Porque eu sinto a falta 
Da nossa paixão.


  Essa informação está errada? Nos avise. ",Parado No Tempo,Exaltasamba,Pagode,Composição: Acyr Marques / Geraldão. 
"É Para Ficar
 
Lá lá lá ia lá ia 
Lá lá lá ia lá ia 
Lá lá lá ia lá ia
É Para Ficar
 
Amor, não faz assim comigo não 
Ah meu amor, amor, amor, amor, amor 
Voltei pra te pedir perdão 
Eu vacilei 
Vacilei, vacilei, vacilei, vacilei 
Quantas vezes vi você chorar 
Também chorei, chorei, chorei, chorei, chorei 
Agora resolvi contar 
Que dessa vez é pra ficar 
Que dessa vez é pra ficar
É Para Ficar
 
Lá lá lá ia lá ia lá ia 
Lá lá lá ia lá ia
É Para Ficar
 
Amor, amor, não faz assim comigo não 
Ah meu amor, amor, amor, amor, amor 
Voltei pra te pedir perdão 
Eu vacilei 
Vacilei, vacilei, vacilei, vacilei 
Quantas vezes vi você chorar 
Também chorei, chorei, chorei, chorei, chorei 
Agora resolvi contar 
Que dessa vez é pra ficar 
Que dessa vez é pra ficar
É Para Ficar
 
Lá lá lá ia lá ia lá ia 
Lá lá lá ia lá ia


  Essa informação está errada? Nos avise. ",É Para Ficar,Exaltasamba,Pagode,Composição: Caetano / Leandro Fab / Fernando Margarça. 
"Pegou Na Veia
 
Olha o cavaco chegou 
Na pegada do tantã 
É nesse samba danado 
Que eu fico até amanhã de manhã
Pegou Na Veia
 
A galera agitando geral 
Ajudando na palma da mão 
O pagode ficou mais legal 
Quando o surdo chegou com a marcação
Pegou Na Veia
 
Hoje vou me acabar com o samba 
O pagode pegou na veia 
Não importa se é madrugada 
Ou se é noite de lua cheia 
Venha junto com o nosso samba 
É gostosa essa brincadeira 
Jogue fora toda tristeza 
E caia na zoeira
Pegou Na Veia
 
Vem já, vem cá, vem ver pra crer 
É só chegar, pra gente mostrar pra você
Pegou Na Veia
 
Cavaco, tantã, banjo e violão 
Pra exaltar nosso samba 
Também tem pandeiro e repique de mão 
Pra exaltar nosso samba
Pegou Na Veia
 
A galera com a gente cantando o refrão 
Pra exaltar nosso samba 
Venha junto com a gente na palma da mão 
Que o samba vai ficar bom 
Firma na palma da mão o refrão 
Firma na palma da mão 
Firma na palma da mão 
Cantando e firmando o refrão


  Essa informação está errada? Nos avise. ",Pegou Na Veia,Exaltasamba,Pagode,Composição: Chrigor / Nico / Pezinho. 
"Picada de Abelha
 
Meu amor quando quer 
Me transforma num rei 
Mas se você se aborrece 
Me vê como um fora-da-lei 
Fica brigando por nada 
Desfaz das coisa que eu dei 
E eu fico me perguntando 
Onde foi que eu errei?
Picada de Abelha
 
Fala comigo com a voz malcriada 
Esquece de vez que nós dois somos um 
Deita comigo de cara amarrada 
E deixa seu corpo e o meu em jejum 
E aí amanhece calada 
E eu como um fora-da-lei 
Um homem sem sonhos, sem nada 
Que um dia foi rei
Picada de Abelha
 
Peço amor e você franze as sobrancelhas 
Peço um sorriso e ai você chora 
Tô pedindo mel vêm picada de abelha 
Ou você me ama ou eu vou me embora
Picada de Abelha
 
Você tá deixando a sua metade 
Ir como um cigano ao sabor do vento 
O meu corpo queima em febre de saudade 
Mais um dia assim amor eu não aguento


  Essa informação está errada? Nos avise. ",Picada de Abelha,Exaltasamba,Pagode,Composição: Altay Veloso. 
"Pintou Sujeira
 
Melou, babou 
O nosso caso de amor 
Quem dedurou 
Nosso barato atrasou
Pintou Sujeira
 
A nossa transa, vazou 
A nossa transa, vazou
Pintou Sujeira
 
Tá todo mundo sabendo  
Que eu estou com você 
Eu te falei  
Que ninguém podia saber 
Agora pintou sujeira 
Não posso me complicar 
Vamos dar um tempo 
Pra poeira abaixar
Pintou Sujeira
 
Tenha paciência meu bem 
Não me leve a mal 
Deixa clarear pra ficar legal
Pintou Sujeira
 
Vamos ficar devagarinho 
Sem dar mancada, no sapatinho 
Não force a barra 
Eu te prometo 
Que vou chegar juntinho


  Essa informação está errada? Nos avise. ",Pintou Sujeira,Exaltasamba,Pagode,Composição: Anderson Leonardo / Pedrinho Da Flor. 
"Pé Na Porta
 
Era só momento noite de aventura 
Golpe de desejo e a gente acabou se envolvendo 
Tanta coisa em risco nossos compromissos 
Mas o amor chegou com o pé na porta 
Lembrando tantas coisas 
Sentia falta de estar com você 
Eu já perdi as contas 
Quantas vezes fiz amor tentando te esquecer 
Sabe aquela vontade quando te invade 
Tira o controle vira obsessão 
Quando o medo foge 
a gente tem vontade de jogar tudo pro alto pelo coração 
Me diz que também se sente assim 
Que arriscaria tudo pra viver por mim


  Essa informação está errada? Nos avise. ",Pé Na Porta,Exaltasamba,Pagode,Composição: Edgar do Cavaco / Matheus Santos / Vitinho. 
"Por  Ti
 
Parece que a paixao tomou conta mim 
Ate do meu coraçao 
O amor machuca 
E eu nas ruas 
Abandonado um coitado 
Apaixonado 
Por alguem 
Que não quer o meu bem 
Um sonhador 
Pensando 
Chorando por voce 
[refrao
eu faço loucura 
Tudo é aventura 
A cura 
Da minha dor 
Meu amor 
Por ti 
Consigo ser o melhor amigo 
Que voce não consegue imaginar 
Contigo 
Tudo posso enfrentar 
Ate te ajudar 
Nas coisas mais dificeis 
E incriveis so quero te amar.
Por  Ti
 
[
Por  Ti
 
[<br/>, Eu te amo 
É a verdade 
Sou tua tranquilidade 
E a felicidade 
Que já encontrei
Por  Ti
 
[
Por  Ti
 
Ja sei o que vai dizer 
Que não me quer 
Que eu tenho outra mulher 
Mais te quero 
Sei que não me ama 
Mais vou fazer tudo 
Ate para o mundo
Por  Ti
 
[<br/>, Por ti


  Essa informação está errada? Nos avise. ",Por  Ti,Exaltasamba,Pagode,Composição: Mateus Goulart Vasques. 
"Por Tão Pouco
 
Por tão pouco 
Eu perdi você 
Que sufoco 
Foi de enlouquecer 
Tanta paixão 
Que ficou pra trás 
Olha, não dá mais pra viver assim
Por Tão Pouco
 
Tá doendo em mim 
Tanta solidão 
Te jurei meu amor, pra que? 
Se agora eu não tenho você 
Onde anda o seu coração?
Por Tão Pouco
 
Hoje eu sonhei com você 
Saudade me faz sofrer 
Tantas lembranças no ar 
Me fazem chorar 
Me fazem querer 
De novo encontrar você
Por Tão Pouco
 
Hoje eu sonhei com você 
Saudade me faz sofrer 
Tantas lembranças no ar 
Me fazem chorar 
Me fazem querer 
De novo encontrar você
Por Tão Pouco
 
Por tão pouco 
Eu perdi você 
Que sufoco 
Foi de enlouquecer 
Tanta paixão 
Que ficou pra trás 
Olha, não dá mais pra viver assim
Por Tão Pouco
 
Tá doendo em mim 
Tanta solidão 
Te jurei meu amor, pra que? 
Se agora eu não tenho você 
Onde anda o seu coração?
Por Tão Pouco
 
Hoje eu sonhei com você 
Saudade me faz sofrer (me faz sofrer) 
Tantas lembranças no ar 
Me fazem chorar 
Me fazem querer 
De novo encontrar você
Por Tão Pouco
 
Hoje eu sonhei com você 
Saudade me faz sofrer 
Tantas lembranças no ar 
Me fazem chorar 
Me fazem querer 
De novo encontrar você
Por Tão Pouco
 
Hoje eu sonhei com você 
Saudade me faz sofrer 
Tantas lembranças no ar 
Me fazem chorar 
Me fazem querer 
De novo encontrar você


  Essa informação está errada? Nos avise. ",Por Tão Pouco,Exaltasamba,Pagode,Composição: Ricardo Soares Nunes / Márcio Lima. 
"Por Um Amor Tão Lindo
 
Eu já lhe dei, tantos motivos 
Pra poder te convencer 
Em mim esta toda a ternura e afeto por você 
Eu sou um ser apaixonado 
Falo isso com prazer 
Sua presença me transforma 
É a luz do meu viver
Por Um Amor Tão Lindo
 
Vem faz de mim seu ideal 
É bom amar, se entregar aos seus instintos 
É bom sentir todo prazer estar contigo enfim 
Não dilacera assim um amor tão lindo, tão lindo


  Essa informação está errada? Nos avise. ",Por Um Amor Tão Lindo,Exaltasamba,Pagode,Composição: Lula / Luis Pintor / Jairo. 
"Pout-Pourri Din Din Din/O Samba Não Pode Parar/ Clareou
 
Faltava um pandeiro no samba, 
Agora o pandeiro chegou 
Em casa que é casa de bamba 
Pandeiro não pode faltar 
Mandaram buscar um cavaco, 
Cavaco no samba entrou 
Juntou um cavaco e um pandeiro, 
Veja só como o samba ficou
Pout-Pourri Din Din Din/O Samba Não Pode Parar/ Clareou
 
Din din din, din din din, 
Veja só como o samba ficou 
Din din din, din din din, 
Veja só como o samba ficou 
Din din din, din din din, 
Veja só como o samba ficou 
Cavaco e pandeiro juntou, 
Veja só como o samba ficou 
Cavaco e pandeiro juntou, 
Veja só como o samba ficou
Pout-Pourri Din Din Din/O Samba Não Pode Parar/ Clareou
 
Devagarinho começou a embalar, 
Embalando o miudinho 
Veio o samba pra esquentar
Pout-Pourri Din Din Din/O Samba Não Pode Parar/ Clareou
 
Quando chegou o tantã e o pandeiro 
O samba ficou maneiro 
E o povo a cantar
Pout-Pourri Din Din Din/O Samba Não Pode Parar/ Clareou
 
Do som do cavaco e pandeiro chegou, 
Quem estava na roda cantou 
Din din din, din din din, 
Veja só como o samba ficou 
Din din din, din din din, 
Veja só como o samba ficou
Pout-Pourri Din Din Din/O Samba Não Pode Parar/ Clareou
 
Din din din, din din din, 
Veja só como o samba ficou 
Din din din, din din din, 
Veja só como o samba ficou 
Din din din, din din din, 
Veja só como o samba ficou 
Cavaco e pandeiro juntou, 
Veja só como o samba ficou 
Cavaco e pandeiro juntou, 
Veja só como o samba ficou 
Cavaco e pandeiro juntou, 
Veja só como o samba ficou
Pout-Pourri Din Din Din/O Samba Não Pode Parar/ Clareou
 
Quero ouvir, vamos cantar 
O samba não pode parar, 
O samba não pode parar 
Na palma da mão, 
Cantando o refrão 
O samba não pode parar, 
O samba não pode parar
Pout-Pourri Din Din Din/O Samba Não Pode Parar/ Clareou
 
O samba não pode parar 
Porque a favela desceu pra ver 
Quem duvidava não tem mais o que dizer 
Ao som do tantã e o pandeiro 
Cavaco chora até o dia amanhecer
Pout-Pourri Din Din Din/O Samba Não Pode Parar/ Clareou
 
Quero ouvir, vamos cantar 
O samba não pode parar, 
O samba não pode parar 
Na palma da mão, 
Cantando o refrão 
O samba não pode parar, 
O samba não pode parar 
O samba não pode parar, 
Osamba não pode parar 
O samba não pode parar, 
O samba não pode parar
Pout-Pourri Din Din Din/O Samba Não Pode Parar/ Clareou
 
Clareou, já vou embora 
Vou sozinho mas deixo a minha viola 
Clareou, já vou embora 
Vou sozinho mas deixo a minha viola
Pout-Pourri Din Din Din/O Samba Não Pode Parar/ Clareou
 
Vou embora, já vou, oh oh, 
Atrasado estou oh oh, 
Minha nega chiou, oh oh 
E o barraco fechou, oh oh 
A tarde chegou, oh oh 
E eu vou me arrumar, oh o 
Vou por água de cheiro 
E o pé no terreiro eu vou botar


  ",Pout-Pourri Din Din Din/O Samba Não Pode Parar/ Clareou,Exaltasamba,Pagode,Sabe de quem é a composição? Envie pra gente.
"Pra Mim Não É
 
Do meu jeito louco, diferente 
Pra falar de amor, eu tô aqui, 
Serenata, violão na mão 
Peito aberto eu vou, tente me ouvir
Pra Mim Não É
 
Céu a lua e as estrelas testemunham 
Ao meu favor, como sofri, 
Pode parecer bobagem, 
Ser otário ou coisa assim 
Tô nem aí.
Pra Mim Não É
 
Se pra você o nosso amor 
Não ta com nada 
Se pra você 
Todo esse sonho é palhaçada 
Se pra você 
Tudo que fiz foi dar mancada
Pra Mim Não É
 
Pra mim não é, 
Pra mim não é, 
Pra mim não é.
Pra Mim Não É
 
Se pra você 
Não tem saída, é o fim da estrada 
Se pra você 
Ontem fui tudo, hoje sou nada 
Se pra você 
Sou passatempo ou madrugada
Pra Mim Não É
 
Pra mim não é, 
E vou provar por que não é
Pra Mim Não É
 
Por que eu te amo, 
E não sei viver sem teu calor 
Por que eu te amo, 
Basta olhar pra ver como estou
Pra Mim Não É
 
Por que eu te amo, 
E com saudades fiz essa canção 
Se não me ama, 
Fala logo, quebro o violão...


  Essa informação está errada? Nos avise. ",Pra Mim Não É,Exaltasamba,Pagode,Composição: Thiaguinho / Bruno Cardoso. 
"Pra Não Pensar Em Você
 
Quando a saudade doer 
E a solidão machucar 
Pra não pensar em você 
Nem procurar seu olhar 
Vou enganar a paixão 
Mentir pro meu coração 
Que já deixei de te amar
Pra Não Pensar Em Você
 
Eu vou fingir que esqueci 
Que não chorei nem sofri 
Vendo você me deixar
Pra Não Pensar Em Você
 
E se a lembrança insistir 
Em procurar por nós dois 
Vai encontrar seu adeus 
Dizendo volto depois 
É impossível, eu sei 
Mentir que nunca te amei 
Que foi um sonho e acabou 
Mas tenho que aceitar 
Cuidar de mim e tentar 
Me encontrar noutro amor
Pra Não Pensar Em Você
 
Mas eu me engano, me desespero 
Porque te amo, porque te quero 
E a minha vida é só pensar em você
Pra Não Pensar Em Você
 
O tempo todo, o dia inteiro 
Sinto seu corpo, sinto seu cheiro 
E a minha vida é só pensar em você


  Essa informação está errada? Nos avise. ",Pra Não Pensar Em Você,Exaltasamba,Pagode,Composição: Piska. 
"Pra Que Chorar
 
Pra que chorar 
Vai ser em vão lutar 
Por um sonho que acabou 
Que tentou sobreviver não deu
Pra Que Chorar
 
Pra que chorar 
Vai ser em vão sofrer 
É melhor deixar pra lá 
Dessa vez o amor não venceu
Pra Que Chorar
 
Eu que pensei que voce fosse 
Uma verdade e era mentira 
Mas uma dor, tanto me entreguei não deu valor
Pra Que Chorar
 
Não vou mais me entregar 
De corpo de alma sem pensar 
Nas consequências se é seguro ou não, 
Deixar o amor me guiar
Pra Que Chorar
 
Não vou mais me iludir 
Quis dar meu melhor só me feri 
Vivendo e aprendendo, 
Vou me levantar e deixar o amor me guiar.


  Essa informação está errada? Nos avise. ",Pra Que Chorar,Exaltasamba,Pagode,Composição: Cláudio Bonfim / Thiaguinho. 
"Pra Sambar
 
Samba morena pro lado de cá 
Samba loirinha pro lado de lá 
Samba pretinha pro lado de cá 
Chama branquinha pra sambar
Pra Sambar
 
Pra sambar, pra sambar
Pra Sambar
 
Chega bem de mansinho 
Pra sambar 
Requebrando o corpinho 
Pra sambar 
Mexe devagarzinho 
Pra sambar 
Com bastante carinho 
Pra sambar 
Ela tem um requebrado, que é de amarrar 
Ela tem um remelexo de apaixonar
Pra Sambar
 
Pra chegar, pra sambar 
Pra chegar, pra sambar


  Essa informação está errada? Nos avise. ",Pra Sambar,Exaltasamba,Pagode,Composição: Beto Lima / Sergio Rufino / Xandre De Pilares. 
"Preciso de Amor
 
Ai meu Deus, o que posso fazer 
Minha amiga não vê que é paixão 
Eu preciso de amor pra viver 
Com ela no meu coração
Preciso de Amor
 
A menina dos meus sonhos 
Não entende meu sorriso 
Ela não percebeu meu desejo no olhar 
E eu aqui sofrendo na ânsia sem poder amar
Preciso de Amor
 
A menina dos meus olhos 
Olha e não vê que eu preciso 
Que eu preciso de amor 
De uma nova paixão 
Viver feliz da vida 
Com ela no meu coração
Preciso de Amor
 
Não consigo ficar com ninguém 
Com ela no meu coração 
Meu namoro é só vai e vem (vem, vem) 
Com ela no meu coração
Preciso de Amor
 
Ai meu Deus, o que posso fazer 
Minha amiga não vê que é paixão 
Eu preciso de amor pra viver 
Com ela no meu coração...


  Essa informação está errada? Nos avise. ",Preciso de Amor,Exaltasamba,Pagode,Composição: André Renato / Delcio Luis. 
"Preciso Desabafar
 
Preciso tanto conversar 
Falar de tudo que aconteceu comigo 
Diz então pode falar 
O que aconteceu que te deixou tão deprimido
Preciso Desabafar
 
É sempre bom desabafar 
Lembra daquela mina que um dia eu te apresentei? 
O que que tem? 
Ficamos juntos um bom tempo e eu me apaixonei 
Tudo bem 
É tão normal um homem se apaixonar
Preciso Desabafar
 
Ela foi embora 
Sem mais nem menos decretou o fim 
Mas dizem que ela chora 
Se algum amigo pergunta por mim
Preciso Desabafar
 
Não fica assim não chora 
Aposto que ela um dia vai voltar 
Meu Deus mas que demora 
Mais um tiquinho vou pirar
Preciso Desabafar
 
Eu já nem sei quem eu sou 
Ou me chamo 
Ai que saudade daquela que eu amo 
Bem que eu notei você meio estranho 
Tão cabisbaixo, sozinho num canto


  Essa informação está errada? Nos avise. ",Preciso Desabafar,Exaltasamba,Pagode,Composição: Mauricinho. 
"Preciso de Um Beijo Seu
 
Eu não consigo te esquecer 
Será que tudo acabou 
É tanto tempo sem te ver 
Mas não passa essa dor
Preciso de Um Beijo Seu
 
Estrada que não tem mais chão sem sua mão pra me guiar 
Um corpo só, sem coração, se não posso te amar 
A madrugada é fria, chove e eu sozinho a te esperar 
Perdido no silêncio teu, sem saber se vai voltar 
Porque te amo, te amo
Preciso de Um Beijo Seu
 
Preciso de um beijo seu pra voltar a ser feliz 
Preciso do carinho teu pra voltar a sorrir 
Por isso fiz essa canção 
Porque te amo, te amo


  Essa informação está errada? Nos avise. ",Preciso de Um Beijo Seu,Exaltasamba,Pagode,Composição: Jeffinho / Magoo. 
"Preciso Te Falar
 
Cara eu preciso te falar tem algo dando errado 
ela me deixou sem jeito fiquei desligado 
e eu sei o quanto ela faz falta ela não tá nem aí 
e sabendo que omundo dá voltas espero ela voltar pra mim
Preciso Te Falar
 
Amigo deixa eu te falar ela tem outro namorado 
e te vendo desse jeito eu jah tô preocupado 
sim é claro que o mundo dá voltas você arruma outra por aí 
vê você parado aqui tô sem jeito 
tá fazendo mal pra mim
Preciso Te Falar
 
Refrão 
Cara eu me apaixonei 
Eu já reparei 
Mais o que eu vou fazer?Vou firgir que aceitei? 
É melhor eu já te avisei ela só te fez sofrer


  Essa informação está errada? Nos avise. ",Preciso Te Falar,Exaltasamba,Pagode,Composição: Dioguinho. 
"Presença de Paz
 
O nosso caso está chegando ao fim 
Já não dá pra insistir 
Nos mesmos erros 
A nossa paixão já não se faz presente 
E entre a gente tudo está diferente
Presença de Paz
 
Já não tem mais sabor o nosso beijo 
Já não há mais prazer, não há desejo 
Já não vejo o sol brilhar 
E nem a noite chegar 
Sem você fico a vagar 
Não sei viver
Presença de Paz
 
Rolam os sonhos 
As fantasias 
Meu coração se inebria 
Oh, minha deusa, onde andarás 
Tua presença é minha paz


  Essa informação está errada? Nos avise. ",Presença de Paz,Exaltasamba,Pagode,Composição: Izaias / Mally / Péricles / Piscina. 
"Pretinho Carente
 
Sei que é difícil, mas eu vou encontrar um alguém 
Pra viver um amor pra valer 
Eu não estou maluco, sei que tem por aí 
Pensamentos assim como o meu 
Quero namorada de pracinha  e de cinema 
Quero aquele tempo de namoro mais fiel 
Quero aquela boca de beijar e arrepiar 
Quero na verdade um amor pra eternizar
Pretinho Carente
 
Quero alguém que possa cuidar de um pretinho carente 
Que chora, sem ninguém 
Quero alguém que possa me dar um carinho 
Que mande embora o sofrer
Pretinho Carente
 
Sei que é difícil, mas eu vou encontrar um alguém 
Pra viver um amor pra valer 
Eu não estou maluco, sei que tem por aí 
Pensamentos assim como o meu 
Quero namorada de pracinha  e de cinema 
Quero aquele tempo de namoro mais fiel 
Quero aquela boca de beijar e arrepiar 
Quero na verdade um amor pra eternizar
Pretinho Carente
 
Quero alguém que possa cuidar de um pretinho carente 
Que chora, sem ninguém 
Quero alguém que possa me dar um carinho 
Que mande embora o sofrer


  ",Pretinho Carente,Exaltasamba,Pagode,Sabe de quem é a composição? Envie pra gente.
