Lyrics,Song,Artist,Genre,Composition
"24 Horas de Amor
 
Amor amigo 
Não sei porque ê ê, ê 
Fugiu de mim 
Sem me dizer 
Pra onde foi 
Cadê você?
24 Horas de Amor
 
Eu te procuro 
(Sem rancor..) 
Mas não te vejo 
(Onde for) 
É muito duro 
É inseguro 
O meu desejo...
24 Horas de Amor
 
É te amar 
(É te amar!) 
É te querer 
(É te querer!) 
24 horas sem cessar 
Meu grande amor 
Longe de ti 
(Não sei sorrir!) 
Sinto 
Até saudades de mim 
Diga que não 
Chegou ao fim...
24 Horas de Amor
 
É te amar 
(É te amar!) 
É te querer 
(É te querer) 
24 horas sem cessar 
Meu grande amor 
Longe de ti 
(Não sei sorrir) 
Sinto 
Até saudades de mim...
24 Horas de Amor
 
Amor amigo 
Não sei porquê, ê, ê 
Fugiu de mim 
Sem me dizer 
Pra onde foi 
Cadê você?...
24 Horas de Amor
 
Eu te procuro 
(Sem rancor!) 
Mas não te vejo 
(Onde vou!) 
É muito duro 
É inseguro 
O meu desejo...
24 Horas de Amor
 
É te amar 
(É te amar!) 
É te querer 
(É te querer!) 
24 horas sem cessar 
Meu grande amor 
Longe de ti 
(Não sei sorrir!) 
Sinto 
Até saudades de mim 
Diga que não 
Chegou ao fim...
24 Horas de Amor
 
É te amar 
(É te amar!) 
É te querer 
(É te querer) 
24 horas sem cessar 
Meu grande amor 
Longe de ti 
(Não sei sorrir) 
Sinto 
Até saudades de mim...
24 Horas de Amor
 
Láia, Láia, Láia, Láia..
24 Horas de Amor
 
24 horas sem cessar 
Meu grande amor 
Longe de ti 
(Não sei sorrir) 
Sinto 
Até saudades de mim...


  Essa informação está errada? Nos avise. ",24 Horas de Amor,Exaltasamba,Pagode,Composição: Rubens Cazagrande / Rui de Queróz de Souza. 
"40 Graus de Amor
 
Meu coração é o teu lugar 
Meu coração quer te abrigar 
Eu te amo tanto, preciso de você 
Eu te amo tanto, meu mundo é você
40 Graus de Amor
 
Lá fora não existe amor 
Sincero como o meu amor 
Eu sei, tão puro e cheio de emoção 
Eu sei, nós dois somos iguais 
Os nossos ideais, paixão, ternura e paz
40 Graus de Amor
 
É só você entrar aqui é o seu lugar, te amo 
Meu coração está no fogo prá te amar, queimando 
É só você chegar quero te abraçar 
Deita no meu peito e sente o meu calor 
Quarenta graus de amor, perfeito
40 Graus de Amor
 
É só você entrar aqui é o seu lugar, te amo 
Meu coração está no fogo prá te amar, queimando 
É só você chegar quero te abraçar 
Deita no meu peito e sente o meu calor 
Quarenta graus de amor, perfeito
40 Graus de Amor
 
Meu coração é o teu lugar 
Meu coração quer te abrigar 
Eu te amo tanto, preciso de você 
Eu te amo tanto, meu mundo é você
40 Graus de Amor
 
Lá fora não existe amor 
Sincero como o meu amor 
Eu sei, tão puro e cheio de emoção 
Eu sei, nós dois somos iguais 
Os nossos ideais, paixão, ternura e paz
40 Graus de Amor
 
É só você entrar aqui é o seu lugar, te amo 
Meu coração está no fogo prá te amar, queimando 
É só você chegar quero te abraçar 
Deita no meu peito e sente o meu calor 
Quarenta graus de amor, perfeito
40 Graus de Amor
 
É só você entrar aqui é o seu lugar, te amo 
Meu coração está no fogo prá te amar, queimando 
É só você chegar quero te abraçar 
Deita no meu peito e sente o meu calor 
Quarenta graus de amor, perfeito
40 Graus de Amor
 
Meu coração é o teu lugar


  Essa informação está errada? Nos avise. ",40 Graus de Amor,Exaltasamba,Pagode,Composição: Delcio Luiz / Pezinho. 
"Abandonado
 
No Pagode é
Abandonado
 
Lá lá ia, lá ia, lá ia, lá ia 
Lá lá ia, lá ia, lá ia, lá ia 
Lá lá ia, lá ia, lá ia, lá ia 
Lá lá ia, lá ia, lá ia, lá ia
Abandonado
 
Abandonado, assim que eu me sinto longe de você 
Despreparado, meu coração dá pulo perto de você 
E quanto mais o tempo passa, mais aumenta essa vontade 
O que posso fazer? 
Se quando beijo outra boca 
Lembro sua voz tão rouca me pedindo pra fazer 
Carinho gostoso, amor venenoso
Abandonado
 
Tô preocupado, será que não consigo mais te esquecer? 
Desesperado, procuro uma forma de não te querer 
Mas quando a gente se encontra, o amor sempre apronta 
Não consigo conter 
Por mais que eu diga que não quero 
Toda noite te espero com vontade de fazer 
Carinho gostoso, amor venenoso
Abandonado
 
Faz amor comigo, sem ter hora pra acabar 
Mesmo que for só por essa noite 
Eu não quero nem saber, quero amar você 
Faz amor comigo até o dia clarear 
Tô ligado, sei que vou sofrer 
Mas eu não quero nem saber, quero amar você
Abandonado
 
Faz amor comigo, sem ter hora pra acabar 
Mesmo que for só por essa noite 
Eu não quero nem saber, quero amar você 
Faz amor comigo até o dia clarear 
Tô ligado, sei que vou sofrer 
Mas eu não quero nem saber, quero amar você
Abandonado
 
Abandonado, assim que eu me sinto longe de você 
Despreparado, meu coração dá pulo perto de você 
E quanto mais o tempo passa, mais aumenta essa vontade 
O que posso fazer? 
Se quando beijo outra boca 
Lembro sua voz tão rouca me pedindo pra fazer 
Carinho gostoso, amor venenoso
Abandonado
 
Tô preocupado, será que não consigo mais te esquecer? 
Desesperado, procuro uma forma de não te querer 
Mas quando a gente se encontra, o amor sempre apronta 
Não consigo conter 
Por mais que eu diga que não quero 
Toda noite te espero com vontade de fazer 
Carinho gostoso, amor venenoso
Abandonado
 
Faz amor comigo, sem ter hora pra acabar 
Mesmo que for só por essa noite 
Eu não quero nem saber, quero amar você 
Faz amor comigo até o dia clarear 
Tô ligado, sei que vou sofrer 
Mas eu não quero nem saber, quero amar você
Abandonado
 
Faz amor comigo, sem ter hora pra acabar 
Mesmo que for só por essa noite 
Eu não quero nem saber, quero amar você 
Faz amor comigo até o dia clarear 
Tô ligado, sei que vou sofrer 
Mas eu não quero nem saber, quero amar você
Abandonado
 
Lá lá ia, lá ia, lá ia, lá ia 
Lá lá ia, lá ia, lá ia, lá ia 
Lá lá ia, lá ia, lá ia, lá ia 
Lá lá ia, lá ia, lá ia, lá ia
Abandonado
 
Abandonado, assim que eu me sinto longe de você!


  Essa informação está errada? Nos avise. ",Abandonado,Exaltasamba,Pagode,Composição: Pedro Pezinho / Thiaguinho. 
"Acaba Tudo Bem
 
La laia laia laia laia (2x)
Acaba Tudo Bem
 
É esse amor da gente que provoca tanta confusão 
Às vezes causa medo que sufoco não é brinquedo não 
Amor de adolescente, inconseqüente que age sem pensar 
E assim tão de repente, olha aí gente, que paixão
Acaba Tudo Bem
 
Me amarro nesse amor 
E esse amor quando é assim, só alegria 
Adoro teu calor quem dera fosse assim todo dia
Acaba Tudo Bem
 
Eu tô legal, até me acostumei com seu humor 
O baixo astral, tá longe dessa onda de caô 
Ta na moral, a gente vive nesse vai e vem 
Mas no final, acaba tudo bem
Acaba Tudo Bem
 
La laia laia laia laia (2x)


  Essa informação está errada? Nos avise. ",Acaba Tudo Bem,Exaltasamba,Pagode,Composição: Andre Lemos / Billy SP. 
"A Carta
 
Não existem mais palavras 
Que eu possa escrever 
Pra falar de tanto amor 
Entenda por favor
A Carta
 
Que uma carta é muito pouco 
Para revelar o retrato da tristeza
A Carta
 
E a cicatriz da saudade 
Que você deixou no meu peito 
Tatuagem de amor, não tem jeito 
Nunca vai sair de mim esta dor 
Entenda o que eu vou te dizer
A Carta
 
Dois pontos, vem 
De volta pro meu coração 
Exclamação
A Carta
 
Não posso viver sem você 
Não tenho razão nem porquê 
Me acostumar com a saudade 
Nem vírgula vai separar
A Carta
 
Nessa oração 
Teu nome da minha paixão 
Não leve a mal 
Eu sei que não sou escritor 
É só uma carta de amor 
De alguém que te quer de verdade


  Essa informação está errada? Nos avise. ",A Carta,Exaltasamba,Pagode,Composição: Aloysio Reis / Delcio Luiz. 
"Aceita Paixão
 
Eu não quero nem saber 
Deixa o povo fofocar 
O importante é ter você 
Pois ao meu lado é teu lugar
Aceita Paixão
 
E daí o que vão dizer 
Temos que aproveitar 
Esse lance eu e você 
Sempre vai dar o que falar
Aceita Paixão
 
Só porque eu vou pra noite 
Chego em casa com o sol 
Sou presença no pagode 
Não largo meu futebol 
Quem me ver, me vê sorrindo 
E vai ser sempre assim
Aceita Paixão
 
Olha eu já to preparado 
Pro que pode acontecer 
Quando a inveja é pesada 
O trabalho é bem feito 
Não pague pra ver 
Mas o meu corpo é fechado 
Menos o meu coração 
Que abre desesperado pedindo calado 
Aceita paixão (2x)


  Essa informação está errada? Nos avise. ",Aceita Paixão,Exaltasamba,Pagode,Composição: Gabriel Barriga / Thiaguinho. 
"Acordar Com Você
 
Vim tentar te dizer 
Que foi bom ter você 
É paixão, pode crer 
Me entreguei sem querer(2x)
Acordar Com Você
 
A felicidade me encontrou 
E veio me dizer que é você 
O meu grande amor, o meu bem querer 
A noite a nossa cama é o nosso lar 
A madrugada a lua vem pra ver 
Sem a gente notar ja vai amanhecer 
Foi tao lindo sonhar e acordar com você
Acordar Com Você
 
Vim tentar te dizer 
Que foi bom ter você 
É paixão, pode crer 
Me entreguei sem querer(3x)


  ",Acordar Com Você,Exaltasamba,Pagode,Sabe de quem é a composição? Envie pra gente.
"A Gente Bota Pra Quebrar
 
Lelelelelelele lá em casa 
Lelelelelelele na cama 
Lelelelelelele tirando a roupa toda
A Gente Bota Pra Quebrar
 
Hoje você não se zanga 
Quando eu vou pro samba 
Você vem, comigo e faz a festa 
Olha que maneiro 
Tem tamborim, pandeiro 
Cavaco e violão 
Amor à beça
A Gente Bota Pra Quebrar
 
Quando chega sexta-feira 
Eu vou pra pagodeira e você não 
Se cansa de pagode 
Dança miudinho, vem no sapatinho 
Agita no refrão 
E se sacode
A Gente Bota Pra Quebrar
 
Meu samba com carinho te faz feliz, feliz 
E tudo nessa vida é você 
Exalta, Exalta 
Se arruma fica linda que eu tô chegando aí 
Espera que essa noite é você 
No show
A Gente Bota Pra Quebrar
 
No samba a gente bota pra quebrar 
Ninguém segura a gente 
A cuíca chora e faz o povo todo balançar 
De um lado pro outro 
Pra trás e pra frente
A Gente Bota Pra Quebrar
 
Lelelelelelele lá em casa 
Lelelelelelele na cama 
Lelelelelelele tirando a roupa toda


  Essa informação está errada? Nos avise. ",A Gente Bota Pra Quebrar,Exaltasamba,Pagode,Composição: Alexandre Pezão / André Lemas. 
"A Gente Faz a Festa (part. Mr Catra)
 
Ela curte um funk 
Ela é de balada 
Ela gosta da night, ela é de beber 
Dá um rolé junto com as amigas 
E só volta pra casa ao amanhecer
A Gente Faz a Festa (part. Mr Catra)
 
Vive a vida tão intensamente 
Não vejo maldade, é só curtição 
Quando a gente ama não vemos defeito 
Ela é a dona do meu coração
A Gente Faz a Festa (part. Mr Catra)
 
Quando existe sentimento 
A gente vê por dentro 
A gente chuta o balde 
A gente faz amor 
Tudo é tão perfeito, puro e verdadeiro 
Tudo é cem por cento quando existe amor
A Gente Faz a Festa (part. Mr Catra)
 
Se faltar dinheiro, o amor inteira 
Em qualquer momento o amor é professor 
Quando existe amor, fidelidade impera 
Tudo dá saudade, nada causa dor
A Gente Faz a Festa (part. Mr Catra)
 
De dia ela que dá um trampo 
De noite sou eu 
E mesmo com o desencontro, a gente se escolheu 
Feito o sol e a lua, a história continua 
Nosso romance com certeza foi Deus quem escreveu
A Gente Faz a Festa (part. Mr Catra)
 
E mesmo com tanta fofoca 
A gente tá aí, se amando e se respeitando pra não destruir 
Tanto entrosamento, vamos ser exemplo 
De amor e honestidade sem se dividir
A Gente Faz a Festa (part. Mr Catra)
 
A gente se completa 
A gente faz a festa 
De dia, de noite, no carro, na rua 
Tudo de bom, beleza pura
A Gente Faz a Festa (part. Mr Catra)
 
A gente se completa 
A gente faz a festa 
De dia, de noite, no carro, na rua 
Quando é paixão ninguém segura


  Essa informação está errada? Nos avise. ",A Gente Faz a Festa (part. Mr Catra),Exaltasamba,Pagode,Composição: Thiaguinho. 
"Ainda É Tudo Seu Aqui
 
(Luiza) 
Ainda tenho tantas coisas pra te dizer 
E saber. 
Você que sempre me ganha 
Antes de me perder 
Me faz ver. 
Em cada melodia e letra que eu vou escrever 
Tem você. 
Sua boca me leva aonde vou me perder 
Mesmo se não for pra sempre 
Volto pra te buscar 
Mesmo que eu siga em frente 
Um dia vou te leva, 
Mas não vá. 
Ainda é tudo seu aqui 
É tudo seu. 
(Thiaguinho) 
As horas vivem com pressa 
Eu ando devagar. 
Segredos moram comigo 
Eu gosto de contar, pro céu. 
A vida inteira é muito pouco só pra começar 
Desvendar. 
E quando os olhos se esquentam, 
Eu perco a direção e a razão. 
(Luiza e Thiaguinho) 
Mesmo se não for pra sempre 
Volto pra te buscar. 
Mesmo que eu siga em frente 
Um dia vou te levar, 
Mas não, não, vá não. 
Ainda é tudo seu aqui,é tudo seu 
Ainda é tudo seu aqui,é tudo seu 
Ainda é tudo seu aqui,é tudo seu 
Ainda é tudo seu aqui,é tudo seu 
Mesmo se não for pra sempre 
Volto pra te buscar. 
Mesmo que eu siga em frente 
Um dia vou te levar, 
Mas não vá,não,não,não vá. 
Ainda é tudo seu aqui,é tudo seu 
Ainda é tudo seu aquié tudo seu 
Ainda é tudo seu aqui,é tudo seu 
Ainda é tudo seu aqui, ainda é tudo seu 
E sempre vai ser seu. 
Ainda é tudo seu,tudo seu. 
Ainda é tudo seu,tudo seu, 
Ainda é tudo seu,tudo seu.


  ",Ainda É Tudo Seu Aqui,Exaltasamba,Pagode,Sabe de quem é a composição? Envie pra gente.
"Algo Mais
 
Às vezes penso que eu minto quando digo que eu te amo 
Porque isso já não é amor 
Às vezes sinto que estou morta quando não estas e me desperto 
Porque sei que isso não é amar 
É algo mais em que me completa 
Algo que não mata nem envenena 
É algo mais, algo mais que amar.
Algo Mais
 
É algo mais que a distância 
Que essa dor e a tristeza 
Sabemos que isso não vai nos separar 
Te dar um beijo cada noite 
Que tuas mãos me apaixonem 
E o nosso amor aumente cada dia mais 
Porque somos algo mais
Algo Mais
 
Às vezes creio ter vivido mais de mil anos contigo 
Porque eu sei que isso já não é amar 
Às vezes sinto que é mentira como entrastes na minha vida 
Porque sei que isso já não é amar 
É algo mais em que me completa 
Algo que não mata nem envenena 
É algo mais, algo mais que amar.
Algo Mais
 
É algo mais que a distância 
Que essa dor e a tristeza 
Sabemos que isso não vai nos separar 
Te dar um beijo cada noite 
Que tuas mãos me apaixonem 
E o nosso amor aumente cada dia mais 
Porque somos algo mais
Algo Mais
 
E eu sei que sem querer, porque em teus olhos eu me posso perder 
Contigo esqueço o que é temer, se você não sabe o que será para mim 
A noite, o dia no meu viver, o sangue nas veias, eu dou tudo por ti 
Contigo o mundo não tem final 
E o tempo não, não se vai acabar 
Acabar
Algo Mais
 
É algo mais que a distância 
Que essa dor e a tristeza 
Sabemos que isso não vai nos separar 
Te dar um beijo cada noite 
Que tuas mãos me apaixonem 
E o nosso amor aumente cada dia mais 
Porque somos algo mais 
Porque somos algo mais


  ",Algo Mais,Exaltasamba,Pagode,Sabe de quem é a composição? Envie pra gente.
"Alma Gêmea
 
Eu percebi no seu olhar 
Um anjo bom de me guiar 
No céu que não vai desabar 
O mel do meu prazer 
Um nó que não vai desatar 
A luz que veio pra ficar 
No coração 
Que sabe o que é sofrer 
Você também já percebeu 
Que o seu grande amor sou eu 
Que a solidão já se perdeu 
Vou te fazer feliz, vem 
Se o destino quis assim 
Bom pra você, melhor pra mim 
É impossível duvidar ainda 
Linda 
Pede pra Deus abençoar 
E o nosso amor eternizar 
Abrir meu coração 
Bem-vinda.
Alma Gêmea
 
Vem, meu pedacinho de maçã 
Me perfumar toda manhã 
Com esse cheirinho bom de fêmea, de fêmea 
Vem, preciso tanto de você 
Eu quero ser seu bem querer 
Você é minha alma gêmea


  Essa informação está errada? Nos avise. ",Alma Gêmea,Exaltasamba,Pagode,Composição: Delcio Luiz / Marquinho Pqd. 
"Alma Gêmea / Dom de Sonhar
 
Eu percebi no seu olhar 
Um anjo bom de me guiar 
No céu que não vai desabar 
O mel do meu prazer 
Um nó que não vai desatar 
A luz que veio pra ficar 
No coração 
Que sabe o que é sofrer 
Você também já percebeu 
Que o seu grande amor sou eu 
Que a solidão já se perdeu 
Vou te fazer feliz, vem 
Se o destino quis assim 
Bom pra você, melhor pra mim 
É impossível duvidar ainda 
Linda 
Pede pra Deus abençoar 
E o nosso amor eternizar 
Abrir meu coração 
Bem-vinda
Alma Gêmea / Dom de Sonhar
 
Vem, meu pedacinho de maçã 
Me perfumar toda manhã 
Com esse cheirinho bom de fêmea, de fêmea 
Vem, preciso tanto de você 
Eu quero ser seu bem querer 
Você é minha alma gêmea
Alma Gêmea / Dom de Sonhar
 
Diz que me ama 
Mesmo que seja mentira 
Mesmo que por brincadeira 
Nem que eu fique na mira 
Certeira da desilusão 
Sonhar nunca foi em vão 
E você é meu sonho predileto 
Pois saiba que quando estou quieto 
Estou com certeza viajando 
E segurando sua mão 
Pois saiba que quando estou quieto 
Estou com certeza viajando 
E segurando sua mão
Alma Gêmea / Dom de Sonhar
 
Transforma em verdade 
Este dom de sonhar 
Me dê a sua mão e vamos viajar, o, o, o, o 
É loucura te olhar e não te desejar 
Então mente pra mim que eu quero acreditar


  ",Alma Gêmea / Dom de Sonhar,Exaltasamba,Pagode,Sabe de quem é a composição? Envie pra gente.
"Alô Sou Eu
 
Eu não sei se você vai lembrar do meu nome 
Eu pedi pro garçom entregar meu telefone 
E pra minha surpresa você entregou o seu 
E por isso eu tô te ligando 
Alô? Sou eu! 
Sou o cara que você olhou a noite inteira 
Despertou em você paixão verdadeira 
Teu olhar, teu sorriso, meu amor se fez 
Foi então que eu perdi a timidez
Alô Sou Eu
 
Fui eu... que me aproximei. 
Fui eu... que me declarei. 
Fui eu... que me encantei. 
Fui eu... que me apaixonei.
Alô Sou Eu
 
Dererere escute o que eu vou te falar. 
Dererere eu quero mesmo é te encontrar. 
Dererere que tal falar de um sentimento. 
Dererere no meu apartamento?


  ",Alô Sou Eu,Exaltasamba,Pagode,Sabe de quem é a composição? Envie pra gente.
"Altas horas
 
Altas Horas
Altas horas
 
-Onde Está Você? 
Madrugada fria 
Eu aqui sozinho 
Precisando te encontrar 
Onde está você?...
Altas horas
 
Já são Altas Horas 
Eu te esperando 
Mas não quero nem pensar 
Que você não vem...
Altas horas
 
Prá me aquecer 
Nessa solidão 
Não suporto mais sofrer 
Quero tanto o teu amor...
Altas horas
 
E o tempo parou 
Eu nem percebi 
Acho que você chegou 
Quando adormeci...
Altas horas
 
Tenho tanto prá dizer 
Dentro do meu coração 
Eu não fiz por merecer 
Tanta solidão 
Eu preciso de você 
Estou apaixonado 
Não consigo te esquecer 
Fica do meu lado...(2x)
Altas horas
 
Madrugada fria 
Eu aqui sozinho 
Precisando te encontrar 
Onde está você?...
Altas horas
 
Já são Altas Horas 
Eu te esperando 
Mas não quero nem pensar 
Que você não vem...
Altas horas
 
Prá me aquecer 
Nessa solidão 
Não suporto mais sofrer 
Quero tanto o teu amor...
Altas horas
 
E o tempo parou 
Eu nem percebi 
Acho que você chegou 
Quando adormeci...
Altas horas
 
Tenho tanto prá dizer 
Dentro do meu coração 
Eu não fiz por merecer 
Tanta solidão 
Eu preciso de você 
Estou apaixonado 
Não consigo te esquecer 
Fica do meu lado...(3x)


  Essa informação está errada? Nos avise. ",Altas horas,Exaltasamba,Pagode,Composição: Beto Lima / Mauro Jr. / Xande de Pilares. 
"A Massa
 
A dor da gente 
É dor de menino acanhado 
Menino-bezerro pisado 
No curral do mundo a penar 
Que salta aos olhos 
Igual a um gemido calado 
A sombra do mal-assombrado 
Mansos meninos domados 
Massa de medos iguais 
Amassando a massa 
A mão que amassa a comida 
Esculpe, modela e castiga 
A massa dos homens normais 
Quando eu lembro da massa 
Da mandioca mãe da massa 
when I remember of massa of manioc 
Quando eu lembro da massa 
Da mandioca mãe da massa 
Nunca mais me fizeram quela presença, mãe 
Da massa que planta a mandioca mãe 
A massa qu'eu falo é a que passa fome, mãe
Da massa que planta a mandioca, mãe 
Quand je rappele de la masse du maniac, mere 
Quando eu lembro da massa da mandioca 
Lélé meu amor lélé 
Léle meu amor léé 
No cabo da minha enxada 
Não conheço corone 
Eu quero mas não quero, camarão 
Mulher minha na função, camarão 
Que está livre de um abraço 
Mas não está de um beliscão 
Torna a repetir meu amor: ai, ai, ai! 
É que o guarda civil não quer 
A roupa no quarador 
O guarda civil não quer a roupa no quarador 
Neu Deus onde vai parar 
Parar essa massa 
Meu Deus onde vai rolar 
Rolar essa massa...


  Essa informação está errada? Nos avise. ",A Massa,Exaltasamba,Pagode,Composição: Jorge Portugal / Raimundo Sodré. 
"Amor Dos Anjos
 
Tire os pés do chão e vem pisar no céu 
Descobrir o louco amor dos anjos 
O cometa é doce e tem calda de mel
Amor Dos Anjos
 
Pegue minha mão e vamos pras estrelas 
Linda, iluminada, amor eu quero vê-la 
Como mais um astro nesse carrossel
Amor Dos Anjos
 
Deixa amor eu levá-la em meus braços 
Que é pro tempo esculpir na paisagem 
O seu rosto gravado em meu peito, tatuagem 
E te amar na leveza das nuvens 
Quando enfim terminar a viagem 
Lua cheia, na sua barriga nossa imagem
Amor Dos Anjos
 
Minha língua no céu da sua boca 
Entre as estrelas que beleza 
Nossa viagem é muito louca 
Nas asas da delicadeza


  Essa informação está errada? Nos avise. ",Amor Dos Anjos,Exaltasamba,Pagode,Composição: Altay Veloso. 
"Amor e Amizade
 
Essa noite eu sonhei com você 
E queria bem mais que sonhar 
Acredito que já percebeu 
Na amizade entre você e eu 
Tá pintando uma diferença
Amor e Amizade
 
Eu não sei o que aconteceu 
Mas a minha intenção mudou 
Se te via como uma amiga 
Ou a dona do meu amor
Amor e Amizade
 
Eu tô confuso 
No que vou fazer 
Te querendo amor! 
Te querendo amor! 
Mas cheio de vontade 
De me declarar 
Te querendo amor! 
Te querendo amar! 
Será que a amizade 
Vai prevalecer 
Te querendo amor! 
Te querendo amor! 
O nosso sentimento 
Vai se libertar


  Essa informação está errada? Nos avise. ",Amor e Amizade,Exaltasamba,Pagode,Composição: Charlles André / Luiz Cláudio Picolé. 
"Amor Voraz
 
Basta um sorriso ou talvez um olhar, 
Um simples gesto seu pode apagar 
Um momento a sós e eu esqueço tudo 
Em meio a tantos ventos, os mal temporais 
Vou me perdendo nesse amor voraz 
E eu confesso cada vez te amo mais 
Eu tento de odiar por um segundo 
Mas sei que é em vão 
Não há amor maior do mundo
Amor Voraz
 
É sempre assim 
Basta o seu pedido de perdão pra mim 
E eu como um fraco volto e caio em suas mãos 
E a tempestade invade o meu coração 
Busquei essas palavras só pra te dizer 
Não vivo sem você.


  Essa informação está errada? Nos avise. ",Amor Voraz,Exaltasamba,Pagode,Composição: Walmir Borges. 
"Angola Nagô
 
ExaltaSamba - Angola Nagô
Angola Nagô
 
[<br/>, Angola Nagô  
É hora, Xangô! (BIS) 
Eu vou à Bahia, no Abaeté 
Fazer meus pedidos porque tenho fé 
Ver lindas baianas dançando afoxé 
E o ritual, menininha, lá é do lava-pé 
Angola Nagô 
É hora, Xangô! (BIS) 
Bahia linda! De belezas naturais! 
Suas lendas e costumes 
Sua crença e rituais 
Tem capoeira ritimada e agogô 
É aquela romaria 
Todos cantam ao Senhor 
Angola Nagô 
É hora, Xangô! (BIS) 
Mãe Menininha, rainha do Candomblé 
O seu nome é abençoado como figa de guiné 
E o jangadeiro rema até contra a maré 
Mãe Oxum que abençôe a todo filho 
Que tem fé! 
Angola Nagô 
É hora, Xangô! (BIS)


  Essa informação está errada? Nos avise. ",Angola Nagô,Exaltasamba,Pagode,Composição: Jairo / Luiz Pintor / Lula. 
"Anjo Meu
 
Anjo meu, 
Eu sou aprendiz desse grande amor 
Sei que errando posso acertar. 
Sonho em te abraçar, 
Te mostrar nosso mundo 
Todo o amor que eu possa te dar.
Anjo Meu
 
Até te mandei um cartão 
(Mas não leu) 
Só pra chamar sua atenção 
(Mas não deu)
Anjo Meu
 
Agora o que eu posso fazer? 
Se meu pensamento é você 
Anjinho cê tem que saber
Anjo Meu
 
Depois do dia em que te conheci 
Teu lindo olhar eu jamais esqueci 
(Anjo meu preciso de você) 
Eu quero te convidar pra dançar 
Ando nas nuvens só de imaginar 
(Anjo meu preciso de você)  (2x)


  Essa informação está errada? Nos avise. ",Anjo Meu,Exaltasamba,Pagode,Composição: Péricles / Thiaguinho. 
"Aonde Você For
 
Meu bem, me leva no teu coração 
Essa carona você não pode negar 
Eu sei, que é grande a tua embarcação 
Bem do tamanho do amor que eu tenho pra te dar
Aonde Você For
 
Vai ser muito bom, viajar com você 
A vida inteira a gente se amar 
Pintar bem no tom azul nosso viver 
E rezar forte pra ele nunca desbotar
Aonde Você For
 
Minha paixão é fogo, é verdadeira 
Tem lenha na fogueira pra nunca acabar 
é tanta emoção, que não é brincadeira 
Não caio na besteira desse sonho acabar
Aonde Você For
 
Aonde você for  
Eu vou lhe acompanhar 
Levar o meu amor  
Doseu pé não vou largar


  Essa informação está errada? Nos avise. ",Aonde Você For,Exaltasamba,Pagode,Composição: Alexandre Pires / Lourenço. 
"Aos Seus Cuidados
 
Sabe quando tudo muda da noite pro dia 
Quando a tempestade parece nunca passar 
Sabe quando um momento rouba sua alegria 
E some a esperança de um dia ela voltar
Aos Seus Cuidados
 
Sabe quando rola aquela madrugada fria 
Quando a luz do Sol não vem pra clarear 
E do nada aparece alguém que te deixa bem 
Faz tudo mudar
Aos Seus Cuidados
 
Assim você chegou, e pôs tudo no lugar 
Não importa onde seja, se a gente está 
Comendo lanche ou a luz de velas, na balada ou vendo a novela 
Tudo é bem melhor, com você perto de mim
Aos Seus Cuidados
 
E o que passou, foi uma ponte pra que eu chegasse até você 
Hoje eu sou, mais forte antes e preparado pra vencer 
Que bom que Deus me entregou, aos seu cuidados meu amor


  ",Aos Seus Cuidados,Exaltasamba,Pagode,Sabe de quem é a composição? Envie pra gente.
