Lyrics,Song,Artist,Genre,Composition
"Mais Forte do Que Eu
 
Eu jamais imaginei viver um grande amor 
Depois que te encontrei, tudo se transformou 
Você me fez sorrir, fez toda dor sumir 
A paz me encontrou
Mais Forte do Que Eu
 
Eu não pude controlar tamanha emoção 
A força desse olhar abriu meu coração 
Foi como despertar, foi como renascer 
Foi como estar no mar
Mais Forte do Que Eu
 
Já sinto seus olhos a me olhar 
E não consigo esperar 
Seu corpo gostoso a me excitar 
É como sonhar
Mais Forte do Que Eu
 
É bom se apaixonar, de todo se entregar 
Hoje eu aprendi o que é amar 
Nosso amor será música no ar 
Como as nuvens que andam sem parar
Mais Forte do Que Eu
 
Eu quero viver de amor 
Junto com você 
Eu te escolhi para ser 
Meu bem querer


  Essa informação está errada? Nos avise. ",Mais Forte do Que Eu,Exaltasamba,Pagode,Composição: Chrigor / Péricles / Izaias / Théo. 
"Mais Que Amigo
 
Lalaiá, laiá, laiá ê 
laiá lá laiá lá 
Lalaiá, laiá, laiá ê 
laiá lá laiá lá
Mais Que Amigo
 
Mais que amigo eu quero ser 
Uma noite de prazer..me faz 
Querer ser bem mais que amigo eu quero ser 
Você..traz.. 
Um brilho inexplicável ao meu viver 
Eu não sou feliz..vem ser! 
Alma da emoção pra ser minha razão 
Vem ser.. 
Minha eterna dimensão, meu céu, minha paixão 
Vem ver 
Que o meu coração quer ser muito!


  ",Mais Que Amigo,Exaltasamba,Pagode,Sabe de quem é a composição? Envie pra gente.
"Mais Que Amigo / Nuance / Acordar Com Você
 
Lalaiá, laiá, laiá ê 
Laiá lá, laiá lá 
Lalaiá, laiá, laiá ê 
Laiá lá, laiá lá
Mais Que Amigo / Nuance / Acordar Com Você
 
Mais que amigo eu quero ser 
Uma noite de prazer 
Me faz 
Querer ser bem mais que amigo eu quero ser 
Você traz 
Um brilho inexplicável ao meu viver 
Eu não sou feliz, vem ser! 
Alma da emoção pra ser minha razão 
Vem ser 
Minha eterna dimensão, meu céu, minha paixão 
Vem ver 
Que o meu coração quer ser muito!
Mais Que Amigo / Nuance / Acordar Com Você
 
O Fogo que queima em mim, acende a paixão em você 
E jamais se viu coisa assim, mistura amor com prazer 
E a gente não cansa de amar porque nosso amor é voraz 
Se eu quero, você pede mais, e o fogo não chega ao fim
Mais Que Amigo / Nuance / Acordar Com Você
 
Tua boca me dá um calor, aí não respondo por mim 
Possuo você sem pudor, e a chama renasce em mim 
E agora não dá pra apagar, meu corpo já incendiou 
Com o fogo do nosso amor
Mais Que Amigo / Nuance / Acordar Com Você
 
Porque nosso amor é nuance, é calor, é tara 
E essa loucura não para, dá sede só de imaginar 
Acende o meu corpo, e teu fogo e nem água apaga 
Carinho que não se compara, é o fogo do nosso amor!
Mais Que Amigo / Nuance / Acordar Com Você
 
Porque nosso amor é nuance, é calor, é tara 
E essa loucura não para, dá sede só de imaginar 
Acende o meu corpo, e teu fogo e nem água apaga 
Carinho que não se compara, é o fogo do nosso amor! 
Ô, calor, ôô
Mais Que Amigo / Nuance / Acordar Com Você
 
Vim tentar te dizer 
Que foi bom ter você 
É paixão, pode crer 
Me entreguei sem querer
Mais Que Amigo / Nuance / Acordar Com Você
 
Vim tentar te dizer 
Que foi bom ter você 
É paixão, pode crer 
Me entreguei sem querer
Mais Que Amigo / Nuance / Acordar Com Você
 
A felicidade me encontrou 
E veio me dizer que é você 
O meu grande amor, o meu bem querer 
À noite, a nossa cama é o nosso lar 
A madrugada, a lua vem pra ver 
Sem a gente notar já vai amanhecer 
Foi tão lindo sonhar e acordar com você
Mais Que Amigo / Nuance / Acordar Com Você
 
Vim tentar te dizer 
Que foi bom ter você 
É paixão, pode crer 
Me entreguei sem querer
Mais Que Amigo / Nuance / Acordar Com Você
 
Vim tentar te dizer 
Que foi bom ter você 
É paixão, pode crer 
Me entreguei sem querer
Mais Que Amigo / Nuance / Acordar Com Você
 
Vim tentar te dizer 
Que foi bom ter você 
É paixão, pode crer 
Me entreguei sem querer


  ",Mais Que Amigo / Nuance / Acordar Com Você,Exaltasamba,Pagode,Sabe de quem é a composição? Envie pra gente.
"Mais Uma Vez
 
Ainda procuro um jeito 
De ter o seu nome 
Nas minhas lembranças 
Eu quero, tirar do meu peito 
Essa dor que mata 
A minha esperança
Mais Uma Vez
 
Eu preciso ver o seu olhar 
Brilhar pra mim 
Não aguento mais 
Essa dor sem fim  
O meu sonho é ver você voltar 
Volta de vez 
Só pra reparar 
O que a solidão me fez
Mais Uma Vez
 
Ah! Fica comigo 
Eu te preciso  
Mais uma vez          
Ah! Fica comigo 
Amor tão lindo 
Faz outra vez


  Essa informação está errada? Nos avise. ",Mais Uma Vez,Exaltasamba,Pagode,Composição: Chiquinho Dos Santos / Helder Celso. 
"Mar de segredos
 
Eu pensei que não era pra me apaixonar, 
mas ouvi a batida do peito falar, 
me envolvi sem querer fui me deixar levar, 
quando vi era rumo pra não regressar.
Mar de segredos
 
Ainda bem, 
armadilha que o destino fez, 
trouxe a felicidade de vez, 
encontrei um amor que me fez enxergar.
Mar de segredos
 
Como é bom, 
sem entregar sem ter medo de amar, 
só assim é que eu pude acordar, 
pra esse amor transformar.
Mar de segredos
 
Um mar de segredos revelei, 
tentei evitar não suportei, 
tanta paixão tanto querer, 
hoje só vivo por você.
Mar de segredos
 
Um mar de segredos revelei, 
tentei evitar não suportei, 
teu coração o meu prazer, 
hoje só vivo por você.
Mar de segredos
 
Um mar de segredos revelei, 
tentei evitar não suportei, 
tanta paixão tanto querer, 
hoje só vivo por você.
Mar de segredos
 
Um mar de segredos revelei, 
tentei evitar não suportei, 
teu coração o meu prazer, 
hoje só vivo por você.


  Essa informação está errada? Nos avise. ",Mar de segredos,Exaltasamba,Pagode,Composição: Indio / Thiaguinho. 
"Maria da Cruz
 
Cadê Maria? Maria da Cruz 
Aquela morena de olhos azuis 
Procuro faz tempo, pois ando sem luz 
Rodei a cidade, nem sinal da Cruz
Maria da Cruz
 
E querendo saber do seu paradeiro 
Fui até a rua Cruzeiro, lugar onde ela morou 
Na esperança de reencontrar seu caminho 
Eu fui me informar com o vizinho 
Do lugar onde ela mudou
Maria da Cruz
 
Perguntei, o vizinho de braço cruzado 
Me olhou com cara de invocado 
Parece que não me quis bem 
E Maria, menina tão doce, tão calma 
Que crucificou minha alma 
E a do vizinho também.
Maria da Cruz
 
Cadê Maria?...


  ",Maria da Cruz,Exaltasamba,Pagode,Sabe de quem é a composição? Envie pra gente.
"Me Apaixonei Pela Pessoa Errada
 
Eu não tenho culpa de estar te amando 
De ficar pensando em você toda hora 
Não entendo por que deixei acontecer 
Isso tudo me apavora
Me Apaixonei Pela Pessoa Errada
 
Você não tem culpa se eu estou sofrendo 
Se fantasiei de verde esta história 
Você tem namorado, posso até estar errado 
Mas tenho que ganhar você
Me Apaixonei Pela Pessoa Errada
 
É mais do que desejo, é muito mais do que amor 
Eu te vejo nos meus sonhos 
E isso aumenta mais a minha dor
Me Apaixonei Pela Pessoa Errada
 
Eu me apaixonei pela pessoa errada 
Ninguém sabe o quanto que estou sofrendo 
Sempre que eu vejo ele do seu lado 
Morro de ciúmes, estou enlouquecendo
Me Apaixonei Pela Pessoa Errada
 
Eu me apaixonei pela pessoa errada 
Ninguém sabe o quanto que estou sofrendo 
Sempre que eu vejo ele do seu lado 
Morro de ciúmes, estou enlouquecendo
Me Apaixonei Pela Pessoa Errada
 
Fica comigo, me deixa ao menos te tocar 
Entenda que ao meu lado é o seu lugar
Me Apaixonei Pela Pessoa Errada
 
Eu me apaixonei pela pessoa errada 
Ninguém sabe o quanto que estou sofrendo 
Sempre que eu vejo ele do seu lado 
Morro de ciúme, estou enlouquecendo
Me Apaixonei Pela Pessoa Errada
 
Eu me apaixonei pela pessoa errada 
Ninguém sabe o quanto que estou sofrendo 
Sempre que eu vejo ele do seu lado 
Morro de ciúme, estou enlouquecendo
Me Apaixonei Pela Pessoa Errada
 
Eu não tenho culpa de estar te amando 
De ficar pensando em você toda hora 
Não entendo por que deixei acontecer 
Isso tudo me apavora
Me Apaixonei Pela Pessoa Errada
 
Você não tem culpa se eu estou sofrendo 
Se fantasiei de verde essa história 
Você tem namorado, posso até estar errado 
Mas tenho que ganhar você
Me Apaixonei Pela Pessoa Errada
 
É mais do que desejo, é muito mais do que amor 
Eu te vejo nos meus sonhos 
E isso aumenta mais a minha dor
Me Apaixonei Pela Pessoa Errada
 
Eu me apaixonei pela pessoa errada 
Ninguém sabe o quanto que estou sofrendo 
Sempre que eu vejo ele do seu lado 
Morro de ciúmes, estou enlouquecendo
Me Apaixonei Pela Pessoa Errada
 
Eu me apaixonei pela pessoa errada 
Ninguém sabe o quanto que estou sofrendo 
Sempre que eu vejo ele do seu lado 
Morro de ciúmes, estou enlouquecendo
Me Apaixonei Pela Pessoa Errada
 
Eu me apaixonei pela pessoa errada 
Ninguém sabe o quanto que estou sofrendo 
Sempre que eu vejo ele do seu lado


  Essa informação está errada? Nos avise. ",Me Apaixonei Pela Pessoa Errada,Exaltasamba,Pagode,Composição: Cleber Bittencourt Santos / Pitter Corrêa. 
"Megastar
 
Pra te amar 
Me desenhei 
Um mega-star 
Pra não sofrer em vão 
Pra te amar 
Num sonho de luz 
Sem solidão 
Foi minha maior missão
Megastar
 
E certo de ser 
Um homem feliz 
Eu te amei 
Como jamais senti 
Por alguém assim 
Amor eu senti! 
Amor eu senti! 
Senti e ainda sinto
Megastar
 
Mas a minha lágrima 
O vento seca 
A minha voz 
Do peito se liberta 
Pois não foi em vão 
Não foi em vão 
O vento vai trazer 
Você pra mim
Megastar
 
Pra te amar 
Me desenhei 
Um mega-star 
Pra não sofrer em vão 
Pra te amar 
Num sonho de luz 
Sem solidão 
Foi minha maior missão
Megastar
 
E certo de ser 
Um homem feliz 
Eu te amei 
Como jamais senti 
Por alguém assim 
Amor eu senti! 
Amor eu senti! 
Senti e ainda sinto
Megastar
 
Mas a minha lágrima 
O vento seca 
A minha voz 
Do peito se liberta 
Pois não foi em vão 
Não foi em vão 
O vento vai trazer 
Você pra mim


  Essa informação está errada? Nos avise. ",Megastar,Exaltasamba,Pagode,Composição: Leandro Lehart. 
"Meia Hora
 
Trinta minutos perto de você pra mim é muito pouco, 
pra mim é absurdo. 
De noite na cama fico sem dormir 
o dia é muito curto, a noite é passageira, 
eu so queria ter você aqui, 
fazer de conta que nada aconteceu, 
você é minha cara metade, o presente que Deus me deu... 
Eu só quero que você entenda que o meu sentimento é verdadeiro, 
não era intenção te magoar... 
ReFrão:(2x) 
Volta pra mim 
Por favor diz que sim, 
Volta pro meu coração. 
Volta sem medo, sem dizer que não, 
Meia hora sem você é solidão.
Meia Hora
 
Você é minha cara metade, o presente que Deus me deu... 
Eu só quero que você entenda que o meu sentimento é verdadeiro, 
não era intenção te magoar...


  Essa informação está errada? Nos avise. ",Meia Hora,Exaltasamba,Pagode,Composição: Evelyn Araujo / Everton Alves. 
"Meu Amor é Demais
 
Laia la laia la laia la laia.... 
Sou teu fã agarradinho com vc eu vou 
É de maçã o gosto desse amor 
É tudo que eu sonhei pra mim 
Eu gamei, agente faz amor como ninguém, confesso pra vc me apaixonei 
As outras eu fazia por fazer 
O meu compromisso é te namorar 
To apaixonado todo mundo vê 
Deixa eu te provar que sou capaz 
E te mostrar que meu amor é demais 
Eu faço de tudo por vc 
Só quero uma chance, me deixa te amar 
Meu vício constante é te desejar 
Batendo na porta do seu coração 
Sou teu namorado, se entrega paixão
Meu Amor é Demais
 
;D


  Essa informação está errada? Nos avise. ",Meu Amor é Demais,Exaltasamba,Pagode,Composição: Caramelo / Leandro Filé / Marcelinho TDP. 
"Meu Desejo
 
Sempre é tão bom 
Estar contigo 
Mesmo estando longe 
Eu te ligo 
Só pra estar perto de você 
Todo o meu pranto 
Está caindo, e eu já não sei mais 
Como eu me sinto, 
Não me deixe só, por quê... 
Eu não sei viver 
Sem teu amor 
Está tão difícil essa dor 
(Vem logo, meu amor) 
Sem você não sei 
O que fazer 
Está tão difícil até viver 
(Sem você aqui) 
Amor eu te amo 
E te quero tanto 
Não me deixe sem você 
Amor eu te amo 
E te quero tanto 
Sem você não sei viver (BIS)


  ",Meu Desejo,Exaltasamba,Pagode,Sabe de quem é a composição? Envie pra gente.
"Meu Esquema
 
Ela é meu time de futebol, 
Ela é meu domingão de sol, 
Ela é meu esquema. 
Ela é meu conserto de rock in roll 
Nação, minha torcida gritando gol 
Minha Ipanema. 
Ela é meu curso de anatomia, 
Ela é meu retiro espiritual, 
Ela é minha história. 
Ela é meu desfile internacional, 
Ela é meu bloco de carnaval, 
Minha evolução. 
Galega, tento descrever o que é estar com você. 
Princesa, todos vão saber que eu estou muito bem, com você.
Meu Esquema
 
Ela é minha ilha da fantasia, 
A mais avançada das terapias, 
Meu play center. 
Ela é minha pista alucinada, 
A mais concorrida das baladas, 
Meu inferninho. 
Ela é meu esporte radical 
Poderosa, viciante, mas não faz mal 
Meu docinho. 
Ela é o que o meu médico receitou 
Ronaldinho Gaúcho mandando um gol 
Minha chapação. 
Galega, nem dá pra dizer o que é estar com você. 
Princesa, todo mundo vê que eu sou mais você.


  Essa informação está errada? Nos avise. ",Meu Esquema,Exaltasamba,Pagode,Composição: Fred Zero Quatro. 
"Meu Jeito de Amar
 
Nada que você venha falar 
vai curar o mal que me causou 
Nada que você possa fazer 
Vai aliviar a minha dor
Meu Jeito de Amar
 
Com certeza vou te perdoar 
Pois eu gosto muito de você 
Tudo vai voltar pro seu lugar 
Quando resolver me entender
Meu Jeito de Amar
 
O meu jeito de amar é assim 
Eu não sou de deixar perceber 
Eu não sou de ligar, de bajular 
O que que eu posso fazer? 
Eu preciso de um tempo pra mim 
Então para de me sufocar 
Eu aposto em você tem nada ver 
Basta querer confiar.


  Essa informação está errada? Nos avise. ",Meu Jeito de Amar,Exaltasamba,Pagode,Composição: Adriano Ribeiro. 
"Minha Dor
 
Ai, meu coração dói demais 
Ai, se essa canção fizesse você voltar
Minha Dor
 
Posso sentir a cada beijo seu 
Forte desejo, no lampejo eu te adorando 
Viajando preso no mar de paixão 
Onde a minha decisão não tem lugar
Minha Dor
 
Preso no mar de emoção 
Onde amar é lindo 
E a solidão não subtrai
Minha Dor
 
Mas, se por acaso 
Eu voltasse a te encontrar 
Nem pensar 
Será preciso de novo a gente separar
Minha Dor
 
O telefone toca e eu vou atender 
No desespero pensando que é você 
E novamente interurbano mas não é a sua voz 
Cai a madrugada 
Ligo o rádio e a nossa canção 
Me fere o peito, machucando o pobre coração 
Que ainda guarda esperança de você voltar
Minha Dor
 
Meu coração dói demais


  Essa informação está errada? Nos avise. ",Minha Dor,Exaltasamba,Pagode,Composição: Salgadinho / Mito. 
"Minha Razão
 
Eu me apaixonei tão de repente 
Feito um menino inocente 
Senti queimar meu coração
Minha Razão
 
Quando o cupido flecha a gente 
Tudo é tão claro e reluzente 
Sentindo o céu em nossas mãos
Minha Razão
 
Quando a paixão é verdadeira 
Tudo que era brincadeira 
Deixa de ser ilusão 
A felicidade é quem nos guia 
Eu agradeço a Deus o dia 
Em que peguei na sua Mão
Minha Razão
 
E é só você quem faz meu Sol nascer 
Clareia meu viver, minha razão 
E é bom demais se entregar assim 
E ver que não tem fim essa União


  Essa informação está errada? Nos avise. ",Minha Razão,Exaltasamba,Pagode,Composição: Pezinho / Thiaguinho. 
"Mini-saia
 
Eu fico na janela 
Esperando ela passar de minissaia 
É perna pra dedel, do chão ao céu 
Que fica sob a minissaia 
Ela usa pra provocar 
Rebolando ela vai sambar
Mini-saia
 
A saia roda, gira, todos viram que ela vinha 
Que alegria 
Isso é que ter bumbum 
A molecada para até o futebol 
O vento bate 
O Sol derrama o seu amor 
A cor do céu não é azul 
É rosa 
E a rua inteira reparou
Mini-saia
 
Na minissaia 
Isso é que ter bumbum 
Na minissaia 
Isso é que ter bumbum
Mini-saia
 
Ela sai assim de manhã 
Começa o dia já botando pra quebrar 
Sabe que é gostosa, fica toda prosa 
Quando sacode o seu balangandã
Mini-saia
 
A saia roda, gira, todos viram que ela vinha 
Que alegria 
Isso é que ter bumbum 
A molecada pára até o futebol 
O vento bate 
O sol derrama o seu amor 
A cor do céu não é azul 
É rosa 
E a rua inteira reparou
Mini-saia
 
Na minissaia 
Isso é que ter bumbum 
Na minissaia 
Isso é que ter bumbum
Mini-saia
 
Ela sai assim de manhã 
Começa o dia já botando pra quebrar 
Sabe que é gostosa, fica toda prosa 
Quando sacode o seu balangandã
Mini-saia
 
Eu fico na janela 
Esperando ela passar de minissaia 
É perna pra dedel, do chão ao céu 
Que fica sob a minissaia 
Ela usa pra provocar 
Rebolando ela vai sambar
Mini-saia
 
A saia roda, gira, todos viram que ela vinha 
Que alegria 
Isso é que ter bumbum 
A molecada para até o futebol 
O vento bate 
O Sol derrama o seu amor 
A cor do céu não é azul 
É rosa 
E a rua inteira reparou
Mini-saia
 
Ela sai assim de manhã 
Começa o dia já botando pra quebrar 
Sabe que é gostosa, fica toda prosa 
Quando sacode o seu balangandã
Mini-saia
 
A saia roda, gira, todos viram que ela vinha 
Que alegria 
Isso é que ter bumbum 
A molecada para até o futebol 
O vento bate 
O Sol derrama o seu amor 
A cor do céu não é azul 
É rosa 
E a rua inteira reparou
Mini-saia
 
Na minissaia 
Isso é que ter bumbum 
Na minissaia 
Isso é que ter bumbum
Mini-saia
 
A molecada para até o futebol 
O vento bate 
O Sol derrama o seu amor 
A cor do céu não é azul 
É rosa 
E a rua inteira reparou
Mini-saia
 
Na minissaia 
Isso é que ter bumbum 
Na minissaia 
Isso é que ter bumbum
Mini-saia
 
A molecada para até o futebol.. 
A cor do céu não é azul 
É rosa 
E a rua inteira reparou
Mini-saia
 
Na minissaia 
Isso é que ter bumbum 
Na minissaia 
Isso é que ter bumbum


  Essa informação está errada? Nos avise. ",Mini-saia,Exaltasamba,Pagode,Composição: Carlos Moura / Gabriel Moura / Valmir Ribeiro. 
"Miragem de Amor
 
Uma miragem de amor 
Que confundiu meu olhar 
Me iludiu por prazer 
Querendo me ver chorar 
Deserto, sede, calor 
Dentro do meu coração 
Destino de um sofredor 
Caminho sem direção 
Por onde o vento levar 
Eu me perdi na ilusão 
Mas consegui me encontrar 
De onde veio essa luz 
Que conseguiu apagar 
Essa miragem de amor 
Amor que me fez sonhar 
Sonhar... 
Nesse deserto é certo que eu vou encontrar 
Alguém por perto sem medo de se apaixonar 
Um verdadeiro amor, querendo entregar 
Seu coração pra quem tem coração pra amar


  Essa informação está errada? Nos avise. ",Miragem de Amor,Exaltasamba,Pagode,Composição: Adalto Magalha. 
"Muita Calma Nessa Hora
 
Eu não sou o tal 
Vacilo legal 
Mas vê lá como fala 
Tá ficando chato 
Ter que aturar 
Te ouvir gritar 
Na moral, melhor parar 
Tô te dando um papo
Muita Calma Nessa Hora
 
Menos, bem menos, chatice, o que eu quero é carinho mas só me dá dura 
Segura amor, segura 
Mais, quero mais, paciência, tô falando sério, não tô de frescura 
Segura amor, segura
Muita Calma Nessa Hora
 
Muita calma nessa hora 
Olha, eu não aguento mais 
Baixa a bola ou vou embora 
Sem olhar pra trás
Muita Calma Nessa Hora
 
Eu não sou o tal 
Vacilo legal 
Mas vê lá como fala 
Tá ficando chato 
Ter que aturar 
Te ouvir gritar 
Na moral, melhor parar 
Tô te dando um papo reto
Muita Calma Nessa Hora
 
Menos, bem menos, chatice, o que eu quero é carinho mas só me dá dura 
Segura amor, segura 
Mais, quero mais, paciência, tô falando sério, eu não tô de frescura não 
Segura amor, segura
Muita Calma Nessa Hora
 
Muita calma nessa hora 
Olha, eu não aguento mais 
Baixa a bola ou vou embora 
Sem olhar pra trás 
Muita calma nessa hora


  Essa informação está errada? Nos avise. ",Muita Calma Nessa Hora,Exaltasamba,Pagode,Composição: Thiaguinho. 
"Muleque Atrevido
 
Quem foi que falou 
Que eu não sou um moleque atrevido 
Ganhei minha fama de bamba 
No samba de roda 
Fico feliz em saber 
O que fiz pela música 
Faça favor 
Respeite quem pode chegar 
Onde a gente chegou 
Também somos linha de frente 
De toda essa história 
Nós somos do tempo do samba 
Sem grana, sem glória 
Não se discute talento 
Nem seu argumento 
Me faça o favor 
Respeite quem pode chegar 
Onde a gente chegou 
E a gente chegou muito bem 
Sem  desmerecer a ninguém 
Enfrentando no peito um certo preconceito 
E muito desdém 
Hoje em dia é fácil dizer 
Essa música é nossa raiz 
Tá chovendo de gente 
Que fala de samba 
E não sabe o que diz 
Por isso vê lá onde pisa 
Respeite a camisa que a gente suou 
Respeite quem pode chegar onde a gente chegou 
E quando chegar no terreiro procure primeiro 
Saber quem eu sou 
Respeitequem pode chegar onde a gente chegou


  Essa informação está errada? Nos avise. ",Muleque Atrevido,Exaltasamba,Pagode,Composição: Jorge Aragão / Paulinho Rezende. 
"Mulher Fatal
 
A gente se combina tanto. 
A gente faz amor legal. 
Eu já conheço tuas manhas teu jeito de mulher fatal. 
Se está zangada faz biquinho se está contente dá carinho,eu só te peço uma coisa me deixa eu beijar tua boca agora que eu te amo e te quero sem demora,o nosso amor já tem a mais linda história 
Que é contada em versos que eu fiz pra você. 
Mulher que mexe comigo por dentro,com meu pensamento o doce veneno eu invento que eu queo te deixar pra ver se mexo contigo no fim parece mais que me impus um castigo. 
Você me mostra logo esse sorriso maroto eu me entrego por inteiro parecendo um garoto querendo um brinquedo,sentindo desejo e essa ânsia acaba no mais lindo beijo...


  ",Mulher Fatal,Exaltasamba,Pagode,Sabe de quem é a composição? Envie pra gente.
"Nasci Pra Te Amar
 
Liga 
Chega de tanto sofrer 
Me diga 
Como é possível viver 
Sem brigar 
Se for preciso benzer 
Faz figa pra gente acertar 
Figa pra gente vencer 
Liga pra gente se amar 
Liga pra gente se vê
Nasci Pra Te Amar
 
Diga que eu sou o teu amor 
Teu calor, tua paz, tua vida 
Não se esqueça da grande paixão 
Que eu sinto por você 
Eu tenho o mundo pra te dar 
Não da pra você perceber 
Que não tem mais motivo pra gente brigar 
O dia pode escurecer 
A noite pode clarear 
O sol pode até se esconder 
Eu não vou esconder que eu nasci pra te amar


  Essa informação está errada? Nos avise. ",Nasci Pra Te Amar,Exaltasamba,Pagode,Composição: Arlindo Cruz / Sombra / Sombrinha. 
"Nem Pensar
 
Lá Laiá Laiá Laiá Laiá Laiá Laiááá
Nem Pensar
 
Se é pra falar de amor.. 
Me deixa começar 
Sou louco por você 
Só não sei demonstrar!
Nem Pensar
 
Se é pra falar de amor.. 
Meus olhos vão mostrar 
Em mim nada mudou 
Você sempre será..
Nem Pensar
 
A luz que ilumina meu céu 
Um cantinho bom de voltar 
É a canção que eu mais gosto 
É o meu lugar!
Nem Pensar
 
Não me deixa,nem pensar 
Eu faço o que for mas não pode acabar 
Não me deixa,nem pensar 
És a luz, minha luz 
Que não pode apagar...
Nem Pensar
 
Não me deixa,nem pensar 
Eu faço o que for mas não pode acabar 
Não me deixa,nem pensar 
És a luz, minha luz 
Que não pode apagar...


  Essa informação está errada? Nos avise. ",Nem Pensar,Exaltasamba,Pagode,Composição: Andrea Amadeu / Helder Celso / Valtinho Jota. 
"Ninguem É de Ninguem
 
Ninguém é dono de ninguém 
Mais é que o peito quando bate 
Bate bate sem parar 
Agente sofre igual refém 
Um prisioneiro da saudade 
Que maldade 
Faz doer 
Meu coração 
Assim foi roubado 
Nem reagiu 
Entregue ao pecado 
Nem quis saber 
Presente ou passado 
Nem questionou 
Se é certo ou errado 
Nem ta preocupado 
Todo apaixonado
Ninguem É de Ninguem
 
Faça comigo o que quiser 
Sou todo seu 
Sem compromisso 
Ta decidido 
Quero te amar 
Deixa rolar 
Pra ver no que vai dar


  ",Ninguem É de Ninguem,Exaltasamba,Pagode,Sabe de quem é a composição? Envie pra gente.
"Não Dá
 
A gente nasceu um pro outro 
Pra que vai fugir da verdade? 
As marcas ficaram no corpo 
Da primeira transa a saudade 
Não teve um amanhecer 
Que a gente não se entregou 
Repleto do teu prazer 
E o fogo do meu calor
Não Dá
 
Não sei até quando te espero 
Mas sei que ainda te quero 
Não posso negar meu desejo 
Eu perco o meu chão se te vejo 
Carente do meu amor 
Sofrendo sem ter por que 
Não vê que o meu coração 
Quer você, quer você 
Quer você, quer você
Não Dá
 
Não dá, não dá 
É tão difícil ficar sem você 
A gente não tem mais tempo á perder 
Não pode ser nosso fim
Não Dá
 
Não dá, não dá 
Por que não ama sem medo de errar 
Se quem errou foi querendo acertar 
Essa distância é ruim


  Essa informação está errada? Nos avise. ",Não Dá,Exaltasamba,Pagode,Composição: Felipe Silva / André Renato. 
"Não Deixe o Samba Morrer
 
Quando eu não puder 
Pisar mais na avenida 
Quando as minhas pernas 
Não puderem aguentar 
Levar meu corpo 
Junto com meu samba 
O meu anel de bamba 
Entrego a quem mereça usar
Não Deixe o Samba Morrer
 
Eu vou ficar 
No meio do povo, espiando 
Minha escola 
Perdendo ou ganhando 
Mais um carnaval
Não Deixe o Samba Morrer
 
Antes de me despedir 
Deixo ao sambista mais novo 
O meu pedido final...
Não Deixe o Samba Morrer
 
Não deixe o samba morrer 
Não deixe o samba acabar 
O morro foi feito de samba 
De samba, prá gente sambar


  Essa informação está errada? Nos avise. ",Não Deixe o Samba Morrer,Exaltasamba,Pagode,Composição: Aloisio / Edson Conceição. 
