Lyrics,Song,Artist,Genre,Composition
"Depuis l'temps
 
Depuis le temps que je brode sans relâche mon trousseau 
J'en ai vu passer des modes j'en ai tordu des ciseaux
Hélas je ne peux plus mettre mes culottes de pilou 
Sécher devant le fenêtre sans ameuter les voyous 
Depuis l'temps que j'l'attends, que j'l'attends
Depuis l'temps que j'l'attends, que j'l'attends mon prince charmant
Depuis l'temps
 
Voilà j'arrive mon aimée
Fais sécher tes culottes au mépris des méchants 
Longtemps déjà je t'ai cherchée
Foin des petites sottes et leurs nylons alléchants
Depuis l'temps
 
J'ai des piles de chemises attachées d'une faveur
Jamais je ne les ai mises il en aura la primeur 
J'ai brodé des kilomètres de torchons et de draps blancs
Ne me reste plus qu'à mettre ses initiales dedans
Depuis l'temps que j'l'attends, que j'l'attends
Depuis l'temps que j'l'attends, que j'l'attends mon prince charmant
Depuis l'temps
 
Voilà j'arrive mon aimée
Tu peux broder mon S à côté de ton A 
Longtemps déjà je t'ai cherchée
Tant pis pour la jeunesse on fait avec ce qu'on a
Depuis l'temps
 
J'ai astiqué les armoires au point d'en user le bois
J'ai jeté ma bassinoire, avec lui je n'aurai pas froid
Pour le lit j'ai en réserve celui de mes grands-parents
Il est grand temps qu'il resserve depuis bientôt 60 ans
Depuis l'temps que j'l'attends, que j'l'attends
Depuis l'temps que j'l'attends, que j'l'attends mon prince charmant
Depuis l'temps
 
Voilà j'arrive mon aimée
De ton lit je m'en charge il va se réveiller
Vu le temps que je t'ai cherchée
S'il n'est pas assez large on n'aura qu'un oreiller
Depuis l'temps
 
Je dois dire que je penche pour un certain décorum 
Un mariage en robe blanche avec beaucoup d'harmonium
Monsieur l'abbé Lacouture celui qui doit nous marier
Pense que telle aventure se doit d'être enjolivée
Depuis l'temps que j'l'attends, que j'l'attends
Depuis l'temps que j'l'attends, que j'l'attends mon prince charmant
Depuis l'temps
 
Tranquillise-toi mon aimée 
S'il n'est pas trop mariolle amène ton curé
Longtemps déjà je t'ai cherchée
Et pour la gaudriole plus besoin du clergé
Depuis l'temps
 
Je ne savais pas qu'un homme c'était aussi déroutant
Ce doit être ce qu'on nomme un Don Juan et pourtant
Je pense à ce que ma mère a failli me dire un soir 
Des choses bien singulières, que je ne veux pas savoir 
Depuis l'temps que j'l'attends, que j'l'attends
Depuis l'temps que j'l'attends, j'ai des doutes maintenant
Depuis l'temps
 
Voilà j'arrive mon aimée
Que madame ta mère excuse mes propos 
Mais pourquoi donc t'ai-je cherchée
La vie est trop amère avec une vieille peau
Depuis l'temps
 
Depuis l'temps que j'l'attends, que j'l'attends ...


  ",Depuis l'temps,Anne Sylvestre,,Sabe de quem é a composição? Envie pra gente.
"Des fleurs pour Gabrielle
 
N'en parlez pas, n'y touchez plus
Vous avez fait assez de mal 
Il ne sera jamais normal 
Que par tristesse l'on se tue
Des fleurs pour Gabrielle
 
Mais avoir vu tout mélangé 
De grosses mains dans votre cœur 
Dans votre âme des étrangers 
Il y a de quoi prendre peur
Des fleurs pour Gabrielle
 
Et c'était un amour peut-être
Un amour pourquoi, un amour comment 
Un qu'on ne met pas aux fenêtres
Un qui ne ferait pas même un roman
Des fleurs pour Gabrielle
 
En brandissant votre conscience 
Vous avez jugé au nom de quel droit 
Vos poids ne sont dans la balance 
Pas toujours les mêmes, on ne sait pourquoi
Des fleurs pour Gabrielle
 
Monsieur pognon peut bien demain 
S'offrir mademoiselle machin
Quinze ans trois mois et quelques jours 
On parlera de grand amour
Des fleurs pour Gabrielle
 
N'en parlez pas, n'y touchez plus
Mais savez-vous de qui je parle ? 
Il ne sera jamais normal 
Qu'on tue et qu'on y pense plus
Des fleurs pour Gabrielle
 
Mais avoir vu tout saccagé 
Et dans son âme et dans son corps 
Mais trouver partout le danger 
Il y a de quoi prendre mort
Des fleurs pour Gabrielle
 
Et c'était un amour peut-être
Un amour printemps, un amour souci 
Un qu'on ne met pas aux fenêtres
Un qui pouvait faire du mal à qui ?
Des fleurs pour Gabrielle
 
Si j'avais su, si j'avais su
Que vous vous penchiez au bord de ce trou 
D'un coup d'avion serais venue
Pour vous retenir là au bord de vous
Des fleurs pour Gabrielle
 
Monsieur pognon ne mourra pas 
Mamzelle machin, la bague au doigt,  
Étalera son grand amour 
Avec quelques diamants autour
Des fleurs pour Gabrielle
 
Le printemps déplie ses feuilles 
La liberté nous berce encore 
Nous qui sommes toujours dehors 
Il se pourrait bien que l'on veuille
Nous couper les ailes aussi
Des fleurs pour Gabrielle
 
Je vous dédie ces quelques fleurs 
J'aurais pu être comme vous
Et tomber dans le même trou 
Je vous comprends si bien, ma sœur,  
Vous restez un de mes soucis
Des fleurs pour Gabrielle
 
On n'a pas arrêté la meule
Où d'autres se feront broyer
Et vous ne serez pas la seule,  
Ça ne peut pas vous consoler


  ",Des fleurs pour Gabrielle,Anne Sylvestre,,Sabe de quem é a composição? Envie pra gente.
"Douce-amère
 
Si je remonte au long des mailles qui ont pêché mes souvenirs 
Je sens bien que vaille que vaille, c'est dur de se redevenir
Et je revois la tristelette qui se noyait dans un chagrin 
Osant à peine dire faites, faites trois tours dans mon jardin
Douce-amère
 
Quand j'étais la douce-amère, qu'on cueille au bord d'un chemin
Qui n'est jamais la première, ni la même que demain
Douce-amère
 
Mais, vois-tu cette sauvagine, la sœur des ronces, des orties 
Me plaisait bien et j'imagine que tu l'aurais aimée aussi
Il fallait pourtant que je change, que je devienne en me fanant 
Cette fleur faussement étrange qui disait en se pavanant
Douce-amère
 
Moi, je suis la douce-amère, moitié miel et moitié feu 
Mes aveux sont des mystères, mes mensonges, des aveux
Douce-amère
 
Le temps que je te reconnaisse, le temps que tu me veuilles bien 
J'ai gagné un peu de tristesse, le temps me ramène et je viens
Si je garde un peu d'amertume, toute douceur m'est revenue
Il faudra que l'on s'accoutume à me voir ainsi devenue
Douce-amère
 
Devenue ta douce-amère, moitié peine, moitié cœur 
Avec toi pour seul mystère, moitié veine, moitié peur 
Douce amère pour ton cœur


  Essa informação está errada? Nos avise. ",Douce-amère,Anne Sylvestre,,Composição: Anne Sylvestre. 
"Douce maison
 
C'était une maison douce, une maison de bon aloi
Juste ce qu'il faut de mousse répartie aux bons endroits
Assez de murs pour connaître une chaleur bien à soi 
Et ce qu'il faut de fenêtres pour regarder sans effroi
Douce maison
 
Non, non, je n'invente pas
Mais je raconte tout droit
Douce maison
 
Elle ouvrait parfois sa porte à ceux qu'elle choisissait
La serrure n'est pas forte, maison, tu n'as pas dé clé
Mais avec sa confiance jamais elle ne pensa 
Qu'on pût user de violence pour pénétrer sous son toit
Douce maison
 
Non, non, je n'invente pas
Mais je raconte tout droit
Douce maison
 
Advint qu'un jour de malchance une bande s'approcha
On sonne à la porte, on lance des coups de pieds ça et là 
A plusieurs, on s'encourage, on prétend qu'elle ouvrira
Et commence le saccage, la porte on l'enfoncera
Douce maison
 
Non, non, je n'invente pas
Mais je raconte tout droit
Douce maison
 
Sauvagement ils pénètrent, dévastant tout devant eux 
Ils obligent les fenêtres à s'ouvrir devant le feu
Avec leurs couteaux ils gravent des insultes sur les murs 
Et s'en vont faisant les braves quand tout n'est plus que blessure
Douce maison
 
Non, non, je n'invente pas
Mais je raconte tout droit
Douce maison
 
La maison, depuis ce crime, n'a plus d'âme ni de nom
Mais elle n'est pas victime, c'est de sa faute, dit-on
Il paraît qu'elle a fait preuve d'un peu de coquetterie
Avec sa toiture neuve et son jardin bien fleuri
Douce maison
 
Non, non, je n'invente pas
Mais je raconte tout droit
Douce maison
 
D'ailleurs, une maison sage ne reste pas isolée
Celles qui sont au village se font toujours respecter 
Quand on n'a pas de serrure, il faut avoir un gardien
C'est chercher les aventures que de fleurir son jardin
Douce maison
 
Non, non, je n'invente pas
Mais je raconte tout droit
Douce maison
 
Si vous passez par la route et si vous avez du câur 
Vous en pleurerez sans doute, c'est l'image du malheur
Mais rien, pas même vos larmes, ne lui portera secours 
Elle est loin de ses alarmes, elle est fermée pour toujours
Douce maison
 
Non, non, je n'invente pas
Mais je raconte tout droit
Douce maison
 
Si j'ai raconté l'histoire de la maison violentée
C'est pas pour qu'on puisse croire qu'il suffit de s'indigner
Il faut que cela s'arrête, on doit pouvoir vivre en paix
Même en ouvrant sa fenêtre, même en n'ayant pas de clé
Douce maison
 
Non, non, je n'invente pas
Mais je raconte tout droit


  Essa informação está errada? Nos avise. ",Douce maison,Anne Sylvestre,,Composição: Anne Sylvestre. 
"Douze petits cochons
 
Douze jolis petits cochons 
Douze cochons qui tournent en rond 
Tu en prends un et puis tu danses 
Il te fera la révérence 
Si tu le montres à ta maman 
Il lui dira Bonjour Madame 
Voulez-vous admirer comment 
Comment je danse la pavane ? 
Voyez 
Mes pieds 
Je suis rose et je sais danser
Douze petits cochons
 
Douze jolis petits cochons 
Trois petits tours ils grandiront 
Si tu viens dans quelques semaines 
Ton cavalier sera plus le même 
Si tu le montres à ta maman 
Il grognera Bonsoir Madame 
J'ai faim, j'ai soif, j'ai pas le temps
Le temps de danser la pavane 
Voyez 
Mes pieds 
Ils sont sales et je vais manger.


  ",Douze petits cochons,Anne Sylvestre,,Sabe de quem é a composição? Envie pra gente.
"Ecrire pour ne pas mourir
 
Que je sois née d'hier ou d'avant le déluge
J'ai souvent l'impression de tout recommencer
Que j'ai pris ma revanche ou bien trouvé refuge
Dans mes chansons, toujours, j'ai voulu exister
Que vous sachiez de moi ce que j'en veux bien dire
Que vous soyez fidèles ou bien simples passants 
Et que nous en soyons justes au premier sourire 
Sachez ce qui, pour moi, est le plus important 
Oui le plus important
Ecrire pour ne pas mourir
 
Écrire pour ne pas mourir 
Écrire, sagesse ou délire, écrire pour tenter de dire, dire 
Tout ce qui m'a blessé, dire tout ce qui m'a sauvé
Écrire et me débarrasser 
Écrire pour ne pas sombrer 
Écrire, au lieu de tournoyer 
Écrire et ne jamais pleurer rien que des larmes de stylo 
Qui viennent se changer en mots pour me tenir le cœur au chaud
Ecrire pour ne pas mourir
 
Que je vive cent ans ou bien quelques décades 
Je ne supporte pas de voir le temps passer 
On arpente sa vie au pas de promenade 
Et puis on s'aperçoit qu'il faudra se presser
Que vous soyez tranquilles ou plein d'inquiétude
Ce que je vais vous dire, vous le comprendrez 
En mettant bout à bout toutes nos solitudes 
On pourrait se sentir un peu moins effrayés 
Un peu moins effrayés
Ecrire pour ne pas mourir
 
Écrire pour ne pas mourir 
Écrire, tendresse ou plaisir, écrire pour tenter de dire, dire 
Tout ce que j'ai compris, dire l'amour et le mépris
Écrire, me sauver de l'oubli
Ecrire pour tout raconter 
Écrire au lieu de regretter 
Écrire et ne rien oublier 
Et même inventer quelques rêves de ceux qui empêchent qu'on crève
Quand l'écriture, un jour, s'achève
Ecrire pour ne pas mourir
 
Qu'on m'écoute en passant, d'une oreille distraite
Ou qu'on ait l'impression de trop me ressembler
Je voudrais que ces mots qui me sont une fête 
On ne se dépêche pas d'aller les oublier
Et que vous soyez critiques ou plein de bienveillance 
Je ne recherche pas toujours ce qui vous plait 
Quand je soigne mes mots, c'est à moi que je pense
Je veux me regarder sans honte et sans regrets 
Sans honte et sans regrets
Ecrire pour ne pas mourir
 
Écrire pour ne pas mourir 
Écrire, grimacer, sourire, écrire et ne pas me dédire, dire 
Ce que je n'ai su faire
Dire pour ne pas me défaire, écrire, habiller ma colère 
Écrire pour être égoïste 
Écrire ce qui me résiste 
Écrire et ne pas vivre triste et me dissoudre dans les mots 
Qui soient ma joie et mon repos 
Écrire et ne pas me foutre à l'eau
Et me dissoudre dans les mots 
Qui soient ma joie et mon repos 
Écrire et pas me foutre à l'eau
Écrire pour ne pas mourir 
Pour ne pas mourir


  Essa informação está errada? Nos avise. ",Ecrire pour ne pas mourir,Anne Sylvestre,,Composição: Anne Sylvestre. 
"Elle fait la gueule
 
Elle voulait la Lune 
Mais j'avais pas la fusée
Elle a des lacunes 
Trop en colère c'est abusé
En classe affaire de Marignan à Marrakech 
Malgré tout ça elle râle encore elle fait la tête 
Je suis pas le mec à Milla 
Si tu fais la folle je te vire comme un pirate 
Je suis pas le mec à Milla 
Si tu fais la folle je te vire comme un pirate 
Un pied dans la musique un pied dans la rue pour les connections 
Je sais ce que je fais si tu crois plus en moi change de direction
Elle fait la gueule
 
Je suis plus dans la street mais je fais les comptes 
Sans faire la moula (sans faire la moula) 
Connu dans la France 
Trop d'influence, Cyril Hanouna (Cyril Hanouna)
Je lui dis regarde l'avion
J'ai vu un gros boule passer
En Gucci Versacce, c'est moi dans le classe G (classe G)
Elle fait la gueule
 
On perd notre temps rien qu'on s'embrouille, faut arrêter
L'amour n'a pas de prix
Je ne sais plus combien j'ai dépensé
Quand je rentre tard elle fait la gueule mais j'ai bossé
Quand je rentre tard elle fait la gueule mais j'ai bossé 
Elle fait la gueule
 
Elle casse la tête jour et nuit 
Mais c'est mon bébé
Elle était maligne 
Elle fouillait mon tel à chaque fois que je dormais 
Quand je répond aux femmes que elle jalouse 
Que elle crée des tensions 
Elle dit que je la trompe jour et nuit comme un mauvais garçon 
Je vais tourner la page rentre pas dans son jeu ça va s'empirer
Elle fait la gueule
 
Je retourne faire les sous j'ai pas le temps de m'embrouiller
J'ai pas le temps de crier
J'ai plus rien à dire je te laisse parler à la messagerie
Je veux plus refaire ma vie je suis trop parano je suis un artiste
Elle fait la gueule
 
Je suis plus dans la street mais je fais les comptes 
Sans faire la moula (sans faire la moula) 
Connu dans la France 
Trop d'influence, Cyril Hanouna (Cyril Hanouna)
Je lui dis regarde l'avion
J'ai vu un gros boule passer
En Gucci Versacce, c'est moi dans le classe G (classe G)
Elle fait la gueule
 
On perd notre temps rien qu'on s'embrouille, faut arrêter
L'amour n'a pas de prix
Je ne sais plus combien j'ai dépensé
Quand je rentre tard elle fait la gueule mais j'ai bossé
Quand je rentre tard elle fait la gueule mais j'ai bossé
On perd notre temps rien qu'on s'embrouille, faut arrêter
L'amour n'a pas de prix
Je ne sais plus combien j'ai dépensé
Elle fait la gueule
 
Quand je rentre tard elle fait la gueule mais j'ai bossé
Quand je rentre tard elle fait la gueule mais j'ai bossé


  Essa informação está errada? Nos avise. ",Elle fait la gueule,Anne Sylvestre,,Composição: Anne Sylvestre. 
"Faites Moi Plutôt La Cour
 
S'il faut parler, faisons causette
Vous avez une jolie voix 
Je crois deviner que vous n'êtes
Pas seulement ce qu'on en voit
Mais pourquoi brûler les étapes 
Et ne pas flâner en chemin? 
Comme les mouches, on ne m'attrape
Pas du premier revers de main
Faites Moi Plutôt La Cour
 
Faites-moi plutôt la cour 
Ça devient rare de nos jours 
On ne se tourne plus autour 
N'importe qui peut faire l'amour
Comme une simple performance 
Mais l'élégance
Mais l'espérance
Faites Moi Plutôt La Cour
 
De se frôler dans un détour 
Mais la patience 
Ça n'a plus cours
Faites Moi Plutôt La Cour
 
S'il faut toucher dès qu'on approche
N'approchez pas, ça sera mieux
S'il faut pour ne pas être cloche
Se réveiller près d'un monsieur
Dont on ne connaît pas l'enfance
A peine la couleur des yeux 
Si c'est fini quand ça commence
Voyez, ça me fatigue un peu
Faites Moi Plutôt La Cour
 
Faites-moi plutôt la cour 
Ça devient rare de nos jours 
On ne se tourne plus autour 
N'importe qui peut faire l'amour
Comme une simple performance
Faites Moi Plutôt La Cour
 
Mais l'élégance
Mais l'espérance
De se frôler dans un détour 
Mais la patience 
Ça n'a plus cours
Faites Moi Plutôt La Cour
 
Si on ne risque pas d'entendre
Le moindre battement de cœur 
Si c'est ridicule d'attendre
Que l'on se fasse un peu moins peur
Moi, je n'ai rien d'une acrobate
Je préfère le sentiment 
S'il faut aimer comme on se gratte
Ça ne m'amuse pas vraiment
Faites Moi Plutôt La Cour
 
Faites-moi plutôt la cour 
Ça devient rare de nos jours 
On ne se tourne plus autour
Faites Moi Plutôt La Cour
 
N'importe qui peut faire l'amour
Comme une simple performance 
Mais l'élégance
Mais l'espérance
De se frôler dans un détour 
Mais la patience 
Ça n'a plus cours
Faites Moi Plutôt La Cour
 
S'il faut supprimer la musique
Et ne garder que le tempo 
S'il faut faire la gymnastique
Et tordre le cou aux oiseaux 
Allez, vous vous trompez d'adresse
Et vous trouverez bien ailleurs 
À moins que d'une histoire de fesses
Vous fassiez une histoire de cœur
Faites Moi Plutôt La Cour
 
Faites-moi déjà la cour 
Et nous verrons dans quelques jours 
Quand vous m'aurez tourné autour
Nous verrons si ces beaux discours 
Ont toujours autant d'importance
Et l'élégance
Et l'espérance
De se frôler dans un détour 
Et la patience 
Pourront toujours 
Vivre dans les chansons d'amour
Rien que dans les chansons d'amour


  ",Faites Moi Plutôt La Cour,Anne Sylvestre,,Sabe de quem é a composição? Envie pra gente.
"Faites-moi souffrir
 
Ah, ha! Ah, ha! Ah, ha! Ah, ha!
Faites-moi souffrir
 
Oui! Faites-moi souffrir 
Arrachez-moi de beaux soupirs 
Je ferai des chansons sublimes 
Oh, oui! Refusez-vous 
Oh! Laissez-moi mourir de vous 
Venez m'assassiner de rimes
Voyez ces beaux regrets 
Comme dentelles de calais 
Que ça fera un beau costume! 
Désirs inassouvis 
Étalage de broderies 
Au ravissant point d'amertume
Faites-moi souffrir
 
Ah, ha! Ah, ha! Ah, ha! Ah, ha!
Faites-moi souffrir
 
Oui! Faites-moi languir 
Éparpillez tous vos sourires 
Regardez-moi en transparence 
Oui! Gaspillez le temps 
Comme si nous en avions tant 
Qu'il n'aurait aucune importance
Promesses non tenues 
Rêves brisés, sitôt venus 
Donneront des superbes 
Silences anodins 
Pas égarés dans des jardins 
Où ne repoussera plus l'herbe
Faites-moi souffrir
 
Ah, ha! Ah, ha! Ah, ha! Ah, ha!
Faites-moi souffrir
 
Oui! Faites-moi mourir 
Envoyez-moi m'ensevelir
Sous un niagara de larmes 
Oh, oui! Balancez-moi 
Entre la froideur et l'émoi
Retirez-moi toutes mes armes 
Je vous aime si fort 
Que me demandez-vous encore? 
Auriez-vous tant besoin de preuves? 
Non! Essayez plutôt 
De me mettre le bec dans l'eau
Et d'inverser le cours du fleuve
Faites-moi souffrir
 
Ah, ha! Ah, ha! Ah, ha! Ah, ha!
Faites-moi souffrir
 
Oui! Faites-moi sourire 
Moi, je veux bien ne plus écrire 
Que des romances, des bluettes 
Oh, oui! Rassurez-vous 
Et j'écrirai à vos genoux
Quelques chansons d'amour simplettes
Faites-moi souffrir
 
Ah, ha! Ah, ha! Ah, ha! Ah, ha! 
Oh, oui!


  ",Faites-moi souffrir,Anne Sylvestre,,Sabe de quem é a composição? Envie pra gente.
"Faluron-lurette
 
Ne craignez-vous point, Lisette 
Qu'à jouer du faluron
Cette attitude ne jette 
Après vous force lurons 
Encore que bien fluette 
Vous différez d'un bâton
Pour peu qu'en l'eau on vous jette
Vous y traceriez un rond
Faluron-lurette
 
On voudrait fleurette 
Sur vos doigts compter 
Maluron-lurette 
Maluron-luré
Faluron-lurette
 
Pour y débusquer, Lisette 
Votre plus joli fleuron 
Sachez que se mettent en quête 
Fier-à-bras et fanfarons 
Y a pourtant belle lurette 
Que la fleur à cent façons 
Chantait faluron-lurette 
Sur trois pieds de vert gazon
Faluron-lurette
 
On voudrait fleurette 
Sur vos doigts compter 
Maluron-lurette 
Maluron-luré
Faluron-lurette
 
Or, sait-on jamais, Lisette 
Ce que les hommes feront? 
Un jour ils vous font la fête 
Lendemain ils vous fuiront 
Eûssiez-vous derrière la tête 
Deux ou trois décamérons 
Vous leur chantez falurette 
Eux n'y voient que faluron
Faluron-lurette
 
On voudrait fleurette 
Sur vos doigts compter 
Maluron-lurette 
Maluron-luré
Faluron-lurette
 
Lors, si m'en croyez, Lisette
Laissez-les tourner en rond 
Et du diable s'ils n'arrêtent
D'eux-mêmes leurs tourbillons
À vous de vous mettre en quête 
De celui pour qui faluron 
Est un placement honnête 
Que l'on garde en sa maison
Faluron-lurette
 
Vous devrez fleurette 
Lui abandonner 
Vous serez, lurette 
Bien enluronnée


  Essa informação está errada? Nos avise. ",Faluron-lurette,Anne Sylvestre,,Composição: Anne Sylvestre. 
"Flocon Papillon
 
Flocon, papillon, la fenêtre, la fenêtre 
Flocon, papillon, la fenêtre est en coton
Flocon Papillon
 
Il neige doux, il neige doux, tout près du feu, resserrons-nous 
Il neige doux, il neige doux, la terre est noire par-dessous
Flocon Papillon
 
Flocon, papillon, la fenêtre, la fenêtre 
Flocon, papillon, la fenêtre est en coton
Flocon Papillon
 
Il neige froid, il neige froid, mettez vos capuchons tout droits 
Il neige froid, il neige froid, la tortue s'est cachée, je crois
Flocon Papillon
 
Flocon, papillon, la fenêtre, la fenêtre 
Flocon, papillon, la fenêtre est en coton
Flocon Papillon
 
Il neige blanc, il neige blanc, ne tombez pas en repartant. 
Il neige blanc, il neige blanc, il neige un peu pour les enfants
Flocon Papillon
 
Flocon, papillon, la fenêtre, la fenêtre 
Flocon, papillon, la fenêtre est en coton
Flocon Papillon
 
Il neigera, il neigera, puis un jour le printemps viendra 
Et sur les branches, il neigera des fleurs de pommes et du lilas


  Essa informação está errada? Nos avise. ",Flocon Papillon,Anne Sylvestre,,Composição: Anne Sylvestre. 
"Flou
 
Quand elle lui disait je t\'aime 
Il prenait un air surpris 
C'était l'évidence même
A quoi bon l'eût-elle dit ?
Quand elle insistait regarde,  
Suis-je vraiment à ton goût ? 
A son expression hagarde 
On l'aurait pris pour un fou
Et quand elle le secouait 
II lâchait d'un air distrait
Flou
 
Flou, je te vois flou 
Je vois comme un brouillard partout 
Autour de tes yeux de tes joues 
Et ton corps qui est en dessous 
Je ne le vois plus du tout 
Flou, je te vois flou 
Tu peux bien te pendre à mon cou 
Tu peux m'arracher des mots doux
Tu peux grimper sur mes genoux 
Je te vois flou
Flou
 
Elle lui disait ça m\'inquiète 
Tu me voyais bien pourtant 
II te faudrait des lunettes 
Tu pourrais de temps en temps 
Me dire que je suis belle 
Mais ses yeux étaient restés 
Tout au fond de ses jumelles 
Où il était enlisé 
Car en face il regardait 
Une autre qui s'en doutait
Flou
 
Flou, tu me vois flou 
Et moi qui t'aime et qui l'avoue
Je ris, je pleure, tu t'en fous
Mais de la fille qui se joue 
Tu connais tout, tout, tout 
Flou, tu me vois flou 
Je peux me tatouer partout 
Je peux me teindre en acajou 
Je peux te faire un charme fou 
Tu me vois flou
Flou
 
Un jour, pour que ça lui passe 
Elle partit s'installer
A la fenêtre d'en face
Où il la vit s'exposer
Mais sans plus la reconnaître 
Alors il la découvrit 
Cramponné à sa fenêtre 
II la guettait jour et nuit 
Mais c'est elle qui pensa
En l'apercevant là-bas
Flou
 
Flou, je te vois flou 
Et moi qui croyais bien que nous 
Vivions un amour à genoux 
Tu es un homme comme tous 
Ceux que je vois partout 
Flou, je te vois flou 
Y a quelque chose là-dessous 
Qui me chagrine un peu beaucoup 
Où est passé mon amour fou ? 
Je le vois flou
Flou
 
Flou, on se voit flou 
Mais pourquoi se rouer de coups ? 
Pourquoi hurler comme des loups 
Si tu dis que ces jeux de fous 
Ne changent rien pour nous ? 
Flou, on se verra flou 
Et quand je ferai les yeux doux 
Toi, tu ne seras pas jaloux 
On pourra vivre tranquillou 
Un amour flou, flou, flou 
Flou et voilà tout


  ",Flou,Anne Sylvestre,,Sabe de quem é a composição? Envie pra gente.
"Frangines
 
Ce fut à l'école, déjà
Qu'on fit de nous des concurrentes
On se regardait chien et chat 
On détestait les redoublantes 
Souffre-douleur ou bien fayotes 
On se poussait toujours plus haut 
On s'arrachait les bonnes notes
On pleurait devant le tableau
Frangines
 
On aurait pu rester frangines 
Ça nous aurait gagné du temps 
Au coude à coude, j'imagine
Qu'il n'aurait pas fallu longtemps
Pour qu'on soit toutes aussi bonnes
Malgré les pionnes 
Et les parents
Frangines
 
Ensuite, en face des garçons 
Commença la grande offensive 
On se fabriquait des façons 
Des rendez-vous sur l'autre rive
Et grande bringue ou Blanche-Neige 
C'était à qui amènerait
Tous les boutonneux du collège 
À l'accompagner sur le quai
Frangines
 
On aurait pu rester frangines 
Ça nous aurait gagné du temps 
Bras dessus-dessous, j'imagine
Qu'on aurait, de ces débutants
Avant que la vie n'les assomme
Pu faire des hommes 
Pas des enfants
Frangines
 
Un peu plus tard, c'est la beauté
Qu'on nous érigea en barrière
On se retrouvait insultée 
Si on n'était pas la première
Nos amitiés faisaient sourire 
Fallait nous crêper le chignon 
Et tout ce qu'on pouvait se dire
N'était que fadaises ou chiffons
Frangines
 
On aurait pu rester frangines 
Ça nous aurait gagné du temps 
Main sur l'épaule, j'imagine
Qu'on aurait pu, se regardant
Voir qu'on était toutes assez belles
Et même celles 
Qui ont pas le temps
Frangines
 
C'est tout pareil dans nos métiers
On nous oppose et on nous monte 
En épingle, pour mieux montrer 
Qu'on se trouve en dehors du compte
Pour peu qu'on dépasse la tête
On est toujours une exception 
Chacune sur notre planète 
Ce qu'on a pu tourner en rond!
Frangines
 
Si on se retrouvait, frangines 
On n'aurait pas perdu son temps
Unissant nos voix, j'imagine
Qu'on en dirait vingt fois autant
Et qu'on ferait changer les choses
Et je suppose, aussi, les gens
Frangines
 
Et qu'on ferait changer les choses
Allez! On ose 
Il est grand temps


  ",Frangines,Anne Sylvestre,,Sabe de quem é a composição? Envie pra gente.
