Lyrics,Song,Artist,Genre,Composition
"Mère, Veux-tu?
 
Mère, veux-tu? 
Oui, ma fille 
Combien d'pas veux-tu passer?
Mère, veux-tu? 
Sois gentille 
J'voudrais tant m'en aller danser
Mère, Veux-tu?
 
Pour le bal je suis tranquille 
Tu voudrais des pas d'géant
Mais ton cœur est si fragile 
Je n't'en donnerai pas autant
Pour aller danser la gigue 
Tu n'auras qu'six pas d'fourmis
Et si sauter te fatigue 
Deux pas de statue aussi
Mère, Veux-tu?
 
Mère, veux-tu? 
Oui, ma fille 
Combien d'pas veux-tu passer?
Mère, veux-tu? 
Sois gentille 
J'voudrais tant m'en aller danser
Mère, Veux-tu?
 
Mais quand tu verras Jean-Jacques 
Tu voudras des pas d'velours
Ou des pas de cloches de Pâques 
Qui font Rome aller-retour 
Tu voudras des pas de lierre 
Pour t'accrocher à son cou
Lui n'aura qu'des pas de pierre
Ça n't'avancera pas beaucoup
Mère, Veux-tu?
 
Mère, veux-tu? 
Oui, ma fille 
Combien d'pas veux-tu passer?
Mère, veux-tu? 
Sois gentille 
J'voudrais tant m'en aller danser
Mère, Veux-tu?
 
Tu voudras des pas de chatte 
Pour l'aimer en tapinois
Lui n'a que ses grandes pattes
Juste bonnes à gauler les noix 
Pour gauler ton cœur, ma douce 
Lui faudrait des pas d'oiseau
Ou des pas de bêtes rousses 
Embusquées dans les roseaux
Mère, Veux-tu?
 
Mère, veux-tu? 
Oui, ma fille 
Combien d'pas veux-tu passer?
Mère, veux-tu? 
Sois gentille 
J'voudrais tant m'en aller danser
Mère, Veux-tu?
 
Qui lui a donné, misère 
Tous ces pas de grand chamois? 
Tu n'écoutes plus ta mère
Tous tes pas sentent l'émoi
Il te va falloir, ma fille 
Marcher à pas de folie 
A grands pas de jours qui brillent 
A grands pas de longues nuits
Mère, Veux-tu?
 
Mère, veux-tu? 
Oui ma fille 
Combien d'pas veux-tu passer?
Mère, veux-tu? 
Oui, ma fille 
Combien d'pas t'en vas-tu passer?


  ","Mère, Veux-tu?",Anne Sylvestre,,Sabe de quem é a composição? Envie pra gente.
"Muse-musaraigne
 
Muse-musaraigne 
N'aime pas les châtaignes
N'aime pas les glands
Ni la mousse 
Ni les pousses 
Du sureau tout blanc 
Muse-musaraigne 
Les mouches la craignent 
Et les vers luisants 
Mais pas les harengs 
Ni les enfants 
Ni les e-enfants


  ",Muse-musaraigne,Anne Sylvestre,,Sabe de quem é a composição? Envie pra gente.
"Noël au bout du monde
 
Ton Noël au bout du monde,  
Dis-moi comment tu le fais 
Il faut que tu me répondes 
S'il te plaît, 
Quelquefois je t'imagine
Mais je ne sais pas très bien,  
Ton pays je le devine 
De très loin
Noël au bout du monde
 
{Refrain:} 
Mets-tu des guirlandes 
Sur un bananier 
Ou bien sur les branches 
Du frangipanier 
Qui a de belles fleurs si blanches ?
Noël au bout du monde
 
Noël a des sortilèges 
Que toi, tu ne connais pas 
Noël pour moi, c'est la neige, 
C'est le froid
Aussi j'ai bien de la peine
A le penser en couleurs 
A rêver qu'il se promène
Dans les fleurs
Noël au bout du monde
 
{au Refrain}
Noël au bout du monde
 
Et pourtant si on y pense 
Noël, c'est bien plus que ça
Et ça n'a pas d'importance
Le climat,  
Noël, c'est retourner boire
A la source des enfants 
C'est retrouver la mémoire
Pour un temps
Noël au bout du monde
 
{au Refrain}
Noël au bout du monde
 
Noël, c'est toujours la trêve
Dans les guerres et les tourments 
Et c'est la paix dont on rêve
Justement,  
Aussi je n'aurai, je le pense, 
Quand mon sapin brillera,  
Vraiment pas de différence 
Avec toi
Noël au bout du monde
 
Qui mets des guirlandes 
Sur un bananier 
Ou bien sur les branches 
Du frangipanier 
Qui a de belles fleurs si blanches


  ",Noël au bout du monde,Anne Sylvestre,,Sabe de quem é a composição? Envie pra gente.
"Noël N'est Pas Au Magasin
 
Je voudrais bien faire plaisir 
Je voudrais être riche 
Pour acheter et pour offrir 
Ce qui est sur les affiches 
Tout ce que d'autres ont fabriqué
Mais je n'ai que trois sous légers
Comment faire quand même 
Cadeau à ceux que j'aime
Noël N'est Pas Au Magasin
 
Noël n'est pas au magasin
Mais dans mon cœur et dans mes mains 
Et si j'en prends la peine
Ma tête est toute pleine 
De ce que j'offrirai demain
Noël n'est pas au magasin
Noël N'est Pas Au Magasin
 
Avec du papier, des ciseaux 
Des crayons, de la colle 
Je ferai naître des oiseaux 
Qui chantent et qui s'envolent
Avec quatre bouts de tissu 
Des rubans, des boutons perdus 
Du coton bleu ou rose 
J'inventerai des choses
Noël N'est Pas Au Magasin
 
Noël n'est pas au magasin
Mais dans mon cœur et dans mes mains 
Et si j'en prends la peine
Ma tête est toute pleine 
De ce que j'offrirai demain
Noël n'est pas au magasin
Noël N'est Pas Au Magasin
 
Quand j'aurai fabriqué des fleurs
Des lampions, des images 
Dans un grand morceau de bonheur 
Je ferai l'emballage
Et pour me ficeler tout ça 
Un grand sourire suffira 
Mon cadeau est à prendre 
Voyez comme il est tendre
Noël N'est Pas Au Magasin
 
Noël n'est pas au magasin
Mais dans mon cœur et dans mes mains 
Et si j'en prends la peine
Ma tête est toute pleine 
De ce que j'offrirai demain
Noël n'est pas au magasin


  Essa informação está errada? Nos avise. ",Noël N'est Pas Au Magasin,Anne Sylvestre,,Composição: Anne Sylvestre. 
"Noël nouvelet
 
Pour la Noël venue 
Nous faudrait des lumières 
Nous faudrait des prières 
Mais nous ne savons plus 
Ne savons plus les dire 
Ne savons plus sourire 
Pour les Noëls d'antan
Nous n'avons plus le temps.
Noël nouvelet
 
Noël nouvelet 
Vous risquez d'être bien laid.
Noël nouvelet
 
Pour la Noël qui vient 
Nous faudrait des guirlandes 
Nous les faudrait bien grandes 
Avec un beau sapin 
Mais les sapins jaunissent 
Et les guirlandes glissent 
Pour nos Noëls d'enfants
Nous sommes bien trop grands.
Noël nouvelet
 
Noël nouvelet 
Vous risquez d'être bien laid.
Noël nouvelet
 
Pour la Noël dorée 
Faudrait qu'on recommence
Avec nos yeux d'enfance
Et nos deux poings serrés 
Sur un bout de chandelle,  
De papier, de ficelle 
Sur nos secrets d'un franc
Qu'on n'gardait pas longtemps.
Noël nouvelet
 
Noël nouvelet 
Vous ne seriez pas si laid.
Noël nouvelet
 
Pour la Noël ce soir 
Si l'étoile s'attarde
Quand bien je te regarde 
Il ne fait pas si noir 
Tant pis pour les lumières 
Tant pis pour les prières 
Noël pouvez sonner 
Un grand amour est né.
Noël nouvelet
 
Mon Noël nouveau 
Moi je vous trouve bien beau.


  ",Noël nouvelet,Anne Sylvestre,,Sabe de quem é a composição? Envie pra gente.
"Non Tu N'as Pas de Nom
 
Non, non, tu n'as pas de nom
Non tu n'as pas d'existence
Tu n'es que ce qu'on en pense
Non, non, tu n'as pas de nom
Non Tu N'as Pas de Nom
 
Oh non, tu n'es pas un être
Tu le deviendrais peut-être 
Si je te donnais asile 
Si c'était moins difficile
S'il me suffisait d'attendre
De voir mon ventre se tendre 
Si ce n'était pas un piège
Ou quel douteux sortilège
Non Tu N'as Pas de Nom
 
Non, non, tu n'as pas de nom
Non tu n'as pas d'existence
Tu n'es que ce qu'on en pense
Non, non, tu n'as pas de nom
Non Tu N'as Pas de Nom
 
Savent-ils que ça transforme 
L'esprit autant que la forme
Qu'on te porte dans la tête
Que jamais ça ne s'arrête?
Tu ne seras pas mon centre 
Que savent-ils de mon ventre? 
Pensent-ils qu'on en dispose
Quand je suis tant d'autres choses?
Non Tu N'as Pas de Nom
 
Non, non, tu n'as pas de nom
Non tu n'as pas d'existence
Tu n'es que ce qu'on en pense
Non, non, tu n'as pas de nom
Non Tu N'as Pas de Nom
 
Déjà tu me mobilises 
Je sens que je m'amenuise
Et d'instinct je te résiste
Depuis si longtemps j'existe
Depuis si longtemps je t'aime
Mais je te veux sans problème 
Aujourd'hui je te refuse
Qui sont-ils ceux qui m'accusent?
Non Tu N'as Pas de Nom
 
Non, non, tu n'as pas de nom
Non tu n'as pas d'existence
Tu n'es que ce qu'on en pense
Non, non, tu n'as pas de nom
Non Tu N'as Pas de Nom
 
À supposer que tu vives 
Tu n'es rien sans ta captive
Mais as-tu plus d'importance
Plus de poids qu'une semence?
Oh, ce n'est pas une fête
C'est plutôt une défaite
Mais c'est la mienne et j'estime
Qu'il y a bien deux victimes
Non Tu N'as Pas de Nom
 
Non, non, tu n'as pas de nom
Non tu n'as pas d'existence
Tu n'es que ce qu'on en pense
Non, non, tu n'as pas de nom
Non Tu N'as Pas de Nom
 
Ils en ont bien de la chance 
Ceux qui croient que ça se pense 
Ça se hurle, ça se souffre 
C'est la mort et c'est le gouffre
C'est la solitude blanche
C'est la chute, l'avalanche
C'est le désert qui s'égrène
Larme à larme, peine à peine
Non Tu N'as Pas de Nom
 
Non, non, tu n'as pas de nom
Non tu n'as pas d'existence
Tu n'es que ce qu'on en pense
Non, non, tu n'as pas de nom
Non Tu N'as Pas de Nom
 
Quiconque se mettra entre 
Mon existence et mon ventre 
N'aura que mépris ou haine
Me mettra au rang des chiennes 
C'est une bataille lasse
Qui me laissera des traces 
Mais de traces je suis faite 
Et de coups et de défaites
Non Tu N'as Pas de Nom
 
Non, non, tu n'as pas de nom
Non tu n'as pas d'existence
Tu n'es que ce qu'on en pense
Non, non, tu n'as pas de nom


  Essa informação está errada? Nos avise. ",Non Tu N'as Pas de Nom,Anne Sylvestre,,Composição: Anne Sylvestre. 
"On S'est Connus
 
On s'est connu comme deux marins retour de pêche
Les yeux perdus encore et cherchant l'horizon
Qui mettent pied à terre et que rien ne dépêche 
Puisqu'aussi bien la mer, c'est pour eux la maison
On s'est connu comme ça, on était bien ensemble
Tu parlais mon langage et j'entendais ta voix
Et comme deux enfants qu'un même jeu rassemble
Tous les deux nous avons hissé le grand pavois
On S'est Connus
 
Mais j'ai appris à être sage
A raccommoder mes filets 
L'amour n'est pas un abordage
Un cœur ne s'prend pas au carrelet
On S'est Connus
 
Tu as mis à mes pieds tes filets pleins d'images
De soleils et de joies pêchés depuis longtemps 
Comme je n'avais rien, tu voulais qu'on partage
Et j'ai tendu les mains pour que tu sois content
Tu connaissais la mer, tu revenais des îles 
Quand moi, je n'en étais qu'à mon premier départ
La tempête, les vents, tu trouvais ça facile 
Disant qu'on vient toujours accoster quelque part
On S'est Connus
 
Mais j'ai appris à être sage
A raccommoder mes filets 
L'amour n'est pas un abordage
Un cœur ne s'prend pas au carrelet
On S'est Connus
 
On s'est connu, mais vois, ce n'était qu'une escale
Nous ne pouvions monter sur le même bateau 
Oh garde tes filets, range-les dans la cale 
Il aurait bien fallu nous rencontrer plus tôt 
Déjà le vent se lève, il faut que je m'en aille
N'oublie pas, quand au loin tu t'en iras voguer
Le triste matelot qui n'avait rien qui vaille
Et qui n'avait jamais, non, jamais navigué
On S'est Connus
 
Car j'ai appris à être sage
A raccommoder mes filets 
L'amour n'est pas un abordage
Un cœur ne s'prend pas- au carrelet


  Essa informação está errada? Nos avise. ",On S'est Connus,Anne Sylvestre,,Composição: Anne Sylvestre. 
"Par Les Champs Inondés
 
Par les champs inondés 
Tu viendras me chercher 
Et nous irons glisser, légers 
De saule en saule aux cheveux mouillés, mouillés
Par Les Champs Inondés
 
Le fond de ton bateau 
Que tu pousses sur l'eau
Couche l'herbe pâlie
Qui plie, couleur de ma mélancolie
Par Les Champs Inondés
 
Les grenouilles par mille 
Sur le miroir fragile 
Font un bruit léger 
Dans leurs vives plongées
Par Les Champs Inondés
 
Et sous notre sillage 
Rêvent les pâturages 
Le chemin s'est noyé
Dans un monde mouillé
Par Les Champs Inondés
 
À tant te regarder 
Par les champs inondés 
Je vois se dédoubler, trembler 
L'ombre de toi que je vais rêver, rêver
Par Les Champs Inondés
 
Échouons le bateau 
Nous marcherons dans l'eau
Les pieds dans la fraîcheur 
J'ai peur de trop laisser battre mon cœur
Par Les Champs Inondés
 
Un pli horizontal 
Déchire le cristal 
Et sous le bruissement 
Des peupliers d'argent
Par Les Champs Inondés
 
J'ai le cœur qui vacille
Des gouttelettes brillent 
Le long des avirons 
Rentrons vite, rentrons
Par Les Champs Inondés
 
Sur les champs engourdis 
Se faufile la nuit 
Vois, le ciel s'alanguit, bleuit
Le jour chavire, mon rêve aussi, aussi
Par Les Champs Inondés
 
À quoi bon s'attarder
Sur les champs inondés? 
Nous laissons nos pensées 
Embrumées jusqu'à demain, vagabonder
Par Les Champs Inondés
 
Par les champs inondés 
Par les champs inondés


  Essa informação está errada? Nos avise. ",Par Les Champs Inondés,Anne Sylvestre,,Composição: Anne Sylvestre. 
"Partage Des Eaux
 
Pas encore née, déjà formée 
Passager d'un monde liquide
Petit poisson, juste un frisson 
Animée de gestes languides 
Où est le haut, ma mère l'eau?
Où est le bas dans ton silence? 
Dans la douceur de ton enclos 
Je suis un presque-rien qui danse 
Et tu me tiens au plus serré 
Ton anneau d'or est bien fermé
Mon océan particulier 
Ma chère 
Geôlière
Partage Des Eaux
 
C'est le doux partage des eaux
Qu'on garde au plus creux de ses os
Partage Des Eaux
 
Où viennent boire les oiseaux 
Du rêve 
On ne sait pas sur son îlot 
Qu'on sera jeté par le flot
Bonheur qui d'un coup de ciseau
S'achève
Partage des eaux
Partage Des Eaux
 
Larmes salées, baisers mouillés 
La vie est là comme une houle 
Tout effrayée de s'y noyer
Langes trempés, lait qui s'écoule
Sitôt salie, sitôt lavée 
Quand j'ai crié mon impatience
Et tout aussi vite abreuvée 
Aux sources de ton abondance 
Tu alimentes mes désirs 
Mais sans jamais t'en dessaisir
Partage Des Eaux
 
Prodigue de tous les plaisirs 
Fontaine 
Certaine
Partage Des Eaux
 
Le tendre partage des eaux 
Qui se décline amoroso 
Où viennent pointer leur museau 
Les louves 
On ne sait pas dans son berceau 
Que se tarira le ruisseau 
Ni que s'assécheront bientôt
Les douves 
Partage des eaux
Partage Des Eaux
 
Et c'est la vie qui coule en nous
Nez enrhumé, genou qui saigne 
Sang qui bouillonne et qui dénoue 
Les prémices d'un nouveau règne
Sueur de l'effort et du jeu
Échange violent des salives 
Et mélange plus amoureux 
D'autres humeurs de sources vives
Où va le torrent de ma vie? 
Son courant serpente et dévie 
Et je demeure inassouvie 
Mon fleuve 
Ma preuve
Partage Des Eaux
 
Le sombre partage des eaux 
Qui creuse en nous tous ses réseaux 
Où vont se noyer nos sanglots 
Tenaces 
On sait trop bien sur son radeau 
Qu'un jour baissera le niveau
Et que se fermera trop tôt 
La nasse 
Partage des eaux
Partage Des Eaux
 
Tant de rivières, de torrents 
Tant de lacs et tant de fontaines 
Tant de mers et tant d'océans
Où sont englouties tant de peines 
Toutes ces eaux qui sont en moi 
Toutes ces eaux qui me traversent 
Sont celles aussi où je me noie 
Quand encore je pleure à verse 
Comment retrouver l'oasis
Pour y dormir comme jadis 
Dans le jardin de tes délices? 
Ma source 
Ma course
Partage Des Eaux
 
L'ultime partage des eaux
Arrivera pianissimo 
Nous n'aurons pas le dernier mot
Qu'importe!
Avant de faire le grand saut 
Boirons à même le goulot 
La gorgée que le chemineau 
Emporte 
Partage des eaux
Partage Des Eaux
 
Partage des eaux


  ",Partage Des Eaux,Anne Sylvestre,,Sabe de quem é a composição? Envie pra gente.
"Parti partout
 
La la la
Parti partout
 
Quand t'es parti
J'ai mal partout
C'est réparti
Ça part du cou 
En descendant, ça investit 
Une omoplate ou un genou 
Il n'y a pas un abattis
Qui se tienne en dehors du coup, oh! 
Plus décatie qu'un vieux matou
Quand t'es parti, j'ai mal partout
Parti partout
 
Plus décatie qu'un vieux matou
Quand t'es parti, j'ai mal partout, oh!
La la la
Parti partout
 
Dans les orties 
Je me tatoue 
Ça fait des plis 
Ça fait des trous 
De partout, je me sens blettie 
Je multiplie les coups de mou 
J'ai des glouglous dans mes circuits
Tous mes grigris deviennent flous, oh! 
Comme un frichti sans son faitout 
Quand t'es parti, j'ai mal partout
Parti partout
 
Comme un frichti sans son faitout 
Quand t'es parti, j'ai mal partout, oh!
La la la
Parti partout
 
Quand t'es parti
Sans un poutou 
Ben mon hostie 
J' t'ai dit de tout!
Je t'ai cherché dans ton tipi
Je t'ai traqué dans ton igloo
Mais quand j' te cherche à Djibouti
Tu vas m'attendre à Tombouctou, où?
Je suis roustie mais toi itou 
Quand t'es parti, j'ai mal partout
Parti partout
 
Je suis roustie mais toi itou 
Quand t'es parti, j'ai mal partout, oh!
La la la... Oh la la! 
Mais j'ai le rythme dans la peau, moi! La la la
Parti partout
 
Mais de Chatou 
À Tahiti 
Tu vas partout 
J' suis mal partie!
La la la
Parti partout
 
Ouh la la, ma sœur! 
Mais qu'est-ce qui m'a pris d'écrire une chanson comme ça?
J'aurais mieux fait de rester chanson française
Avec la guitare et les grands cheveux, et Lénine, et tout ça! 
Seulement, voilà, tu fais une chanson, il faut que tu la chantes 
Sinon les droits d'auteur, ils ne tombent pas!
Alors tu la chantes! 
Ben, voilà!


  ",Parti partout,Anne Sylvestre,,Sabe de quem é a composição? Envie pra gente.
"Pas Difficile
 
Se retrouver dans la rue 
Pas difficile 
Honteux de sa main tendu 
Pas difficile 
C’est comme l’envers d’un jeu 
Une cascade 
Où on glisse peu à peu 
Dégringolade 
Il suffit d’un matin gris 
Bien ordinaire 
D’une lettre qui vous dit 
Y’a rien à faire 
On ne peut plus vous garder 
On ne peut plus vous loger 
On ne peut plus vous aimer 
Il faudra vous débrouiller 
Seul
Pas Difficile
 
Quand ca commence 
La malchance 
Ca vous balance 
Drôle de dance 
J’y pense
Pas Difficile
 
Dormir sur un coin du quai 
Pas difficile 
Une inscription à la craie 
Pas difficile 
Plus de maison plus de chaud 
Et plus de place 
On ne donne pas de boulot 
À cette crasse 
Plus de boulot plus de sous 
Et plus de piaule
Pas Difficile
 
C’est une histoire de fous 
Pas vraiment drôle 
On ne peut pas vous laisser 
Car le métro va fermer 
On ne peut rien vous donner 
Pour qu’vous allez vous saoûler 
Seul
Pas Difficile
 
Quand ca commence
Pas Difficile
 
Se retrouver en prison 
Pas difficile 
Votre mère avait raison 
Pas difficile 
Prendre un peu ce qui est là 
Qui fait envie 
Et qu’on ne vous donne pas 
Vive la vie 
Ou glisser sans le savoir 
Drôle de drame 
Au filet du désespoir 
Pour quelques grammes 
On ne peut pas vous donner 
On ne peut pas vous soigner 
On n’peut pas vous pardonner 
Faudra vous habituer 
Seul
Pas Difficile
 
Quand ca commence
Pas Difficile
 
Passer sans se retourner 
C’est trop facile 
Dire qu’on n’a pas à donner 
C’est trop facile 
Penser qu’on est différent 
Parce qu’on est propre
Pas Difficile
 
Quand le malheur mécontent 
Nous apostrophe 
C’est ignorer qu’un matin 
Demain peut-être 
On peut la tenir en main 
La triste lettre 
On ne peut plus vous garder 
On ne peut plus vous loger 
On ne peut plus vous aimer 
Il faudra vous débrouiller 
Seul
Pas Difficile
 
Quand ca commence


  ",Pas Difficile,Anne Sylvestre,,Sabe de quem é a composição? Envie pra gente.
"Pause
 
Ça serait une pause 
Entre deux sonneries 
Quand le bruit se repose 
Un soupçon d'accalmie
Ça serait un silence 
Au milieu du fracas 
La minute d'absence
Où on ne répond pas
Pause
 
Un petit temps d'arrêt
Siou plait 
Je crois qu'il me faudrait
Juste un peu de secret 
Juste un peu de secret 
Faire un palier
Pause
 
Rien qu'un petit palier
Grappiller cet instant 
Pour mettre innocemment 
Pour mettre impunément 
Un peu de flou dans mon emploi du temps
Pause
 
Ça serait un mensonge 
Entre deux vérités 
Une question qui plonge 
Avant d'être posée
Ça serait une fable 
Au milieu des discours 
Une fuite improbable 
Un ultime recours
Pause
 
Même si ça dépayse 
Oh please 
Il faudrait que je dise
Pause
 
Juste quelques bêtises 
Juste quelques bêtises
Pause
 
Faire un palier 
Rien qu'un petit palier
Grappiller cet instant 
Pour mettre innocemment 
Pour mettre impunément 
Un peu de flou dans mon emploi du temps
Pause
 
Ça serait un scaphandre 
Au milieu des requins 
Quand la chair est si tendre 
Et l'habit si mesquin
Ça serait une esquive 
A ce monde voyeur 
La défense passive 
Armure du rêveur
Pause
 
Sans beaucoup d'exigence
Je pense 
Qu'il me faudra d'urgence
Juste un peu de silence 
Juste un peu de silence
Pause
 
Faire un palier 
Rien qu'un petit palier
Grappiller cet instant 
Pour mettre innocemment 
Pour mettre impunément 
Un peu de flou dans mon emploi du temps


  ",Pause,Anne Sylvestre,,Sabe de quem é a composição? Envie pra gente.
"Pelouse au repos
 
La la la
Pelouse au repos
 
Pas besoin de fleurir 
Pas besoin de verdir 
Calmer les pâquerettes 
Tâcher de contenir 
S'efforcer d'endormir
Les pensées, les violettes 
Sermonner le gazon 
Gronder le liseron 
Consoler la doucette 
Dissuader le chardon 
Ralentir le mouron 
Et les pieds d'alouette
Pelouse au repos
 
Venir incognito 
Planter un écriteau 
Pelouse au repos 
Pelouse au repos
Pelouse au repos
 
Venir incognito 
Planter un écriteau 
Pelouse au repos 
Pelouse au repos
Pelouse au repos
 
Ne vivre que d'un œil
Empaqueter les feuilles 
Refuser toute greffe 
Désoler le cerfeuil 
Et même à quatre feuilles 
Décourager le trèfle 
Pas besoin d'arroser
Pas besoin d'espérer
Les œillets de poète 
À quoi bon jardiner? 
Surtout pas déranger 
Les graines dans leur sieste
Pelouse au repos
 
Venir incognito 
Planter un écriteau 
Pelouse au repos 
Pelouse au repos
Pelouse au repos
 
Venir incognito 
Planter un écriteau 
Pelouse au repos 
Pelouse au repos
Pelouse au repos
 
Inutile en ce jour 
De penser aux labours 
D'attendre des cueillettes
Et les topinambours 
Et les chansons d'amour
Les mettre aux oubliettes 
Menacer le chiendent 
Qui cherche, l'imprudent
À faire une colère 
Fermer tous les auvents 
Attendre, cœur battant 
La première primevère
Pelouse au repos
 
Venir incognito 
Planter un écriteau 
Pelouse au repos 
Pelouse au repos
Pelouse au repos
 
Venir incognito 
Planter un écriteau 
Pelouse au repos 
Pelouse au repos
Pelouse au repos
 
Mettre les sentiments 
Et les attachements 
En utile jachère 
Laisser négligemment 
Les aveux, les serments 
Rouler dans la poussière 
Endormir les chagrins 
Parmi les boulingrins 
Désapprendre l'ivresse
Se glisser, clandestin 
Dans des alexandrins 
Enterrer les caresses
Pelouse au repos
 
Rester incognito 
Garder son écriteau 
Pelouse au repos 
Pelouse au repos
Pelouse au repos
 
Rester incognito 
Garder son écriteau 
Pelouse au repos 
Pelouse au repos
Pelouse au repos
 
La la la
Pelouse au repos
 
Refleurir au printemps 
En prenant tout son temps


  ",Pelouse au repos,Anne Sylvestre,,Sabe de quem é a composição? Envie pra gente.
"Petit Bonhomme
 
Le mari de Maryvonne était mon amant 
Quelquefois je m'en étonne, encore maintenant
Au début, tout feu tout braise, il était gentil 
Quand il se mettait à l'aise, il refaisait le lit
Il me disait: Tu es belle 
Après comme avant 
Il descendait la poubelle en repartant
Petit Bonhomme
 
La-la-la, petit bonhomme comme on est bien élevé 
C'était grâce à Maryvonne, il me l'avait caché
La-la-la, petit bonhomme, comme on avait bien menti 
Ma femme est une matrone, il m'avait dit
Petit Bonhomme
 
Le mari de Maryvonne était mon amant 
Mais il m'appela bobonne au bout de pas longtemps
Puis je rencontrai sa femme qui me dit merci 
Depuis qu'il vous a dans l'âme, il ne vient plus ici
Il m'avait dit: Maryvonne est un vrai boudin
Toujours elle me cramponne et ça me dit rien
Petit Bonhomme
 
La-la-la, petit bonhomme, comme on est mal élevé 
Maryvonne est très mignonne, il me l'avait caché
La-la-la, petit bonhomme, comme on avait bien menti 
Ma maîtresse est une conne, il lui avait dit
Petit Bonhomme
 
Le mari de Maryvonne n'est plus mon amant
Comme il n'a trouvé personne il est chez sa maman
Maryvonne et moi on pense qu'on pourra bientôt
Se prendre un peu de vacances, un peu de repos 
Mais voilà que Maryvonne m'apprend ce midi
Sa belle-mère lui téléphone elle vient aussi
Petit Bonhomme
 
La-la-la, petit bonhomme, ça commence à se gâter 
Il la prenait pour sa bonne, elle en a eu assez 
La-la-la, petit bonhomme, comme on avait bien menti 
Ma mère est une gorgone, il avait dit
Petit Bonhomme
 
Le mari de Maryvonne a pu se recaser 
C'est Sophie qui lui redonne un peu de volupté
Au début tout feu tout braise, il sera gentil 
Quand il se mettra à l'aise, il refera le lit
Il lui dira: Tu es belle 
Après comme avant 
Il descendra la poubelle en repartant
Petit Bonhomme
 
La-la-la, petit bonhomme mais ça ne va pas durer 
Quand il lui dira bobonne elle va se tirer 
Moi, sa mère et Maryvonne on l'a bien dit à Sophie
On t'attend ma toute bonne dans le midi
Petit Bonhomme
 
Si longtemps ça recommence, on va se retrouver 
Toute une colonie de vacances, on va bien s'amuser


  Essa informação está errada? Nos avise. ",Petit Bonhomme,Anne Sylvestre,,Composição: Anne Sylvestre. 
