Lyrics,Song,Artist,Genre,Composition
"La Peau de L'ours
 
J'ai vendu la peau de l'ours, ma mère
- Elle ne valait pas bien lourd - 
Avant de l'avoir piégé, misère
Avant de l'avoir touché
J'ai vendu la peau de l'ours, ma mère
Sans caresser son velours 
Sans l'avoir déshabillé, peuchère
Sans même lui faire l'amour
La Peau de L'ours
 
C'est ainsi que bien souvent on pense
Avoir tout entre ses mains 
Si du pot au lait on âche l'anse
Café noir le lendemain 
Il arrive que les ours se vengent 
D'avoir été convoités
Il est évident qu'ça les dérange
De nous voir anticiper
La Peau de L'ours
 
J'ai vendu la peau de l'ours, ma mère
- Elle ne valait pas bien lourd - 
Avant de l'avoir piégé, misère
Avant de l'avoir touché
J'ai vendu la peau de l'ours, ma mère
Sans caresser son velours 
Sans l'avoir déshabillé, peuchère
Sans même lui faire l'amour
La Peau de L'ours
 
Tenez, par exemple, je chansonne 
Sans vraiment penser plus loin 
Je rencontre deux ou trois personnes 
Qui me parlent du prochain 
De mon prochain disque, et elles bavardent 
Sur ce qu'on y entendra
Et moi, sans malice, je hasarde 
Tout ce qui rimait par là
La Peau de L'ours
 
J'ai vendu la peau de l'ours, ma mère
- Elle ne valait pas bien lourd - 
Avant de l'avoir piégé, misère
Avant de l'avoir touché
J'ai vendu la peau de l'ours, ma mère
Sans caresser son velours 
Sans l'avoir déshabillé, peuchère
Sans même lui faire l'amour
La Peau de L'ours
 
A partir de là, c'est l'engrenage
Voici qu'on vend pour de vrai
Mes nouvelles chansons, c'est l'usage
Faut éveiller l'intérêt
Et pendant ce temps, moi, je me ronge 
Devant mon bout de papier 
J'en perds l'appétit, j'en perds le songe
Je n'ai rien à proposer
La Peau de L'ours
 
J'ai vendu la peau de l'ours, ma mère
- Elle ne valait pas bien lourd - 
Avant de l'avoir piégé, misère
Avant de l'avoir touché
J'ai vendu la peau de l'ours, ma mère
Sans caresser son velours 
Sans l'avoir déshabillé, peuchère
Sans même lui faire l'amour
La Peau de L'ours
 
Même en supposant que la panique 
Me décoince le cerveau 
Que j'aie fait les chansons de mon disque
Et que je le trouve beau 
En vous les chantant, je réitère 
Un optimisme anormal 
Car en présumant qu'elles vont vous plaire
Je vous solde l'animal
La Peau de L'ours
 
Je vendrai la peau de l'ours, ma mère
On la vend chacun son tour 
Ce n'est pas pour se vanter, misère
C'est pour la publicité
Je vendrai la peau de l'ours, ma mère
Mais regretterai toujours 
De l'avoir laissé filer, peuchère
Sans même lui faire l'amour {3x}


  ",La Peau de L'ours,Anne Sylvestre,,Sabe de quem é a composição? Envie pra gente.
"La poule aux coeufs d'or
 
V'là qu'la poule aux œufs d'or
Veut garder son trésor 
V'là qu'la gallinacée
Veut plus se faire trousser 
L'est fatiguée de pondre
Fatiguée de s'faire tondre
Les plumes sur le dos 
D'aligner les cadeaux
Pour se faire pardonner 
D'avoir le cul doré
La poule aux coeufs d'or
 
{Refrain:} 
La poulette elle a mal 
Elle a mal au trou d'balle
Car toujours elle pond 
Pon pon pon pon 
Car toujours elle pond 
Elle se dit : Pourquoi ponds-je ? 
Cette question la ronge 
Plus elle se morfond 
Plus on lui répond : Ponds 
Pon pon pon pon 
Plus on lui répond : Ponds
La poule aux coeufs d'or
 
V'là qu'la poule aux œufs d'or
Ferme son coffre-fort 
V'là qu'la gallinacée
A l'arrière-train froncé
Elle voit pauvre poire 
Revendiquer sa gloire 
Par ces gros maquignons 
Qui guettent à son croupion 
Pour peu qu'ils lui fournissent
Quelques grains de maïs
La poule aux coeufs d'or
 
{au Refrain}
La poule aux coeufs d'or
 
Mais la poule aux œufs d'or
Fait plus aucun effort 
Mais la gallinacée 
A la tripe coincée 
Eh, pondez-les vous-mêmes 
Ce n'est pas son problème
Gardez vos laxatifs 
Vos pruneaux purgatifs 
La cocotte elle veut plus 
Veut plus se casser le cul
La poule aux coeufs d'or
 
La poulette elle a mal 
Elle a mal au trou de balle 
Depuis le temps qu'elle pond
Pon pon pon pon 
Depuis le temps qu'elle pond
Elle dit : Pourquoi pondais-je ? 
Ça m'a ruiné le siège
Lâchez-moi les crampons 
Plus jamais j\'entends ponds 
Pon pon pon pon 
Plus jamais j\'entends ponds
La poule aux coeufs d'or
 
La poulette elle a mal 
Elle a mal au trou d'balle
Et jusqu'aux amygdales
Peau d'balle peau d'balle
C'est la grève totale


  ",La poule aux coeufs d'or,Anne Sylvestre,,Sabe de quem é a composição? Envie pra gente.
"La quarantaine
 
Depuis que les garces du pays 
M'ont mise en quarantaine
J'ai récolté quarante amis
Je ne sens plus mes peines 
Tout l' monde est bien content
Les gars n'en ont pas fait autant
La quarantaine
 
J'ai toujours un porte-cruche
Quand je vais puiser de l'eau
Et si parfois je trébuche 
On me retient illico 
Si je vais à la promenade 
J'ai huit chevaliers servants
Qui me content sérénade 
Et me protègent du vent
La quarantaine
 
Depuis que les garces du pays 
M'ont mise en quarantaine
Elles tirent seules l'eau du puits
Trouvant lourde la chaîne 
Vilaines au bois-dormant 
Au bout d' leur bras, point de galant
La quarantaine
 
J'en ai un qui me réveille
Et me sert le déjeuner 
Un qui soigneusement veille 
À c' que je pose en premier
Le pied droit, surtout pas l'autre
Car ils seraient obligés 
De supporter, bons apôtres 
Mes mauvaises volontés
La quarantaine
 
Depuis que les garces du pays 
M'ont mise en quarantaine
Elles peuvent bien avoir des soucis 
Se changer en fontaines 
Pas un ne les entend 
Autant se confier au vent
La quarantaine
 
Le dimanche à la grand-messe 
Ils me portent mon missel 
À ma place ils se confessent 
Paient la quête et les chandelles 
Je r'viens fleurant l'eau bénite
Mon repas est tout servi 
La journée s'écoule vite
Et puis on me met au lit
La quarantaine
 
Depuis que les garces du pays 
M'ont mise en quarantaine
Elles ont froid au fond de leur lit 
Et leurs rêves se traînent 
Les gars sont bien contents 
Mon lit est chaud, mon lit est grand
La quarantaine
 
Il n'est pas jusqu'à mes robes
Qu'ils ne taillent avec goût
Ils iraient courir le globe 
Pour poser à mes genoux 
Les trésors des Amériques 
Les produits miraculeux 
Moi, je règne, séraphique 
Sur mes quarante amoureux
La quarantaine
 
Faut les voir, les garces du pays 
À longueur de semaine 
Guigner, lorgner avec envie 
Ma jolie quarantaine 
Elles ont perdu leur temps 
Moi, je n'en ai pas fait autant
Et mon cœur en est bien content


  ",La quarantaine,Anne Sylvestre,,Sabe de quem é a composição? Envie pra gente.
"À La Récré
 
À la récré, à la récré 
À quoi pourrait-on jouer? 
(À la récré, à la récré) 
(À quoi pourrait-on jouer?)
À La Récré
 
Si on joue à la marelle 
Ça vous use la semelle 
La semelle d'un soulier
On a un pied plus léger 
Un pied plus léger que l'autre
Ou alors il faut changer 
(Un pied plus léger que l'autre)
(Ou alors il faut changer)
À La Récré
 
À la récré, à la récré 
À quoi pourrait-on jouer?
À La Récré
 
(À la récré, à la récré) 
(À quoi pourrait-on jouer?)
À La Récré
 
Si on joue à la délivre 
Moi, je ne pourrai pas suivre 
Si on joue à la délo 
J'aurai sûrement trop chaud
Ou j'aurai mal à la tête
Mal au ventre ou mal aux pieds 
(Ou j'aurai mal à la tête)
(Mal au ventre ou mal aux pieds)
À La Récré
 
À la récré, à la récré 
À quoi pourrait-on jouer? 
(À la récré, à la récré) 
(À quoi pourrait-on jouer?)
À La Récré
 
Si on joue à cache-cache
À La Récré
 
Y en a toujours qui se fâchent 
Si on joue à chat perché 
Je vais sûrement tomber 
Et puis si on joue au foot 
J'aurai jamais le ballon
(Et puis si on joue au foot) 
(J'aurai jamais le ballon)
À La Récré
 
À la récré, à la récré 
À quoi pourrait-on jouer? 
(À la récré, à la récré) 
(À quoi pourrait-on jouer?)
À La Récré
 
Il faudrait que l'on invente
Un jeu qui toujours contente 
Les filles et puis les garçons 
Les durs et les mollassons 
Quoi, c'est la cloche qui sonne?
À La Récré
 
Déjà finie la récré! 
(Quoi, c'est la cloche qui sonne?)
(Déjà finie la récré!)
À La Récré
 
À la récré, à la récré 
On n'a pas l' temps de jouer


  ",À La Récré,Anne Sylvestre,,Sabe de quem é a composição? Envie pra gente.
"La reine du créneau
 
Quand j'ai eu mon permis tout neuf
Du premier coup, c'est pas du bluff, 
J'ai compris qu' j'avais intérêt
A rester aux aguets 
Que simplement, on m'imagine
Dans ma deux-chevaux d'origine
Affrontant mon premier trottoir 
Le cœur rempli d'espoir
Je voulais que ma manœuvre 
Fût un vrai petit chef d'œuvre
Mais je n'entendais que trop
Tous les clients d'un bistrot
Me beugler leurs commentaires 
Mais passe-la, ta marche arrière ! 
Ah, j'vous jure, ah les nanas
Heureus\'ment qu\'on est là ! 
Ces abrutis pleins de Pernod 
Ils m'ont fait rater mon créneau
La reine du créneau
 
Toutes les automobilistes 
Pourraient faire avec moi la liste 
Des âneries que l'on entend
Quand on est au volant 
J'ai donc appris à leur répondre
Et de manière à les confondre 
Oui, ça consomme mais moins qu'un mari
Et c'est bien plus gentil
La conduite, je l'ai apprise
Pas dans une pochette-surprise 
La voiture, elle est à moi 
Ni à Jules, ni à papa 
Et quand le long d'un trottoir
Je les voyais goguenards 
Je demandais sans un frisson 
Vous voulez une leçon ? 
Pour conjurer la parano 
J'suis d'venue la reine du créneau
La reine du créneau
 
On s'habitue, on en rigole
Puis on a une grosse bagnole 
Alors on se fait insulter 
Elle t\'a pas trop coûté, hein ? 
Ils sont là qui vous collent aux fesses 
Parce que c'est pas une gonzesse
Qui va leur barrer le chemin 
La veille, c'est pas demain
Mais tous ces doubleurs à droite 
Ces pousse-toi d'là que j'déboite
Maniaques de l'appel de phares
Abuseurs d'anti-brouillard
Ceux chez qui rien ne distingue 
Le volant d'avec un flingue
Avant que de les laisser 
Nous jeter dans l'fossé
Résistons à ces tyranneaux 
Nous sommes les reines du créneau
La reine du créneau
 
S'ils nous renvoient à nos fourneaux
Ne lâchons pas notre créneau


  ",La reine du créneau,Anne Sylvestre,,Sabe de quem é a composição? Envie pra gente.
"La Rochelle Par La Mer
 
J'suis retournée à La Rochelle
Mais je ne l'ai pas retrouvée
Pourtant, je crois, la route est belle 
Pardon, je l'ai pas regardée
Mais, quand j'ai marché dans la ville
Je ne m'y suis pas reconnue
J'y revenais le cœur tranquille
Je n'y marchais pas les pieds nus
La Rochelle Par La Mer
 
Mais La Rochelle par la mer 
Par un beau soir, plein vent arrière 
Mais La Rochelle par la mer 
Avec un bateau grand ouvert 
Que c'était beau! Et la guitare
Sur ses cordes vieilles chanta 
Nous étions six à n'y pas croire
A la beauté de ce soir-là
La Rochelle Par La Mer
 
La Rochelle, ma belle 
Depuis que j'ai vu tes deux tours
Je te compte avec mes amours 
Je te compte avec mes amours
La Rochelle Par La Mer
 
Pour parvenir à La Rochelle 
Une semaine avait suffi 
Mer et soleil, vent dans nos ailes 
Le vent ne soufflait que la nuit 
Le sommeil nous livrait bataille 
J'en ai vu des soleils levants
J'en ai dormi, vaille que vaille
Des heures sur le pont brûlant
La Rochelle Par La Mer
 
Puis La Rochelle par la mer 
Nous accueillit dans sa lumière 
Puis La Rochelle, port ouvert 
Nous prit entre ses tours de pierre 
Puis, le soir, la ville endormie 
Nous offrait ses cours, ses maisons 
Où la guitare, la jolie 
Nous déroulait une chanson
La Rochelle Par La Mer
 
La Rochelle, ma belle 
Depuis que j'ai vu tes deux tours
Je te compte avec mes amours 
Je te compte avec mes amours
La Rochelle Par La Mer
 
Fallut rester à La Rochelle 
Quatre ou cinq jours, je ne sais plus 
Si la mer se montrait rebelle 
La ville a senti nos pieds nus 
Puis un soir, par vent favorable 
Il fallut la quitter pourtant 
En une sortie mémorable 
On repartit en louvoyant
La Rochelle Par La Mer
 
De La Rochelle par la mer 
Nous repartions, vent de travers 
Puis La Rochelle sur la mer 
Ne fut bientôt qu'une lumière
Mes compagnons de ce voyage 
Sans doute ils se reconnaîtront 
N'oublieront pas le bateau sage
Et la guitare et les chansons
La Rochelle Par La Mer
 
La Rochelle, ma belle 
Je ne verrai plus tes deux tours 
Avec mes yeux des anciens jours 
Mais tu restes avec mes amours 
Avec mes amours


  Essa informação está errada? Nos avise. ",La Rochelle Par La Mer,Anne Sylvestre,,Composição: Anne Sylvestre. 
"La rose au boué
 
Mon père avec ma mère 
N'avaient fille que moué {2x}
La destinée, la rose au boué 
La rose au boué 
N'avaient fille que moué
La destinée, ohé !
La rose au boué
 
Ils me firent faire une robe 
Une robe de soué {2x} 
La destinée, la rose au boué 
La rose au boué 
N'avaient fille que moué
La destinée, ohé !
La rose au boué
 
On me la porte à coudre 
Au grand tailleur du roué {2x} 
etc... 
A chaque coup d'aiguille :
Ma fille embrasse-moué. {2x} 
etc...
La rose au boué
 
C'est pas l'affaire des filles
D'embrasser les garçons {2x}
etc...
La rose au boué
 
Mais c'est l'affaire des filles
De balayer la maison {2x} 
etc...
La rose au boué
 
Quand les maisons sont propres 
Les amoureux y vont {2x} 
etc...
La rose au boué
 
Et ils y vont quatre par quatre 
En jouant du violon {2x} 
Etc...
La rose au boué
 
Quand les maisons sont sales, 
Les amoureux s'en vont {2x}
Etc...
La rose au boué
 
Ils s'en vont quatre par quatre
En jouant du bâton {2x} 
etc...


  ",La rose au boué,Anne Sylvestre,,Sabe de quem é a composição? Envie pra gente.
"La rose des vents
 
Laisse-moi t’offrir la rose des vents 
Laisse-moi t’offrir ce reflet mouvant 
D’une algue à sa pointe d’argent 
Bougeant 
Entre mes mains, la voile 
D’un vaisseau tout blanc 
Reçois la rose pâle 
De mes doigts tremblants
La rose des vents
 
Elle est la fleur de nos rencontres 
Celle que mon cœur gardera 
Depuis toujours, elle nous montre 
Tous les chemins de tous ses bras 
À l’heure où les ombres s’allongent 
Au jour d’une proche saison 
Nous irons pourchasser nos songes 
Aux quatre coins de l’horizon
La rose des vents
 
Laisse-moi t’offrir la rose des vents 
Laisse-moi t’offrir ce reflet mouvant 
D’une algue à sa pointe d’argent 
Bougeant 
Entre mes mains, la voile 
D’un vaisseau tout blanc 
Reçois la rose pâle 
De mes doigts tremblants
La rose des vents
 
Tes mains, dans le jardin des algues 
Ont pris les miennes follement 
J’y ai reçu l’unique bague 
Où tournent encore nos serments 
Au prix d’un cœur, l’amour s’achète 
Et tes paroles que je crois 
S’en sont allées dans la tempête 
Aux quatre vents, signe de croix
La rose des vents
 
Laisse-moi t’offrir la rose des vents 
Laisse-moi t’offrir ce reflet mouvant 
D’une algue à sa pointe d’argent 
Bougeant 
Entre mes mains, la voile 
D’un vaisseau tout blanc 
Reçois la rose pâle 
De mes doigts tremblants
La rose des vents
 
Tout environné de sirènes 
Aux cheveux lents comme ruisseau 
Aux yeux pâlis de souveraine 
S’en reviendra notre vaisseau 
Et nous dirons à nos images 
À nos enfants aux yeux trop las 
Le plus beau de tous les voyages 
C’est celui qu’on ne fera pas


  ",La rose des vents,Anne Sylvestre,,Sabe de quem é a composição? Envie pra gente.
"La serpente
 
Garez vos pieds, garez vos fesses 
Garez tout ce que vous possédez 
Et je vous fais bien la promesse 
Que belle vous l’aurez échappée 
Car je sens venir la serpente 
La serpente aux tout petits yeux 
La serpente qui se vante 
De tout faire mieux 
En un mot: D’être le bon Dieu
La serpente
 
Ayant très tôt eu la malchance 
De la connaître d’assez près 
Experte au jeu de mal y pense 
Mais pourvue de quelques attraits 
Je l’ai vue grandir, la serpente 
J’ai vu briller ses petits yeux 
À l’âge où les filles se vantent 
De tout faire mieux 
Elle était déjà le bon Dieu
La serpente
 
À l’âge où les filles se disent 
Qu’elles ont bien le temps d’y penser 
Elle plongeait, tête comprise 
Dans des histoires insensées 
Et depuis ce temps, la serpente 
N’en croyant pas ses petits yeux 
Ne sait toujours pas qui la hante 
Pensant bien un peu 
N’être pas toujours le bon Dieu
La serpente
 
Le hasard ayant la main lourde 
Je la retrouvai sous mes pieds 
Voyez un peu comme on est gourde! 
Je la crus douée d’amitié 
Mais je vis bientôt la serpente 
Froid au cœur mais pas aux yeux 
Me déchirer, me mettre en vente 
Me traiter pas mieux 
Que s’il n’y avait pas de bon Dieu
La serpente
 
L’ayant jetée comme une pieuvre 
Je vis quelqu’un la ramasser 
Elle continua son œuvre 
Jusqu’à ce qu’on en eût assez 
On se repassa la serpente 
Comme s’il ne valait pas mieux 
Telle une chose malfaisante 
Lui ôter un peu 
L’envie de jouer au bon Dieu
La serpente
 
Mais elle est toujours là qui rôde 
Entre médisance et whisky 
Pour un peu d’aventure en fraude 
Roulant avec n’importe qui 
J’ai fait cette chanson méchante 
Rien que pour me distraire un peu 
Mais je crois que pour la serpente 
Ça ne va pas mieux 
Si vraiment il y a un bon Dieu
La serpente
 
Garez vos pieds, garez vos miches 
Garez tout ce qui vaut le coup 
Elle va mourir et je m’en fiche 
Chez moi, ça va pas mal, et vous? 
Car je l’ai revue la serpente 
Avec des poches sous les yeux 
Encore plus laide que méchante 
Et ce n’est pas peu 
Et ça me fait plaisir, bon Dieu!


  ",La serpente,Anne Sylvestre,,Sabe de quem é a composição? Envie pra gente.
"L'autre Et L'une
 
L'autre dit à l'une
Je ne te veux pas de mal 
Nous sommes chacune 
Sur nos gardes et c'est normal
Celui que tu aimes 
N'est pas le même avec moi
Tu as ses problèmes 
Je ne connais que ses joies 
L'une dit à l'autre
Je redoutais cet instant 
Ce n'est pas ta faute
Mais c'est la faute du temps
Je ne suis pas sûre 
De n'avoir que des soucis
Et pour les blessures 
Tu en recevras aussi
L'autre Et L'une
 
Que tu sois l'autre ou l'une
Tu prends ton coup de lune 
Tu prends ton coup au cœur 
Que tu sois l'une ou l'autre
Souvent la marche est haute 
Pour trouver le bonheur
L'autre Et L'une
 
L'autre dit: Je doute
Que tu veuilles m'écouter
Tu es sur la route 
Je suis sur le bas-côté 
Je sais, c'est facile
De venir après la pluie 
Mais il est fragile 
Le soleil de l'embellie
L'une dit: De grâce
J'ai fait le chemin pour lui
L'autre Et L'une
 
Je voulais qu'on fasse
Une pause avant la nuit 
Je n'ai pas de chaînes
Pour le tenir près de moi 
Je n'ai que ma peine
J'en userai si je dois
L'autre Et L'une
 
Que tu sois l'autre ou l'une
Tu prends ton coup de lune 
Tu prends ton coup au cœur 
Que tu sois l'une ou l'autre
Souvent la marche est haute 
Pour trouver le bonheur
L'autre Et L'une
 
L'autre dit: Je pense
Qu'on nous a mal élevées
Cette appartenance 
Mais comment s'en délivrer?
L'autre Et L'une
 
Quelle est cette fièvre 
Qui nous met le cœur en croix 
Des mots sur les lèvres 
Que l'on n'imaginait pas?
L'une dit: J'en crève
De le porter dans mon sang 
Il était ma sève 
Pour toi, ce n'est qu'un passant
Je devrais sans doute 
M'oublier encore un peu
Mais que ça me coûte 
De l'imaginer heureux!
L'autre Et L'une
 
Que tu sois l'autre ou l'une
Tu prends ton coup de lune 
Tu prends ton coup au cœur 
Que tu sois l'une ou l'autre
Souvent la marche est haute 
Pour trouver le bonheur
L'autre Et L'une
 
L'autre dit: Je gage
Que tu ne m'écoutes plus
Et c'est un mirage
De penser qu'on aurait pu
Dans une autre histoire 
Ne pas tant se détester 
Et simplement boire 
À la source d'à côté
J'aurais pu dit l'une
Te prendre la main ailleurs 
Mais ton coup de lune 
C'est aussi mon coup au cœur
Tes vagabondages 
Font écrouler ma maison 
Mais tu fais ta cage 
Des barreaux de ma prison
L'autre Et L'une
 
Que tu sois l'autre ou l'une
Tu prends ton coup de lune 
Tu prends ton coup au cœur 
Que tu sois l'une ou l'autre
Souvent la marche est haute 
Pour trouver le bonheur
L'autre Et L'une
 
Que tu sois l'autre ou l'une
Tu prends ton coup de lune 
Tu prends ton coup au cœur 
Que tu sois l'une ou l'autre
Souvent la marche est haute 
Pour trouver le bonheur


  ",L'autre Et L'une,Anne Sylvestre,,Sabe de quem é a composição? Envie pra gente.
"La Vaisselle
 
Qui c'est qui fait la vaisselle?
Faut pas qu' ça se perde!
Qui c'est qui doit rester belle
Les mains dans la merde?
La Vaisselle
 
Mais tout change, mais tout change 
Et voici Jules qui lange 
Les fesses de l'héritier
Il balaie, il balaie 
Et bientôt, quelle merveille 
Il astique le plancher
La Vaisselle
 
Ça fait rien 
On change rien!
La Vaisselle
 
Qui c'est qui fait la vaisselle?
Faut pas qu' ça se perde!
Qui c'est qui doit rester belle
Les mains dans la merde?
La Vaisselle
 
Mais tout bouge, mais tout bouge 
Et voici que les yeux rouges 
Il fait cuire le rôti 
Il cuisine, il cuisine 
Quelle splendeur assassine! 
Fait la plonge et il essuie
La Vaisselle
 
Ça fait rien 
On change rien!
La Vaisselle
 
Qui c'est qui fait la vaisselle?
Faut pas qu' ça se perde!
Qui c'est qui doit rester belle
Les mains dans la merde?
La Vaisselle
 
Mais tout marche, mais ça marche 
Et voici qu'il ne se cache
Quand il reste à la maison 
C'est Germaine qui ramène
Tout l'argent de la semaine
Ce n'est pas contre raison
La Vaisselle
 
Ça fait rien 
On change rien!
La Vaisselle
 
Qui c'est qui fait la vaisselle?
Faut pas qu' ça se perde!
Qui c'est qui doit rester belle
Les mains dans la merde?
La Vaisselle
 
Mais il l'aime, mais ils s'aiment
Et ce n'est pas un problème
De savoir qui va porter 
La culotte ou bien les bottes 
Et le seul drapeau qui flotte 
C'est une taie d'oreiller
La Vaisselle
 
Ça fait rien 
On change rien!
La Vaisselle
 
Qui c'est qui fait la vaisselle?
Faut pas qu' ça se perde!
Qui c'est qui doit rester belle
Les mains dans la merde?
La Vaisselle
 
Mais voici que sonne l'heure
De traîner l'enfant qui pleure
Vers l'école aux bancs de bois
L'enfant de Germaine et Jules
Sans y penser, articule 
Dans les livres d'autrefois
La Vaisselle
 
Ça fait rien 
On change rien!
La Vaisselle
 
Qui c'est qui fait la vaisselle?
Faut pas qu' ça se perde!
Qui c'est qui doit rester belle
Les mains dans la merde?
La Vaisselle
 
Tout recule, tout recule 
Et plus tard le petit Jules 
Aura des enfants aussi 
Qui derrière leur cartable 
Dans l'école imperturbable
Épelleront ces niaiseries
La Vaisselle
 
Ça fait rien 
On change rien!
La Vaisselle
 
Qui c'est qui fait la vaisselle?
Faut pas qu' ça se perde!
Qui c'est qui doit rester belle
Les mains dans la merde?
La Vaisselle
 
Qui c'est qui fait la vaisselle?
Faut pas qu'ça se perde
Oh, ben non! 
Merde!


  ",La Vaisselle,Anne Sylvestre,,Sabe de quem é a composição? Envie pra gente.
"Lazare et Cécile
 
On dit que Lazare et Cécile 
Se sont enfuis cette nuit 
Et que la lune docile 
Jusqu'au matin n'a pas luit
On dit qu'un foulard de brume
Fit pour elle un voile blanc 
Fit à Lazare un costume 
Tissé de nacre et d'argent
Lazare et Cécile
 
On le savait au village 
Que Cécile allait souvent 
Rêvasser dans les herbages 
Et danser avec le vent 
On riait de ce Lazare 
Sans amie sans fiancée 
Qui rôdait près de la mare 
Et n'allait jamais danser
Lazare et Cécile
 
On dit que Lazare et Cécile 
Ont un soir changé d'avis
C'était pourtant pas facile
De se cacher près d'ici
Ils ont joint leur solitude 
Ils ont partagé le vent 
Prenant la douce habitude 
De s'aimer secrètement
Lazare et Cécile
 
Au bout de quelques semaines 
Il parut aux indiscrets 
Que dans sa jupe de laine 
Cécile s'alourdissait
Lors il fallut les entendre 
Tous crier au déshonneur 
Mais Cécile qui est tendre 
A préféré le bonheur
Lazare et Cécile
 
On dit que Lazare et Cécile 
Se sont enfuis cette nuit 
Il y a bien des imbéciles 
Pour en sourire aujourd'hui
Pourtant jusqu'au bout des saules
Ils se sont tenus la main 
Puis épaule contre épaule 
Ils ont suivi leur chemin
Lazare et Cécile
 
On aurait voulu peut-être 
Voir Cécile dans l'étang
Et sur la branche d'un hêtre
Trouver Lazare pendant 
Sans gêne on aurait pu suivre 
Leur cortège en soupirant 
Mais ceux que l'amour délivre
Préfèrent s'aimer vivants
Lazare et Cécile
 
On dit que Lazare et Cécile 
Se sont mariés cette nuit 
Dans la lumière fragile 
Des heures d'après minuit
On dit qu'au creux de la mare
La lune en deux se brisa 
Formant deux anneaux bizarres 
Qu'ils se glissèrent au doigt
Lazare et Cécile
 
Lorsque ils ont couru ensemble 
Le vent leur fit un manteau 
Moi qui ne dormais pas j'en tremble
De les avoir vus si beaux 
Toi, Cécile, toi, Lazare 
Apprenez à votre enfant 
Que jamais on ne sépare 
Ceux qui s'aiment simplement
Lazare et Cécile
 
Que jamais on ne sépare 
Ceux qui s'aiment simplement


  ",Lazare et Cécile,Anne Sylvestre,,Sabe de quem é a composição? Envie pra gente.
