Lyrics,Song,Artist,Genre,Composition
"
        2000 Blues
        
    
 
A hundred thousand dollars 
Wouldn't touch the price i paid
Of the hundred thousand moments 
Of the times i wish i'd stayed.
But even if i had all the time and money, 
It's still the same old news.
Nothin' does you any good
When you got 2000 blues.

        2000 Blues
        
    
 
Ten thousand clouds 
On a rainy rainy day 
Couldn't wash away
All the dust and the haze. 
But i tried and i tried 
To search for all the clues, 
Why i can't wash away
These 2000 blues.

        2000 Blues
        
    
 
If i had an airplane 
With a co-pilot too, 
I'd fly to a planet
That was closest to you. 
I'd set the tracking system
With your safety fuse, 
And set the countdown 
For 2000 blues.


  Essa informação está errada? Nos avise. ",,,,Composição: Billy Gibbons / Dusty Hill / Frank Beard. 
"
        36-22-36
        
    
 
What, what, what chu you want?  
My thing is a real fine thing 
It's a thing it's a real fine thing
It ain't broke, it don't need a fix
36-22-36 
I got a gyroscope goin' round and round
Got a thunderbird take me all over town 
Got a transistor radio standin' on the mix
36-22-36 
36-18-36 
Where'd she go? 
What chu say? 36-22-36 
What chu say? 36-22-36 
You want what? 36-22-36 
What chu say? 36-22-36 
What chu want?


  ",,,,Sabe de quem é a composição? Envie pra gente.
"
        A Fool For Your Stockings
        
    
 
Is it you again outside, 
Just banging on the front door? 
You say you had enough, 
Now you're coming' back for more,
But that's alright.
I said that that's alright.
I may not want to admit it, 
I'm just a fool for your stockings I believe.
Now I don't mind when you send money
and bring your girlfriends with you, 
But how could one be so thoughtless to try 
and handle less than two? 
But that's alright.
I said that that's alright, baby.
I may not want to admit it, 
I'm just a fool for your stockings I believe.
Now I'm tellin' everybody
It seems too good to be true: 
Sweet things can always get sweeter. 
I know mine did, how about you? 
Yes, it's alright.
I said, yes it is, that's alright.
I may not want to admit it, 
I'm just a fool for your stockings I believe


  Essa informação está errada? Nos avise. ",,,,Composição: Billy Gibbons / Dusty Hill / Frank Beard. 
"
        Afterburner
        
    
 
When it's cold outside and you want to sleep in
go for a pallet that's so nice and thin.
Zip it on around while it's on the ground,
spread it out and lay it on down. 
Slip inside my sleeping bag, 
slip inside my sleeping bag.

        Afterburner
        
    
 
You're afraid of the dark, baby, no need to be shy.
We'll talk about some lovin' while we look at the sky.
Don't be hesitating, it'll be alright,
we'll tuck it in until it's clean out of sight.
Slip inside my sleeping bag, 
slip inside my sleeping bag.

        Afterburner
        
    
 
Let's go out to Egypt cause it's in the plan,
sleep beside the pharoahs in the shifting sand. 
We'll look at some pyramids and check out some heads.
Oh, we'll whip out our mattress cause there ain't no beds.
Slip inside my sleeping bag, 
slip inside my sleeping bag.


  ",,,,Sabe de quem é a composição? Envie pra gente.
"
        Alley-Gator
        
    
 
Crawlin' cross the floor at the Holiday Inn motel 
saw that girl that my swamp bone knew so well  
She crawled out of Texas flipped off to Baton Rouge  
She got that Gulf Coast sun tan that give a poor boy the blues 

        Alley-Gator
        
    
 
Alley-gator  
With those hypnotic big green eyes  
Alley-gator  
She'll make you fraid em 
She'll chew you up, ain't no lie 
Yeah yeah yeah 

        Alley-Gator
        
    
 
Crawlin' through the weeds with a Louisiana mean-toothed grin 
You tell her that you love her, then you better tell her once again  
She might scratch your back, rub you with her rack  
You better watch out or stand back 

        Alley-Gator
        
    
 
Alley-gator  
With those hypnotic big green eyes  
Alley-gator  
She'll make you fraid em 
She'll chew you up, ain't no lie 
Listen hear 

        Alley-Gator
        
    
 
Alley-gator  
With those hypnotic big green eyes  
Alley Gator  
She'll make you fraid em 
She'll chew you up, ain't no lie 

        Alley-Gator
        
    
 
Alley-gator 

        Alley-Gator
        
    
 
Alley-gator 

        Alley-Gator
        
    
 
Alley-gator 

        Alley-Gator
        
    
 
Alley-gator 

        Alley-Gator
        
    
 
Alley-gator 

        Alley-Gator
        
    
 
Alley-gator 

        Alley-Gator
        
    
 
Alley-gator 

        Alley-Gator
        
    
 
Alley-gator 

        Alley-Gator
        
    
 
Crocodile 

        Alley-Gator
        
    
 
Crocodile 

        Alley-Gator
        
    
 
Alley-gator


  Essa informação está errada? Nos avise. ",,,,Composição: Billy Gibbons. 
"
        Antenna Head
        
    
 
Old 61's my number on the highway
I'm turning up the V's on the airways
I'm tuned into some bad-ass transactions
It's the only way to get my satisfaction
Yeah antenna head, yeah antenna head 
Antenna waves be burnin' up my radio
Mister Deejay say it's the only way to go
Cranked up all the way my tube is turning read 
Got a pocket full off cornbread just call it 
Antenna head 
Yeah antenna head 
Yeah antenna head 
Yeah yeah yeah antenna head 
Yeah antenna head


  Essa informação está errada? Nos avise. ",,,,Composição: Billy Gibbons / Dusty Hill / Frank Beard. 
"
        Apologies To Pearly (instrumental)
        
    
 
[


  ",,,,Sabe de quem é a composição? Envie pra gente.
"
        Arrested for Driving While Blind
        
    
 
When you're driving down the highway at night
And you're feelin' that wild turkey's bite
Don't give Johnny Walker a ride
Cause Jack Black is right by your side 
You might get taken to the jailhouse and find 
You've been arrested for driving while blind

        Arrested for Driving While Blind
        
    
 
Now just the other night with nothin' to do
We broke a case of proof 102 
And started itchin' for that wonderful feel
Of rollin' in an automobile
You could say we was out of our mind 
And let me tell you we were flyin' while blind

        Arrested for Driving While Blind
        
    
 
Then they had us up against the wall  
Hey it's only blood grain alcohol
And there ain't no cause for alarm
We ain't out to do nobody no harm
How could anyone be so unkind 
To arrest a man for drivin' while blind


  Essa informação está errada? Nos avise. ",,,,Composição: Billy Gibbons / Dusty Hill / Frank Beard. 
"
        Asleep In The Desert
        
    
 
[


  ",,,,Sabe de quem é a composição? Envie pra gente.
"
        As Time Goes By
        
    
 
You must remember this 
A kiss is still a kiss, a sigh is just a sigh 
The fundamental things apply 
As time goes by

        As Time Goes By
        
    
 
And when two lovers woo 
They still say I love you, on that you can rely 
No matter what the future brings 
As time goes by

        As Time Goes By
        
    
 
Moonlight and love songs, never out of date 
Hearts full of passion, jealousy, and hate 
Woman needs man and man must have his mate 
That no one can deny

        As Time Goes By
        
    
 
It's still the same old story
A fight for love and glory, a case of do or die 
The world will always welcome lovers 
As time goes by


  ",,,,Sabe de quem é a composição? Envie pra gente.
"
        Avalon Hideaway
        
    
 
Somebody breathin' down my neck
While I'm tryin' to roll the bones
I don't care I'll just float a check
Cause I'm feelin' my gamblin' Jones
Here come seven, gimme eleven come again 
Love to hideout where I am my own best friend

        Avalon Hideaway
        
    
 
There's crazy little Linda Lou
With the long and lanky legs 
Nobody do it like Linda do 
At these backwoods lone star dregs 
Like I told you, head out FM 92 
Roll in slowly, you'll be safer if you do

        Avalon Hideaway
        
    
 
If you don't know what I'm talkin' about
Let me ease your worried mind 
It's the place to go without a doubt
But it's a little bit hard to find
Back in the timber, once you're there
You'll wanna stay
Get loose and limber anytime night or day 
Just remember, ask for the Avalon hideaway


  Essa informação está errada? Nos avise. ",,,,Composição: Billy Gibbons / Dusty Hill / Frank Beard. 
"
        Back Door Love Affair
        
    
 
Got to have you baby 
Don't you say that you don't care
Got to have you baby 
Don't you say that you don't care

        Back Door Love Affair
        
    
 
Any way you want it baby 
I'll settle for a back door love affair

        Back Door Love Affair
        
    
 
I call you on the telephone 
The party says that you ain't there
I call you on the telephone 
The party says that you ain't there

        Back Door Love Affair
        
    
 
When a man asked who's callin
I said, just tell em it's a back door love affair


  Essa informação está errada? Nos avise. ",,,,Composição: Bill Ham / Billy Gibbons. 
"
        Backdoor Medley
        
    
 
I. Backdoor Love Affair

        Backdoor Medley
        
    
 
Got to have you, baby, even  
though you say that you don't care.
Got to have you, baby, even  
though you say that you don't care.
Any way you want it,  
settle for a backdoor love affair.

        Backdoor Medley
        
    
 
- Billy Gibbons & Bill Ham

        Backdoor Medley
        
    
 
II. Mellow Down Easy

        Backdoor Medley
        
    
 
Jump, jump here, jump, jump there, 
jump, jump, baby, everywhere. 
Don't you mellow down easy,
babe, you got to mellow down easy. 
Don't you mellow down easy.
Got to mellow down easy. 
Don't you mellow down easy.
Got to mellow down easy, babe. 
Don't you mellow down easy.
Got to mellow down easy. 
Don't you mellow down easy.
Mellow down easy when you really wanna blow your top.

        Backdoor Medley
        
    
 
Shake, shake here, shake, shake there, 
shake, shake, baby, everywhere. 
Don't you mellow down easy,
babe, you got to mellow down easy. 
Don't you mellow down easy.
Got to mellow down easy. 
Don't you mellow down easy.
Got to mellow down easy, babe. 
Don't you mellow down easy.
Got to mellow down easy. 
Don't you mellow down easy.
Mellow down easy when you really wanna blow your top.

        Backdoor Medley
        
    
 
Shake, shake here, shake, shake there, 
shake, shake, baby, everywhere. 
Don't you mellow down easy,
babe, you got to mellow down easy. 
Don't you mellow down easy.
Got to mellow down easy. 
Don't you mellow down easy.
Got to mellow down easy, babe. 
Don't you mellow down easy.
Got to mellow down easy. 
Don't you mellow down easy.
Mellow down easy when you really wanna blow your top.

        Backdoor Medley
        
    
 
- Willie Dixon

        Backdoor Medley
        
    
 
III. Backdoor Love Affair No. 2

        Backdoor Medley
        
    
 
Baby baby baby baby, don't you want a man like me?
Uh-huh uh-huh, yes I do, yes I do. 
Oh, baby baby baby baby, don't you want a man like me?
Uh-huh uh-huh, uh-huh uh-huh, uh-huh uh-huh. 
Oh, I give you lovin' by the daytime,
night time you could take good care of me.

        Backdoor Medley
        
    
 
Baby baby baby baby, don't you want a man like me?
Uh-huh uh-huh, yes I do, yes I do. 
Oh, baby baby baby baby, don't you want a man like me?
Uh-huh uh-huh, uh-huh uh-huh, uh-huh uh-huh. 
Oh, I give you lovin' by the daytime,
night time you could take good care of me.

        Backdoor Medley
        
    
 
Baby baby baby baby, don't you want a man like me?
Uh-huh uh-huh, yes I do, yes I do. 
Oh, baby baby baby baby, don't you want a man like me?
Uh-huh uh-huh, uh-huh uh-huh, uh-huh uh-huh. 
Oh, I give you lovin' by the daytime,
night time she could take good care of me.

        Backdoor Medley
        
    
 
- Billy Gibbons

        Backdoor Medley
        
    
 
IV. Long Distance Boogie

        Backdoor Medley
        
    
 
Is everybody feelin' good? You makin' us feel good, too!
Now, early this morning I got on that long distance telephone 
and I called my mama. 
I said, Mama, this is your boy, and I\'m way down here in 
New Orleans, Louisiana. 
And she said, That\'s all right, boy. 
And she turned to my papa and she said,  
Papa, our boy\'s way down there in New Orleans. 
We cannot let him stay out all night long. 
She did! 
Long about that time, I heard my papa lean toward my mama. 
I heard papa tell mama, Let that boy boogie-woogie. 
He said, It\'s in him and it\'s got to come out.

        Backdoor Medley
        
    
 
So I went downtown. 
There's a lot of people there.
They was-a really havin' a ball.
And I felt so good. 
Yes, I felt so good. 
Yes, I felt so good. 
Yes, I felt so good. 
Yes, I felt so good. 
Yes, I felt so good. 
Yes, I felt so good.

        Backdoor Medley
        
    
 
Boogie, children!

        Backdoor Medley
        
    
 
Boogie, children!


  Essa informação está errada? Nos avise. ",,,,Composição: Philip T. Pugh / Sherman Marshall. 
"
        Bad Girl
        
    
 
See that girl with the red dress on, 
she can do it all night long, 
she's a bad girl, she's a bad girl.
I know a girl that likes to flirt, 
she can do it in a mini skirt. 
She's a bad girl, she's a bad girl.
Ain't it a shame when a girl goes bad,
it's enough to drive you mad.

        Bad Girl
        
    
 
Yesterday I was playin' it cool
but she played me for a first class fool, 
she's a bad girl, she's a bad girl.
I'm gonna tell you like I told some friends
I'm goin' back to dig her again.
She's a bad girl, she's a bad girl.
Ain't it a shame when a girl goes bad,
it's enough to drive you mad.

        Bad Girl
        
    
 
I know a girl with a GTO, 
she's the one that go cat go,
she's a bad girl, she's a bad girl.
See the girl dressed in green, 
she's the one that's a mean machine,
she's a bad girl, she's a bad girl.
Ain't it a shame when a girl goes bad,
it's enough to drive you mad.


  Essa informação está errada? Nos avise. ",,,,Composição: Billy Gibbons / Dusty Hill / Frank Beard. 
"
        Balinese
        
    
 
Deep in the South of Texas 
not so long ago, 
there on a crowded island 
in the Gulf of Mexico

        Balinese
        
    
 
it didn't take too much money,
man, but it sure was nice. 
You could dance all night if you felt all right, 
drinking whiskey and throwing dice.

        Balinese
        
    
 
And everybody knows 
it was hard to leave. 
And everybody knows 
it was down at the Balinese.

        Balinese
        
    
 
Yeah, I remember Ruby, 
she always dressed in red 
wearing skintight pants, Lord, and how she could dance 
with a rag wrapped around her head.

        Balinese
        
    
 
And everybody knows 
it was hard to leave. 
And everybody knows 
it was down at the Balinese.

        Balinese
        
    
 
And everybody knows 
it was hard to leave. 
And everybody knows 
it was down at the Balinese, 
it was down at the Balinese, 
it was down at the Balinese.


  Essa informação está errada? Nos avise. ",,,,Composição: Billy Gibbons / Dusty Hill / Frank Beard. 
"
        Bang Bang
        
    
 
Percussion-dominated song, afrobeat loops from Frank Beard. Composed 
for the movie Striptease, though they chose to use La Grange instead.

        Bang Bang
        
    
 
Everybody knows what it's all about
Pretty thing jumpin' all around
Shakin' your money-maker now
Take it off and take me down

        Bang Bang
        
    
 
Bang, bang, shang-a-lang 
Bang, bang, shang-a-lang 
Take it off 
She bang-bang my shang-a-lang 
She bang-bang my shang-a-lang 
Hey yeah

        Bang Bang
        
    
 
Tear me up, baby, tear me down 
You got me movin' upside down
Feelin' good, I'm feelin' alright
Do it again, do it all night

        Bang Bang
        
    
 
Bang, bang, shang-a-lang 
Bang, bang, shang-a-lang 
Take it off, take it off 
She bang-bang my shang-a-lang 
She bang-bang my shang-a-lang 
(popgun!)

        Bang Bang
        
    
 
Hey, hey, hey...

        Bang Bang
        
    
 
Do me once, baby do me twice 
Do it cos it feels so nice
I don't care bout nothin' else
Do me til my money melts

        Bang Bang
        
    
 
Bang, bang, shang-a-lang, take it off 
Bang, bang, shang-a-lang, hey yeah 
She bang-bang my shang-a-lang 
She bang-bang my shang-a-lang 
Hey 
(popgun!)

        Bang Bang
        
    
 
Hey, hey, hey...


  Essa informação está errada? Nos avise. ",,,,Composição: Billy Gibbons. 
"
        Bar-B-Q
        
    
 
No, baby, tell me why don't you?
Well, now, baby, tell me why don't you?
Aw, baby, tell me why don't you?

        Bar-B-Q
        
    
 
No, baby, now want to make me some? 
Oh, now, baby, now want to make me some? 
Aw, baby, now want to make me some?

        Bar-B-Q
        
    
 
No, baby, tell me why don't you?
Oh, now, baby, tell me why don't you
aw, make me some of your fine famous Bar-B-Q?


  Essa informação está errada? Nos avise. ",,,,Composição: Bill Ham / Billy Gibbons. 
"
        Beatbox
        
    
 
A nine volt battery from japan 
It's got the beat
A little tape deck in my hand 
It's so so sweet
Keeps me rockin' round the clock
I don't mind it
I got the beatbox, the beatbox 
Just a beatin' that box
Beatbox, beatbox 
One c-90's back to back
Jumpin?on that jack 
Don't play with fire or
Unplug my wire, beg or steal 
It's not for hire
Keeps me rockin' ?round the clock
I don't mind it because
I got the beatbox, the beatbox 
Just a beatin' that box
Beatbox, beatbox 
[cities not listed
 
Paris, Rome, Toyko, Osaka, Forenza, Milano, Vesuvio 
Dallas, Texas (have mercy)


  ",,,,Sabe de quem é a composição? Envie pra gente.
"
        Bedroom Thang
        
    
 
I know you wanna be my bedroom thang 
But you're much too young
You're the finest thing I've ever seen
You just wanna have fun

        Bedroom Thang
        
    
 
I need someone who can scratch my back 
I need someone who can carry my pack 
I need someone to be with me at night 
You're gonna make me feel alright

        Bedroom Thang
        
    
 
Don't you bother me with petty lines
I know you ran away from home 
This might come to you as some surprise 
I wish you'd leave me alone

        Bedroom Thang
        
    
 
I need someone to scratch my back 
I need someone to carry my pack 
I need someone to be with me at night 
You're gonna make me feel alright


  Essa informação está errada? Nos avise. ",,,,Composição: Billy Gibbons. 
"
        Beer Drinkers & Hell Raisers
        
    
 
If you see me walkin' down the line
With my fav'rite honky tonk in mind
Well, I'll be here around suppertime
With my can of dinner and a bunch of fine

        Beer Drinkers & Hell Raisers
        
    
 
Beer drinkers and hell raisers, yeah 
Uh-huh-huh, baby, don't you wanna come with me?

        Beer Drinkers & Hell Raisers
        
    
 
The crowd gets loud when the band gets right 
Steel guitar cryin' through the night
Yeah, try'n to cover up the corner fight
But ev'rything's cool cause bass is tight

        Beer Drinkers & Hell Raisers
        
    
 
Beer drinkers and hell raisers, yeah 
Huh, baby, don't you wanna come with me?
Ah, play it boy

        Beer Drinkers & Hell Raisers
        
    
 
The joint was jumpin' like a cat on hot tin
Lord, I thought the floor was gonna give in 
Soundin' a lot like a House Congressional
cause we're experimental and professional

        Beer Drinkers & Hell Raisers
        
    
 
Beer drinkers, hell raisers, yeah 
Well, baby, don't you wanna come with me?


  Essa informação está errada? Nos avise. ",,,,Composição: Billy Gibbons / Dusty Hill / Frank Beard. 
"
        Belt Buckle
        
    
 
Red, red lips 
Swivelin? hips 
Movin' in some new blue jeans
Shufflin' sweet right with that beat
She can really shake that thing 
Belt buckle 
Shinin' day and night
When she shake that thing 
Hope it's next to mine
I said, lord have mercy, my o? my 
You been lookin' too good
I think you wanna shake with me 
Baby I think you should 
Belt buckle 
Shinin' day and night
When you shake that thing 
Hope it's next to mine
Please, please baby, I wanna say 
You lookin' so fine
And if you hold mine next to yours 
I'll hold you next to mine
Belt buckle 
Shinin? day and night 
When you shake that thing 
Hope it's next to mine


  ",,,,Sabe de quem é a composição? Envie pra gente.
"
        Black Betty
        
    
 
Whoa, Black Betty (Bam-ba-Lam) 
Whoa, Black Betty (Bam-ba-Lam)

        Black Betty
        
    
 
Black Betty had a child (Bam-ba-Lam) 
The damn thing gone wild (Bam-ba-Lam) 
She said, I\'m worryin\' outta mind (Bam-ba-Lam) 
The damn thing gone blind (Bam-ba-Lam) 
I said Oh, Black Betty (Bam-ba-Lam) 
Whoa, Black Betty (Bam-ba-Lam)

        Black Betty
        
    
 
Oh, Black Betty (Bam-ba-Lam) 
Whoa, Black Betty (Bam-ba-Lam)

        Black Betty
        
    
 
She really gets me high (Bam-ba-Lam) 
You know that's no lie (Bam-ba-Lam)
She's so rock steady (Bam-ba-Lam)
And she's always ready (Bam-ba-Lam)
Whoa, Black Betty (Bam-ba-Lam) 
Whoa, Black Betty (Bam-ba-Lam)

        Black Betty
        
    
 
Whoa, Black Betty (Bam-ba-Lam) 
Whoa, Black Betty (Bam-ba-Lam)

        Black Betty
        
    
 
She's from Birmingham (Bam-ba-Lam)
Way down in Alabam' (Bam-ba-Lam)
Well, she's shakin' that thing (Bam-ba-Lam)
Boy, she makes me sing (Bam-ba-Lam) 
Whoa, Black Betty (Bam-ba-Lam) 
Whoa, Black Betty 
BAM-BA-LAM


  ",,,,Sabe de quem é a composição? Envie pra gente.
"
        Black Fly
        
    
 
Black fly buzzin  buzzin' around
Black fly flyin' from town to town
Black fly lookin' around and around
What's he gonna do when he finds her?

        Black Fly
        
    
 
He got the mojo workin' overtime
Makin' it, layin' it on the line
Chasin' his honey with a honeysuckle vine
Who's so lucky and gets to kiss her?

        Black Fly
        
    
 
Black fly, that's right
Black fly, that's right

        Black Fly
        
    
 
Flyin' round lookin' for a black cat bone
Flyin' with John the conquerer showin
Messin' around with a honey-bee
Will she kiss him or sting him, what's it gonna be?

        Black Fly
        
    
 
Black fly, that's right
Black fly, that's right

        Black Fly
        
    
 
Black fly buzzin, buzzin' around
Black fly flyin' from town to town
Black fly zzzzz'n all around
Fly gonna fly when he find her

        Black Fly
        
    
 
Black fly, that's right
Black fly, that's right
Black fly, that's right
Black fly, yeah that's alright


  Essa informação está errada? Nos avise. ",,,,Composição: Billy Gibbons. 
"
        Blue Jean Blues
        
    
 
I done ran into my baby 
And fin'lly found my old blue jean
I done ran into my baby 
And fin'lly found my old blue jean
Well, I could tell that they was mine 
From the oil and the gasoline

        Blue Jean Blues
        
    
 
If I ever get back my blue jean 
Lord, how happy could one man be 
If I ever get back my blue jean 
Lord, how happy could one man be 
Cause if I get back those blue jean
You know, my baby be bringin' em home to me


  Essa informação está errada? Nos avise. ",,,,Composição: Billy Gibbons / Dusty Hill / Frank Beard. 
"
        Breakaway
        
    
 
It's a chemical attraction I just can't slide by
Every time I look into my baby's eyes
I'm helpless, so helpless, so I surrender
There's a visual attraction and she's branded my soul
Simply can't deny it, she has control
I'm helpless, so helpless, so I remember
She won't let me breakaway
She won't let me breakaway
I said break away, yeah, ah yeah 
We were working it though, baby we had a groove 
Movin' to the moment when we make our move
But it happened, something happened 
And I'm not lying bout the pain
She won't let me breakaway
She won't let me breakaway
I said breakaway, yeah, oh yeah 
I want the answer, I want my soul 
I'm dealing with a feeling deeper in love
But I'm helpless, so helpless, but I remember
She keeps saying breakaway 
Something's saying breakaway
Telling me to breakaway 
Keeps on saying breakaway


  Essa informação está errada? Nos avise. ",,,,Composição: Billy Gibbons. 
"
        Brown Sugar
        
    
 
My friends, they all told me 
Man, there's something gonna change your life
My friends, they all told me 
Man, there's something gonna change your life
Gotta have that brown sugar 
Man it's just gonna change my life
Man, I gotta have that brown sugar 
Man, it's just gonna make me feel so right

        Brown Sugar
        
    
 
There's something make me feel good
and it's gonna change my life
There's something make me feel good
and it's gonna change my life
I gotta have some of that Brown Sugar 
Gotta try it before I die

        Brown Sugar
        
    
 
Man it sure do save me 
when there's no place left for me
Man it sure do save me 
when there's no place left for me
Gotta have some of that Brown Sugar 
as long as that's gonna set me free

        Brown Sugar
        
    
 
Man, there's somethin' make me feel good
and it's gonna change my life
Man, there's somethin' make me feel good
and it's gonna change my life
I gotta have some of that Brown Sugar 
Gotta try it before I die


  Essa informação está errada? Nos avise. ",,,,Composição: Billy Gibbons. 
