Lyrics,Song,Artist,Genre,Composition
"
        Party On The Patio
        
    
 
I found an empty house in my neighborhood, 
I knew that wer shouldn't but I thought we could.
Knew it wouldn't be hard to slide into the backyard,
Called all my friends and slipped a hundred to the guard. 
We turned on the radio and had a party on the patio.

        Party On The Patio
        
    
 
Betty's in the sauna and she's getting kind of hot,
Mary's in the icebox wishin' she was not.
Connie's in the whirlpool, Jimmy's tryin' to be cool,
Libby's in the bushes cause she's nobody's fool.
We turned the lights down low and had a party on the patio.

        Party On The Patio
        
    
 
Heard the cops are coming so we tried to jump the fence, 
Mary didn't make it and we haven't seen her since.
Connie had another drink, Jimmy simply couldn't think,
Billy G. was passed out underneath the sink. 
But everybody's gonna show for another party on the patio.


  Essa informação está errada? Nos avise. ",,,,Composição: Billy Gibbons / Dusty Hill / Frank Beard. 
"
        PCH
        
    
 
I was out on the coastline 
Getting a little shake 
Do it every day 
for mercy sake 
Sometime surf's up
Sometimes it's flat
Eatin' up asphalt
Prowlin' like a tomcat
Stunned at what I see 
Should I stay or should I leave 
Too much, not enough PCH 
Too much, not enough PCH 
Feelin' kind of free
By the deep blue sea 
A true blood blue slud 
Hangin' on me
Wanna head north 
But I might go south 
Can't make up my mind
Cause I'm thinking like Brian
I'm hangin' in and out
I'm pullin' up cause it's about
Too much, not enough PCH 
Too much, not enough PCH


  Essa informação está errada? Nos avise. ",,,,Composição: Billy Gibbons / Dusty Hill / Rube Beard. 
"
        Pearl Necklace
        
    
 
She's really upset with me again,
I didn't give her what she likes.
I don't know what to tell her,
Don't know what to say.
Everything got funky last night.

        Pearl Necklace
        
    
 
She was really bombed, 
And I was really blown away, 
Until I asked her what she wanted, 
And this is what she had to say: 
A pearl necklace. 
She wanna pearl necklace. 
She wanna pearl necklace.

        Pearl Necklace
        
    
 
She gets a charge out of bein' so weird,
Digs gettin' downright strange.
But I can keep a handle on anything, 
Just this side of deranged.

        Pearl Necklace
        
    
 
She was gettin' bombed,
And I was gettin' blown away,
And she held it in her hand  
And this is what she had to say: 
A pearl necklace. 
She wanna pearl necklace. 
She wanna pearl necklace.

        Pearl Necklace
        
    
 
She's so cold, as pure as the driven slush.
And that's not jewelry she's talkin'about, [see notes

It really don't cost that much.

        Pearl Necklace
        
    
 
She was gettin' bombed,
And I was gettin' blown away,
And she took it in her hand, 
And this is what she had to say: 
A pearl necklace. 
She wanna pearl necklace. 
She wanna pearl necklace.


  Essa informação está errada? Nos avise. ",,,,Composição: Billy Gibbons / Dusty Hill / Frank Beard. 
"
        Penthouse Eyes
        
    
 
She's always checkin' with her penthouse eyes,
Makes me stutter, gives me butterflies. 
Got to have her, she pins me up with her penthouse eyes.

        Penthouse Eyes
        
    
 
I wanna lie where her eagle flies, 
She's got my love pressure on the rise.
When I see her, she really rocks me with her penthouse eyes.

        Penthouse Eyes
        
    
 
Don't need excuse for graspin 
Can't blame the boy for askin'.
One look sting you like a honey bee, 
But it's her eyes gonna set you free.

        Penthouse Eyes
        
    
 
I wanna stretch her out in old Levi's,
Got to have a little piece of paradise. 
I got to have her, she pins me up with her penthouse eyes.

        Penthouse Eyes
        
    
 
Don't need excuse for graspin 
Can't blame the boy for askin'.
There's no escape let me tell you no lie,
She's always lookin' with her penthouse eyes.


  Essa informação está errada? Nos avise. ",,,,Composição: Billy Gibbons / Dusty Hill / Frank Beard. 
"
        Piece
        
    
 
Piece  
I want a little piece  
I want a little piece of your love 

        Piece
        
    
 
I' ve been here, I' ve been there 
Seems like I' ve been everywhere 
Lookin' around lookin' for a release 
I'm just lookin' around 

        Piece
        
    
 
Piece  
I want a little piece  
I want a little piece of your love 

        Piece
        
    
 
So tell me, tell me  
What cha gonna do 
I just wanna make love to you 

        Piece
        
    
 
Piece  
I want a little piece  
I want a little piece of your love 

        Piece
        
    
 
Piece  
I want a little piece  
I want a little piece of your love


  ",,,,Sabe de quem é a composição? Envie pra gente.
"
        Pincushion
        
    
 
I been stuck, so I asked her why 
She gave me acupuncture as her alibi 
Shook my soul, and stole my dough 
Left my conditional, a deep dark hole 
I'm a pincushion, gotta face the facts
I'm just a pincushion, do everything she ask
I get nailed every now and then 
I get my mojo working but I'm pinned again
I'm a pincushion, gotta face the facts
I'm just a pincushion, do everything she asks
I'm getting pricked around and punctureated
I let my ya ya down, I got penetrated 
I'm a pincushion, gotta face the facts
I'm just a pincushion, do everything she asks
I'm a pincushion, gotta face the facts
I'm just a pincushion, do everything she asks


  Essa informação está errada? Nos avise. ",,,,Composição: Billy Gibbons. 
"
        Planet Of Women
        
    
 
What can I do, I'm a nervous wreck?
There's girls everywhere, I better go and check. CHECK IT OUT
I can't tell a diamond from a hole in the ground.
They all got my head spinning round and round. 
Planet of women, oh yeah. 
The planet of women, oh yeah. 
It's driving me insane.

        Planet Of Women
        
    
 
They start by acting just a little discreet. 
Then they're in the skies and they're in the streets.
You can find them in cars or a hotel lobby, 
they're easy to find, just look for a body.
Planet of women, oh yeah. 
Just a planet of women, oh yeah. 
It's driving me insane.

        Planet Of Women
        
    
 
If you have the answer, drop me a line today 
or send a straight jacket something in a shade of gray. 
I think I've sprained my brain cause it won't unwind.
Every day it's man against man on the
planet of women, oh yeah. 
Just a planet of women, oh yeah. 
It's driving me insane,
it's driving me insane.


  Essa informação está errada? Nos avise. ",,,,Composição: Billy Gibbons / Dusty Hill / Frank Beard. 
"
        Poke Chop Sandwich
        
    
 
Poke 
Better watch that 
Poke chop sandwich...waitin' in th' sack
Ridin' a tom tom, a double fat back
Got my poke chop sandwich... 
Layin' on da drum
Poke chop greazy...i'm gonna get some
Get some a' dat poke chop
Poke chop sandwich 
Poke chop 
Poke chop sandwich 
Yeah yeah twenty five 
Louisiana back beat and th' texas bop
Do a hollywood shuffle jes' can't top it
New york turn around and 
Th' London stomp
African good luck combination 
I know that ya want 
Poke chop 
Poke chop sandwich 
Poke chop 
Double poke chop sandwich 
Play on 
Spider & lightnin' hopkins got
Th' big bad beat
Ain't no question what they gonna eat
Spider wanna a bottle, 
Lightnin' wanna a can
They'll take in a bucket
Cause they dam well can
A poke chop 
A poke at dat chop 
Cut dat poke chope 
Poke chop sandwich 
Feel like, I feel like a poke chop sandwich 
Give me dat sandwich in wax paper 
Pork chop sandwich


  ",,,,Sabe de quem é a composição? Envie pra gente.
"
        Poke Chop Sandwitch
        
    
 
(about lightnin' hopkins' drummer who used to keep a porkchop sandwich on his floor tom, for snacking during the breaks. recorded with hopkins' drummer, spider, present in the studio.) 
poke 
Better watch that 
Poke chop sandwich…waitin' in th?sack
Ridin' a tom tom, a double fat back
Got my poke chop sandwich?/p>  
Layin' on da drum
Poke chop greazy…i'm gonna get some
Get some a?dat poke chop 
Poke chop sandwich 
Poke chop 
Poke chop sandwich 
Yeah yeah twenty five 
Louisiana back beat and th?texas bop 
Do a hollywood shuffle jes?can't top it
New york turn around and 
Th?london stomp 
African good luck combination 
I know that ya want 
Poke chop 
Poke chop sandwich 
Poke chop 
Double poke chop sandwich 
Play on 
Spider & lightnin' hopkins got
Th?big bad beat 
Ain't no question what they gonna eat
Spider wanna a bottle,  
Lightnin?wanna a can 
They'll take in a bucket
cause they dam well can
A poke chop 
A poke at dat chop 
Cut dat poke chope 
Poke chop sandwich 
Feel like, i feel like a poke chop sandwich 
Give me dat sandwich in wax paper 
Pork chop sandwich


  ",,,,Sabe de quem é a composição? Envie pra gente.
"
        Precious And Grace
        
    
 
Ridin' top the floodway on a Friday night
The landscape's a fine and nat'ral sight
Just cruisin' slow through the dark of night
With Precious and Grace ev'rything's all right

        Precious And Grace
        
    
 
Good God Almighty, we was goin' down slow
Yeah, if we knew just where we had to go 
Cryin  just a flyin' down a put out road
With Precious and Grace in my flathead Ford

        Precious And Grace
        
    
 
So if you're out rollin' late some night
Yeah, and you need that supernatural delight, I'm talkin' to you, brother
I know somebody's, they's just out of sight
Get with Precious and Grace, they gonna treat you right


  Essa informação está errada? Nos avise. ",,,,Composição: Billy Gibbons / Dusty Hill / Frank Beard. 
"
        Prettyhead
        
    
 
Don't send me no bag, don't send me no skag
A pin-headed ho won't do
Don't send me no square without some beehive hair
She got to have her rhythm with blues

        Prettyhead
        
    
 
Gotta have a prettyhead, gotta have a prettyhead 
Gotta have a prettyhead, I said pretty head

        Prettyhead
        
    
 
Don't send nothin' lame, don't send nothin' tame
A scatter-brained ho won't do
Don't send me no skang, don't send me nothin' rang
I want it hot, righteous and blue

        Prettyhead
        
    
 
Gotta have a prettyhead, gotta have a prettyhead 
GOtta have a prettyhead, I said pretty head

        Prettyhead
        
    
 
Play the guitar

        Prettyhead
        
    
 
Drop-dead, big red, icy head, pretty pretty head

        Prettyhead
        
    
 
Don't send me no twig, don't send nothin' big
With a sideways thing-a-majig 
Don't send me no pro, don't send nothin' low
Down and out, holdin' out ho

        Prettyhead
        
    
 
Gotta have a prettyhead, gotta have a prettyhead 
Gotta have a prettyhead, said pretty, pretty head


  Essa informação está errada? Nos avise. ",,,,Composição: Billy Gibbons / Dusty Hill / Frank Beard. 
"
        Punk As Boyfriend
        
    
 
So you stayed in my house for about a year  
Ate my food and you drank my beer  
You took my money and kept asking for more  
You disappeared and didn't close the door, baby 

        Punk As Boyfriend
        
    
 
Wuzzup? wuzzup?  
Wuzzup? wuzzup? 

        Punk As Boyfriend
        
    
 
It's your punkass boyfriend 

        Punk As Boyfriend
        
    
 
Then you came around and I bought you a brand new car  
I said I loved you, didn't get me very far 
Then another round of give that, give me this  
Then boom, you were gone  
I got the total dis' 

        Punk As Boyfriend
        
    
 
Wuzzup? Wuzzup?  
So wrong  
Wuzzup? Wuzzup?  
So wrong 

        Punk As Boyfriend
        
    
 
It's your punkass boyfriend 
It's your punkass boyfriend 

        Punk As Boyfriend
        
    
 
One, two  
It's your punkass boyfriend 
Clouding up the issue  
It's your punkass boyfriend 
I just want to kiss you 

        Punk As Boyfriend
        
    
 
It's your punkass boyfriend 
Clouding up the issue  
Listen punk before I turn on you  
I just want to kiss you 

        Punk As Boyfriend
        
    
 
It's your punkass boyfriend 
It's your punkass boyfriend


  ",,,,Sabe de quem é a composição? Envie pra gente.
"
        Que Lastima
        
    
 
nosotros los pobres borrachos.  
Nadie nos quieren cojer.  
Nuestro corazon no es tan  
malo, pero no tenemos mujer. 

        Que Lastima
        
    
 
Que Lastima  
Que Lastima  
Que Lastima  
Que Lastima  
Que Lastima  
Que Lastima 

        Que Lastima
        
    
 
Nosotros tenemos cerveza,  
tambien tenemos tiempo.  
Importante tener pocos pesos.  
Mi suerte es mala siempre. 

        Que Lastima
        
    
 
Que Lastima  
Que Lastima  
Que Lastima  
Que Lastima  
Que Lastima  
Que Lastima 

        Que Lastima
        
    
 
Que Lastima  
Que Lastima  
Que Lastima  
Que Lastima  
Que Lastima  
Que Lastima 

        Que Lastima
        
    
 
Y nosotros los pobres borrachos.  
Nadie nos quieren cojer.  
Nuestro corazon no es tan  
malo, pero no tenemos mujer. 

        Que Lastima
        
    
 
Que Lastima  
Que Lastima  
Que Lastima


  ",,,,Sabe de quem é a composição? Envie pra gente.
"
        Rhythmeen
        
    
 
Solid-silver beat machine 
Hunkin' down
Funkin' up on Magazine
On rhythmeen in New Orleans

        Rhythmeen
        
    
 
Drinkin' Dixie 45 with hot links
In a silver Continental 
Wired as hell and doin' things
That's what you get on rhythmeen

        Rhythmeen
        
    
 
Oh yeah, way up 
Oh yeah, way out 
Uh-huh, get on up 
Rhythmeen is down 
Rhythmeen thing 
Mean mean rhythmeen

        Rhythmeen
        
    
 
Can't get enough of that special sauce
The backbeat's the big boss
Here comes another dope fiend 
Tradin' up for rhythmeen

        Rhythmeen
        
    
 
Oh yeah, weird up 
Oh yeah, fear not 
Uh-huh, get on up 
Rhythmeen is down

        Rhythmeen
        
    
 
Leanin' on a silver Lincoln
A Galaxy 500 
In a Mustang might Tchoupitoulas 
Rhythmeen up everything


  Essa informação está errada? Nos avise. ",,,,Composição: Billy Gibbons. 
"
        Rio Grande Mud
        
    
 
Got a girl, her name's,
finest thing you ever seen. 
And I love her, she's all that I want.
And I need her, she's all that I need.

        Rio Grande Mud
        
    
 
Well,, oh Francis, why 
do you love me and make me cry? 
How I love her, she's all that I want.
How I need her, she's all that I need.

        Rio Grande Mud
        
    
 
If I ever caught her with Stevie P 
I'd throw her back in the Penitentiary, now.
And if I caught her with my mother's son
I'll call her daddy and get my gun.

        Rio Grande Mud
        
    
 
My Fancine just turned thirteen, 
she's my angelic teenage queen.
And I love her, she's all that I want.
And I need her, she's all that I need.
And I love her, she's all that I want.
And I need her, she's all that I need.
And I love her, she's all that I want.
And I need her, she's all that I need.


  ",,,,Sabe de quem é a composição? Envie pra gente.
"
        Rough Boy
        
    
 
What in the world's come all over me?
I ain't got a chance of one in three
Ain't got no rap, ain't got no line
But if you'll give me just a minute I'll be feeling fine

        Rough Boy
        
    
 
I am the one who can fade the heat 
The one they all say just can't be beat
I'll shoot it to you straight and look you in the eye
So gimme just a minute and I'll tell you why

        Rough Boy
        
    
 
I'm a rough boy
I'm a rough boy

        Rough Boy
        
    
 
I don't care how you look at me
Because I'm the one and you will see
We can make it work, we can make it fine 
So give me one more minute and I'll tell you why

        Rough Boy
        
    
 
I'm a rough boy
I'm a rough boy


  Essa informação está errada? Nos avise. ",,,,Composição: Billy Gibbons / Dusty Hill / Frank Beard. 
"
        Salt Lick
        
    
 
I met a girl with a black cigar, and a salt lick in her hand 
She settled down into a quiet room 
And she started to strike up the band 
She had a time gettin' down to work, with a salt lick in her hand
She ran right in and jumped into my lap, with a salt lick in her hand 
She let me know what was on her mind 
And said I want to play with your band 
I took her home and she blew my 
Mind, and now I'm with her all the time

        Salt Lick
        
    
 
And so it's been for many days and
Nights, as I sit and wonder where she's been
The girl I knew with the black 
Cigar, she bring the salt lick here again 
She walked out on me yeah the other day 
And I haven't seen her round till then?


  ",,,,Sabe de quem é a composição? Envie pra gente.
"
        Sharp Dressed Man
        
    
 
Clean shirt, new shoes 
And I don't know where I am goin' to
Silk suit, black tie 
I don't need a reason why

        Sharp Dressed Man
        
    
 
They come running just as fast as they can 
Coz every girl crazy bout a sharp-dressed man

        Sharp Dressed Man
        
    
 
Gold watch, diamond ring 
I ain't missin  not a single thing
Cufflinks, stick pin 
When I step out I'm gonna do you in

        Sharp Dressed Man
        
    
 
They come a-running just as fast as they can 
Coz every girl crazy bout a sharp dressed man

        Sharp Dressed Man
        
    
 
Top coat, top hat 
And I don't worry coz my wallet's fat
Black shades, white glove 
Lookin' sharp, lookin' for love

        Sharp Dressed Man
        
    
 
They come a-runnin' just as fast as they can
Coz every girl crazy bout a sharp dressed man


  Essa informação está errada? Nos avise. ",,,,Composição: Billy Gibbons / Dusty Hill / Frank Beard. 
"
        Sheik
        
    
 
I met a shiek from Mozambique 
who led me to the Congo. 
He dreamed to go to Mexico 
and sample a burrito.

        Sheik
        
    
 
My tempature had risen again, 
it must have been a hundred and ten.

        Sheik
        
    
 
Under the oaks I was telling some jokes 
and thinkin' I had it made-
Gettin' on with the folks, havin' some Coke
and coolin' off in the shade.

        Sheik
        
    
 
My tempature had risen again, 
and it must have been a hundred and ten.

        Sheik
        
    
 
I took a boat that couldn't float
to Rio de Janeiro. 
So with my scuba I swam to Cuba 
but I'll be gone tomorrow.

        Sheik
        
    
 
My tempature had risen again, 
it must have been a hundred and ten.


  Essa informação está errada? Nos avise. ",,,,Composição: Billy Gibbons / Dusty Hill. 
"
        She Loves My Automobile
        
    
 
She don't love me, she love my automobile.
She don't love me, she love my automobile.
Well she would do anything just to slide behind the wheel. 
She said what's it gonna take for you to lay your top on down?
She said what's it gonna take for you to lay your top on down?
I said honey why don't you ask me when we get to the outskirts of town.
Well now she don't care if I'm stoned or sloppy drunk.
Well she don't care if I'm stoned or sloppy drunk,
Long as she got the keys and there's a spare wheel in her trunk.


  Essa informação está errada? Nos avise. ",,,,Composição: Billy Gibbons / Dusty Hill / Frank Beard. 
"
        She's A Heartbreaker
        
    
 
She used to drive a beat up pickup 
Down around San Antone 
Stealin' the heart of every guy in town
Includin' the one I own
But this sweet young thing of seventeen 
Would sting you with the lovesick blues 
Just a blonde haired blue eyed picture of sin 
Lookin' for someone to use
She's a lover n fighter, she's a wild bull rider
And I'm wonderin' why she left me such a long time ago
She's a heartbreaker, she's a love taker
She can break a heart and take all the love she needs 
Well I heard she got down in Beaumont 
And she wound up in El Paso 
She was tuff as a boot and thin as a rail 
And she could step to the cotton eyed Joe 
If you run across this flagrant fuzzy 
Slip in and get her while you can 
Cause before too long she'll be good as gone
And runnin' with another man
She's a lover n fighter, she's a wild bull rider
And I'm wonderin' why she left me such a long time ago
She's a heartbreaker, she's a love taker
She can break a heart and take all the love she needs


  ",,,,Sabe de quem é a composição? Envie pra gente.
"
        She's Just Killing Me
        
    
 
Everything about her was natural 
Everything about her was cool 
But I'm a little partial for beautiful girls
Even if they blood runs blue 
I think I see her 
I think I want her 
I think I love her 
She's just killing me
I think she's killing me
Her castanets are enormous 
Her bongo beat absolute 
And when she doin' midnite performances
She's got a secret somethin' to boot
I think I see her 
I think I want her 
Oh, I think I love her 
But she's just killing me
I think she's killing me
Miss Satanic Pandemonia 
Don't get any lower or slower
What you see is what you get conmigo 
And the bonus of an albino boa 
I think I see her 
I think I want her 
Yes, I think I love her 
She's just killing me
She's just killing me
(That's some time I had)
I think I see her 
I know I love her 
Yes, I might love her 
She's just killing me
She wanna be killing me 
(Suck my blood)


  Essa informação está errada? Nos avise. ",,,,Composição: Billy Gibbons / Dusty Hill / Frank Beard. 
"
        Sinpusher
        
    
 
I dropped out of society 
Fell by the wayside so to speak 
Quit my job i'm a lazy slob
Never lift a finger cept for my heart throb
I\'m a sinpusher, hangin\' on the on the dldown low 
Just a sinpusher, kinda like heaven or hell 
I want a bit of everything 
I'm wanted by the law
I just want a little bit 
I guess i want it all 
I\'m a sinpusher, hangin\' on the on the dldown low 
Im just a sinpusher, kinda like heaven or hell 
I like my big fat back 
I like my ya ya thin 
I like to push it down 
Into the land of sin 
I\'m a sinpusher, hangin\' on the on the dldown low 
Im a sinpusher, kinda like heaven or hell


  ",,,,Sabe de quem é a composição? Envie pra gente.
"
        Sixteen Tons (feat. Jeff Beck)
        
    
 
Well some people say a man is made outta mud 
A poor man's made outta muscle and blood
Muscle and blood and skin and bone 
A mind that's weak and back that's strong

        Sixteen Tons (feat. Jeff Beck)
        
    
 
I load sixteen tons what do you get 
Another day older and deeper in debt 
Saint Peter don't you call me cause I can't go
I owe my soul to the company store

        Sixteen Tons (feat. Jeff Beck)
        
    
 
I said people say the man is made outta mud 
A poor man's made outta muscle and blood
Muscle and blood and skin and bone 
A mind that's weak and back that's strong

        Sixteen Tons (feat. Jeff Beck)
        
    
 
I load sixteen tons what do you get 
Another day older and deeper in debt 
Saint Peter, don't you call me cause I can't go
I owe my soul to the company storе


  ",,,,Sabe de quem é a composição? Envie pra gente.
"
        Sleeping Bag
        
    
 
When it's cold outside and you want to sleep in,
Go for a pallet that's nice and thin.
Zip it on around while it's on the ground,
Spread it out and lay it on down. 
Slip inside my sleeping bag, 
Slip inside my sleeping bag.

        Sleeping Bag
        
    
 
You're afraid of the dark, baby, don't be shy.
We'll talk about some lovin' while we look at the sky.
Don't be hesitating, it'll be alright,
We'll tuck it in until it's clean out of sight.
Slip inside my sleeping bag, 
Slip inside my sleeping bag.

        Sleeping Bag
        
    
 
Let's go out to egypt cause it's in the plan,
Sleep beside the pharoahs in the shifting sand. 
We'll look at some pyramids and check out some heads.
Oh, we'll whip out our mattress cause there ain't no beds.
Slip inside my sleeping bag, 
Slip inside my sleeping bag.


  Essa informação está errada? Nos avise. ",,,,Composição: Billy Gibbons / Dusty Hill / Frank Beard. 
"
        Snappy Kakkie
        
    
 
I say Hey! Snappy Kakkie! 
Do you wanna play? 
I say Hey! Snappy Kakkie! 
I said whatcha' say!
The water she is nice we can steal away 
They'll never know we're gone til the break o day
Come on! Come on! 
I say Hey Snappy Kakkie 
Did they talk to you today? 
I say Hey Snappy Kakkie 
Did you see it their way? 
The moon she is high, we must leave tonite 
We must get away, we will join the fight 
Come on! Come on! 
I say Hey Snappy Kakkie! 
Did our brothers stay 
I say Hey Snappy Kakkie 
Will our sisters pay 
Does it really matter of the friends we lost 
It doesn't really matter cause their souls were lost
Come on! Come on! 
I say Hey! Snappy Kakkie! 
Do you wanna play? 
I say Hey! Snappy Kakkie! 
I say Hey! watcha' say!
The water she is nice we can steal away 
They'll never know we're gone til the break o day
So come on!


  Essa informação está errada? Nos avise. ",,,,Composição: Billy Gibbons / Dusty Hill / Frank Beard. 
"
        (Somebody Else Been) Shakin' Your Tree
        
    
 
Well, I'm tryin  yes I'm tryin just to get a line on you
Where you been? 
But I'm havin' trouble puttin' a find on you
I'm wearin' thin
Somebody else been shaking your tree 
Supposed to saving all that stuff for me

        (Somebody Else Been) Shakin' Your Tree
        
    
 
You been hidin  yes, your're hidin  you been stayin' out on me
Sneakin' round
Me and you ain't workin' out just like we oughta be
You've got me down
Somebody else been shaking your tree 
Supposed to be saving all that stuff for me

        (Somebody Else Been) Shakin' Your Tree
        
    
 
I'm tired of foolin' around with you, and sittin' here alone
It's on my mind
I think it's time for me to find a new tree of my own
It's plantin' time
Anything you wanna do is cool with me 
I don't care who shakes your tree


  Essa informação está errada? Nos avise. ",,,,Composição: Billy Gibbons. 
